iteration	status	dev_rmse	val_rmse	dev_clean	dev_low	dev_medium	dev_high	dev_stripe	dev_gradient	val_clean	val_low	val_medium	val_high	val_stripe	val_gradient	runtime_s	memory_mb	description
113	discard	17.655119		10.034134	12.323683	25.542158	38.636373	10.1717	9.222664							1.295	96.9	Estimate final Tukey residual location from 48 core neighbors while retaining the 64-neighbor scale estimate
114	discard	17.682077		10.078597	12.349273	25.559406	38.606933	10.210739	9.287514							1.274	110.2	Estimate final Tukey residual scale from 48 core neighbors while retaining the 64-neighbor location estimate
115	discard	17.946627		10.158926	12.341728	25.960423	39.552108	10.289362	9.377216							1.359	113.4	Use corrected tangent-plane distance for the final robust PCA spatial kernel
116	provisional	17.632223		10.006906	12.320135	25.51372	38.580006	10.160369	9.212199							1.179	96.8	Estimate final Tukey residual location and scale from a 32-neighbor core while retaining 128-neighbor covariance support
117	discard	17.665592		10.08225	12.378927	25.436751	38.503899	10.280295	9.311431							1.18	96.8	Estimate final Tukey residual location and scale from a 16-neighbor core while retaining 128-neighbor covariance support
118	discard	17.636826		10.019189	12.32927	25.492371	38.562761	10.200247	9.217122							1.184	96.8	Estimate final Tukey residual location and scale from a 24-neighbor core while retaining 128-neighbor covariance support
119	discard	17.630768		10.01001	12.322222	25.498976	38.574932	10.16926	9.209209							1.239	104.8	Estimate final Tukey residual location and scale from a 28-neighbor core while retaining 128-neighbor covariance support
120	discard	17.630704		9.995951	12.317519	25.50346	38.578953	10.172756	9.215586							1.226	96.5	Estimate final Tukey residual location and scale from a 30-neighbor core while retaining 128-neighbor covariance support
121	discard	17.624252		9.989918	12.305567	25.52541	38.615501	10.132656	9.176462							1.216	96.9	Estimate final Tukey residual location from 32 neighbors and scale from 48 neighbors
122	discard	17.623986		9.986181	12.315103	25.506878	38.5902	10.156624	9.188931							1.184	96.9	Estimate final Tukey residual location from 24 neighbors while retaining the 32-neighbor scale estimate
123	discard	17.642633		10.034785	12.326747	25.498522	38.560578	10.191265	9.243899							1.179	99.4	Estimate final Tukey residual location from 32 neighbors and scale from 24 neighbors
124	keep	17.539547	14.705215	9.943366	12.306801	25.369013	38.305784	10.141378	9.170939	11.269413	11.943246	18.061025	25.369274	11.675323	9.913007	1.09	97.3	Estimate first-pass Tukey residual location and scale from a 64-neighbor core while retaining 112-neighbor covariance support
125	provisional	17.436335		9.954249	12.303457	25.105294	37.97461	10.158053	9.122348							1.046	97.2	Reduce the first-pass Tukey residual-statistic core from 64 to 32 neighbors while retaining 112-neighbor covariance support
126	discard	17.418577		10.038919	12.376409	24.905778	37.717041	10.323163	9.150153							1.048	98.4	Reduce the first-pass Tukey residual-statistic core from 32 to 16 neighbors while retaining 112-neighbor covariance support
127	discard	17.414162		9.952916	12.302869	25.037021	37.880927	10.222239	9.088996							1.069	97.1	Reduce the first-pass Tukey residual-statistic core from 32 to 24 neighbors while retaining 112-neighbor covariance support
128	discard	17.434364		9.952666	12.318781	25.076324	37.931285	10.220258	9.10687							1.015	108.1	Reduce the first-pass Tukey residual-statistic core from 32 to 28 neighbors while retaining 112-neighbor covariance support
129	discard	17.418637		9.974961	12.319211	25.029658	37.872591	10.212551	9.10285							1.016	110.2	Estimate first-pass Tukey residual location from 32 neighbors and scale from 24 neighbors
130	discard	17.43673		9.924518	12.284133	25.121767	37.994705	10.194405	9.100855							1.03	97.4	Estimate first-pass Tukey residual location from 24 neighbors while retaining the 32-neighbor scale estimate
131	discard	17.491657		9.934525	12.297491	25.264723	38.188663	10.125171	9.139371							1.046	106.3	Estimate first-pass Tukey residual location from 32 neighbors and scale from 48 neighbors
132	discard	17.498365		9.931402	12.318281	25.272458	38.168886	10.139654	9.159513							1.075	110.2	Increase the first-pass Tukey residual-statistic core from 32 to 48 neighbors
133	discard	17.466807		9.938177	12.302361	25.198058	38.066058	10.151618	9.144571							1.081	106.3	Use a 40-neighbor first-pass Tukey residual-statistic core
134	discard	17.450218		9.942597	12.311882	25.145606	38.025743	10.137626	9.137853							1.045	106.4	Use a 36-neighbor first-pass Tukey residual-statistic core
135	discard	17.436335		9.954249	12.303457	25.105294	37.97461	10.158053	9.122348							1.03	110.5	Use a 34-neighbor first-pass Tukey residual-statistic core
136	discard	17.446882		9.937981	12.320649	25.145248	38.012102	10.131798	9.133515							1.026	97.6	Use a 35-neighbor first-pass Tukey residual-statistic core
137	discard	17.380046	14.720481	10.005305	12.32013	24.855877	37.696339	10.254714	9.147907	11.327525	12.021307	18.093408	25.124586	11.766349	9.989708	1.043	89.5	Extend only the first Tukey-PCA refinement from 112 to 128 neighbors
138	provisional	17.484047		9.984158	12.305652	25.176383	38.066638	10.174459	9.19699							1.1	101.3	Extend only the first Tukey-PCA refinement from 112 to 120 neighbors
139	discard	17.463383		9.99789	12.314713	25.090568	37.974565	10.198356	9.204206							1.177	98.3	Extend only the first Tukey-PCA refinement from 120 to 124 neighbors
140	discard	17.471592		9.991111	12.313176	25.136895	38.015364	10.183323	9.189683							1.131	98.2	Extend only the first Tukey-PCA refinement from 120 to 122 neighbors
141	discard	17.479004		9.984427	12.306497	25.161144	38.047705	10.181357	9.192894							1.106	98.1	Extend only the first Tukey-PCA refinement from 120 to 121 neighbors
142	discard	17.483155		9.968132	12.3005	25.195767	38.093891	10.158485	9.182156							1.115	98.1	Narrow only the 120-neighbor first-refinement Gaussian bandwidth from the 112th- to the 108th-neighbor radius
143	discard	17.483927		9.977965	12.301422	25.186524	38.079645	10.166403	9.191604							1.126	98.0	Narrow only the 120-neighbor first-refinement Gaussian bandwidth from the 112th- to the 110th-neighbor radius
144	discard	17.48524		9.995729	12.310273	25.157094	38.043295	10.193639	9.211409							1.137	98.1	Widen only the 120-neighbor first-refinement Gaussian bandwidth from the 112th- to the 116th-neighbor radius
145	discard	17.484838		9.991327	12.307638	25.166404	38.054143	10.185261	9.204257							1.126	114.2	Widen only the 120-neighbor first-refinement Gaussian bandwidth from the 112th- to the 114th-neighbor radius
146	discard	17.484047		9.984158	12.305652	25.176383	38.066638	10.174459	9.19699							1.161	98.1	Reduce only the first Tukey-PCA refinement from 120 to 116 neighbors
147	discard	17.517281		9.945172	12.30173	25.306075	38.228165	10.136687	9.185858							1.122	97.6	Reduce only the first Tukey-PCA refinement from 120 to 114 neighbors
148	discard	17.512371		9.955453	12.302356	25.28461	38.200981	10.144372	9.186454							1.143	111.6	Reduce only the first Tukey-PCA refinement from 120 to 115 neighbors
149	discard	17.472633		10.041932	12.322607	25.107609	37.929942	10.208134	9.225574							1.138	102.1	Widen only the 224-neighbor provisional-PCA Gaussian bandwidth from the 112th- to the 120th-neighbor radius
150	discard	17.480103		9.962477	12.248027	25.198091	38.152869	10.149002	9.170153							1.132	102.0	Narrow only the 224-neighbor provisional-PCA Gaussian bandwidth from the 112th- to the 108th-neighbor radius
151	discard	17.484743		9.972442	12.301318	25.183145	38.112801	10.156122	9.182628							1.14	102.1	Narrow only the 224-neighbor provisional-PCA Gaussian bandwidth from the 112th- to the 110th-neighbor radius
152	discard	17.476743		10.014923	12.313299	25.133052	37.988683	10.19612	9.214383							1.159	120.9	Widen only the 224-neighbor provisional-PCA Gaussian bandwidth from the 112th- to the 116th-neighbor radius
153	discard	17.480433		9.995356	12.311246	25.154916	38.02839	10.185405	9.207284							1.176	101.9	Widen only the 224-neighbor provisional-PCA Gaussian bandwidth from the 112th- to the 114th-neighbor radius
154	discard	17.400428	14.713823	9.991032	12.310277	24.982947	37.79837	10.188526	9.131416	11.298549	11.983202	18.101017	25.201406	11.73075	9.96801	1.045	98.0	Reduce the first-pass Tukey residual-statistic core from 64 to 32 neighbors while retaining 120-neighbor covariance support
155	discard	17.518309		9.936921	12.309332	25.324364	38.238935	10.133955	9.166347							1.06	97.3	Reduce the first-pass Tukey residual-statistic core from 64 to 56 neighbors
156	discard	17.526526		9.942712	12.308667	25.325584	38.274589	10.144124	9.163479							1.1	97.4	Reduce the first-pass Tukey residual-statistic core from 64 to 60 neighbors
157	discard	17.534231		9.94218	12.305326	25.356707	38.297952	10.142469	9.160753							1.093	97.4	Reduce the first-pass Tukey residual-statistic core from 64 to 62 neighbors
158	discard	17.536265		9.943147	12.305659	25.362203	38.297981	10.145909	9.162691							1.119	100.1	Reduce the first-pass Tukey residual-statistic core from 64 to 63 neighbors
159	provisional	17.48463		9.939875	12.314534	25.23191	38.116983	10.136372	9.168108							1.117	97.2	Tighten only the first Tukey-biweight cutoff from 4.62 to 4.15 weighted-MAD sigmas
160	discard	17.460977		9.941373	12.323652	25.168899	38.023591	10.139019	9.16933							1.132	110.4	Tighten only the first Tukey-biweight cutoff from 4.15 to 3.92 weighted-MAD sigmas
161	discard	17.473028		9.940567	12.318809	25.201736	38.072035	10.136964	9.168055							1.088	97.3	Tighten only the first Tukey-biweight cutoff from 4.15 to 4.04 weighted-MAD sigmas
162	discard	17.479341		9.940307	12.316555	25.218091	38.096521	10.136507	9.168064							1.075	110.4	Tighten only the first Tukey-biweight cutoff from 4.15 to 4.10 weighted-MAD sigmas
163	discard	17.510985		9.939923	12.309598	25.297863	38.211012	10.138643	9.16887							1.091	97.4	Relax only the first Tukey-biweight cutoff from 4.15 to 4.38 weighted-MAD sigmas
164	discard	17.486139		9.944668	12.322588	25.227325	38.102536	10.143013	9.176706							1.088	97.4	Tighten only the final Tukey-biweight cutoff from 2.77 to 2.65 weighted-MAD sigmas
165	discard	17.44921		9.534876	12.210526	25.688154	38.589256	9.857063	8.815386							1.343	106.5	Add a third Tukey-biweight refinement on the retained 128-neighbor final patch
166	keep	17.32966	14.510292	9.605558	12.26303	25.234757	38.117551	9.888752	8.868309	10.93522	11.683143	18.080307	25.312434	11.442436	9.60821	1.367	97.5	Accept a third Tukey refinement only on geometrically thin local sheets
167	discard	17.316307		9.568144	12.254761	25.241576	38.120566	9.872762	8.840031							1.326	97.5	Relax the third-refinement sheet-thickness gate from 0.10 to 0.125 local radii
168	crash																	Require angular stability before accepting the gated third Tukey refinement
169	discard	17.372323		9.701357	12.274935	25.234757	38.117551	9.947189	8.958146							1.313	113.7	Require five-degree angular stability before accepting the gated third Tukey refinement
170	discard	17.468493		9.908448	12.309209	25.231944	38.116983	10.107333	9.137041							1.326	97.5	Require sufficient effective sample support before accepting the gated third Tukey refinement
171	discard	17.330179		9.605267	12.262612	25.234791	38.117798	9.89015	8.870455							1.33	97.6	Require a modest 32-sample effective support before accepting the thin-sheet third Tukey refinement
172	discard	17.402337		9.758511	12.301859	25.232165	38.117027	9.998885	9.005575							1.323	113.7	Replace hard third-refinement acceptance with a residual-thickness confidence blend
173	discard	17.326664		9.603879	12.24604	25.235065	38.117422	9.890887	8.866692							1.371	100.8	Relax only the gated third Tukey-biweight cutoff from 2.77 to 3.23 weighted-MAD sigmas
174	discard	17.337933		9.618338	12.283833	25.234492	38.117446	9.893257	8.880232							1.325	113.5	Tighten only the thin-sheet third Tukey cutoff from 2.77 to 2.31 weighted-MAD sigmas
175	discard	17.357907		9.65943	12.295685	25.231883	38.116955	9.914398	8.929092							1.321	103.6	Tighten the third-refinement sheet-thickness gate from 0.10 to 0.075 local radii
176	discard	17.315233		9.551232	12.224061	25.257705	38.131877	9.881528	8.844993							1.317	102.0	Relax the third-refinement sheet-thickness gate from 0.10 to 0.15 local radii
177	discard	17.353052		9.649153	12.264514	25.234195	38.117551	9.93056	8.922338							1.342	113.7	Require local residual thickness to contract from the broad PCA thickness before accepting the third Tukey refinement
178	discard	17.34545		9.640577	12.277961	25.232461	38.11733	9.902286	8.902085							1.41	105.6	Require the third Tukey refinement to reduce query-local robust residual thickness
179	discard	17.324384		9.594334	12.266139	25.235171	38.117514	9.876608	8.856538							1.314	97.4	Reduce only the gated third Tukey refinement from 128 to 112 neighbors
180	discard	17.327358		9.600688	12.264057	25.234886	38.117513	9.883767	8.863238							1.352	105.5	Reduce only the gated third Tukey refinement from 128 to 120 neighbors
181	discard	17.328536		9.602846	12.263314	25.23485	38.117481	9.886134	8.866591							1.326	113.3	Reduce only the gated third Tukey refinement from 128 to 124 neighbors
182	discard	17.329265		9.604741	12.263055	25.234837	38.117491	9.887678	8.867787							1.318	97.5	Reduce only the gated third Tukey refinement from 128 to 126 neighbors
183	crash																	Reduce only the gated third Tukey refinement from 128 to 127 neighbors
184	discard	17.329567		9.605331	12.263111	25.234796	38.117559	9.888212	8.868392							1.32	105.6	Reduce only the gated third Tukey refinement from 128 to 127 neighbors
185	discard	17.327463		9.599366	12.261783	25.234467	38.117465	9.88944	8.862256							1.352	105.8	Narrow only the gated third Tukey-refinement Gaussian bandwidth from the 112th- to the 108th-neighbor radius
186	discard	17.329164		9.602611	12.262517	25.234779	38.117558	9.891861	8.865658							1.357	97.5	Narrow only the gated third Tukey-refinement Gaussian bandwidth from the 112th- to the 110th-neighbor radius
187	discard	17.332846		9.61052	12.26566	25.234789	38.117544	9.895358	8.873206							1.381	98.0	Widen only the gated third Tukey-refinement Gaussian bandwidth from the 112th- to the 116th-neighbor radius
188	discard	17.32671		9.599492	12.262389	25.234808	38.117567	9.883025	8.862977							1.431	113.5	Narrow only the gated third Tukey covariance kernel while retaining the established residual-statistic kernel
189	discard	17.330437		9.605445	12.262445	25.234419	38.11745	9.895384	8.867477							1.372	113.7	Narrow only the gated third Tukey residual-statistic kernel from the 112th- to the 108th-neighbor radius
190	discard	17.330623		9.605482	12.262717	25.234749	38.117551	9.894948	8.86829							1.362	113.7	Narrow only the gated third-pass residual-statistic bandwidth from neighbor 112 to neighbor 110
191	discard	17.330027		9.605104	12.265362	25.234824	38.117559	9.8892	8.868113							1.331	106.6	Widen only the gated third-pass residual-statistic bandwidth from neighbor 112 to neighbor 116
192	discard	17.32966		9.605558	12.26303	25.234757	38.117551	9.888752	8.868309							1.265	110.5	Compute the gated third Tukey refinement only for patches that pass the retained thin-sheet test
193	crash																	Normalize the gated third Tukey refinement by robust in-plane patch scale
194	discard	17.356628		9.656448	12.288524	25.232068	38.117025	9.933014	8.912691							1.348	100.9	Normalize the gated third Tukey refinement by robust in-plane patch scale
195	discard	17.325779		9.594492	12.248458	25.236975	38.117798	9.884607	8.872345							1.345	97.6	Gate the third Tukey refinement at a 0.20 robust thickness-to-tangent-spread ratio
196	crash																	Gate the third Tukey refinement at a 0.175 robust thickness-to-tangent-spread ratio
197	discard	17.337499		9.611425	12.27313	25.234074	38.117365	9.908857	8.880141							1.323	97.7	Gate the third Tukey refinement at a 0.175 robust thickness-to-tangent-spread ratio
198	discard	17.323682		9.592174	12.256061	25.23867	38.122098	9.873059	8.860028							1.351	106.7	Normalize the third-refinement thickness gate by the 32-neighbor robust-statistic core radius
199	discard	17.331321		9.606043	12.25966	25.23502	38.118951	9.893748	8.874505							1.325	111.5	Normalize the third-refinement thickness gate by the robust core's weighted tangent RMS spread
200	discard	17.343974		9.629928	12.26303	25.234757	38.117551	9.918406	8.900174							1.344	113.5	Reject the thin-sheet third Tukey refinement when the preceding robust step collapses residual scale by more than half
201	discard	17.357823		9.704113	12.261015	25.232777	38.117315	9.918362	8.913355							1.329	97.6	Require the gated third Tukey refinement to retain at least half of its Gaussian spatial weight mass
202	discard	17.32966		9.605558	12.26303	25.234757	38.117551	9.888752	8.868309							1.336	113.5	Require the thin-sheet third Tukey refinement to retain at least one quarter of its Gaussian spatial weight mass
203	discard	17.329801		9.605721	12.26303	25.234751	38.117551	9.888205	8.869547							1.323	97.5	Require the thin-sheet third Tukey refinement to retain at least three eighths of its Gaussian spatial weight mass
204	discard	17.333353		9.613195	12.263601	25.233431	38.117593	9.893689	8.878611							1.307	103.8	Require the thin-sheet third Tukey refinement to retain at least seven sixteenths of its Gaussian spatial weight mass
205	discard	17.343442		9.650989	12.261357	25.232841	38.117279	9.904003	8.894185							1.344	113.5	Require the thin-sheet third Tukey refinement to retain at least fifteen thirty-seconds of its Gaussian spatial weight mass
206	discard	17.347649		9.669655	12.260248	25.232784	38.117281	9.90829	8.897635							1.349	97.5	Require the thin-sheet third Tukey refinement to retain at least 31/64 of its Gaussian spatial weight mass
207	discard	17.374089		9.701372	12.270989	25.233929	38.11707	9.943041	8.978133							1.317	97.3	Use bounded-influence Cauchy weighting instead of redescending Tukey rejection only in the gated third refinement
208	discard	17.41		9.803496	12.289243	25.234063	38.11777	9.994442	9.020988							1.32	102.8	Mix 5% unrejected Gaussian support into only the gated third Tukey refinement
209	discard	17.326065		9.603603	12.241612	25.235232	38.117592	9.892427	8.865926							1.321	104.8	Use a linear compact-support residual taper only in the gated third robust refinement
210	discard	17.327167		9.602606	12.25325	25.234946	38.117585	9.889049	8.865566							1.368	96.5	Use a three-halves compact-support residual taper only in the gated third robust refinement
211	discard	17.32831		9.603769	12.258362	25.234844	38.117569	9.88864	8.866678							1.38	113.7	Use a seven-fourths compact-support residual taper only in the gated third robust refinement
212	discard	17.328965		9.6046	12.260749	25.234799	38.11756	9.888641	8.86744							1.481	97.4	Use a fifteen-eighths compact-support residual taper only in the gated third robust refinement
213	discard	17.329308		9.605065	12.261903	25.234778	38.117555	9.888684	8.867862							1.37	113.6	Use a 31/16 compact-support residual taper only in the gated third robust refinement
214	discard	17.329483		9.605308	12.26247	25.234768	38.117553	9.888715	8.868083							1.334	97.5	Use a 63/32 compact-support residual taper only in the gated third robust refinement
215	discard	17.329571		9.605432	12.262751	25.234762	38.117552	9.888733	8.868195							1.367	113.7	Use a 127/64 compact-support residual taper only in the gated third robust refinement
216	discard	17.329615		9.605495	12.262891	25.23476	38.117551	9.888742	8.868252							1.339	105.5	Use a 255/128 compact-support residual taper only in the gated third robust refinement
217	discard	17.336571		9.540666	12.214118	25.364019	38.220553	9.861487	8.818585							1.348	97.5	Relax the third-refinement sheet-thickness gate from 0.10 to 0.20 local radii
218	discard	17.320524		9.544197	12.220812	25.299309	38.160144	9.871132	8.827551							1.394	113.6	Relax the third-refinement sheet-thickness gate from 0.10 to 0.175 local radii
219	discard	17.314503		9.546256	12.213609	25.276449	38.144447	9.879537	8.826722							1.324	98.5	Relax the third-refinement sheet-thickness gate from 0.10 to 0.1625 local radii
220	discard	17.315961		9.54679	12.224038	25.270908	38.136818	9.884725	8.832485							1.336	109.3	Relax the third-refinement sheet-thickness gate from 0.10 to 0.15625 local radii
221	discard	17.317878		9.544197	12.222224	25.284826	38.15634	9.872957	8.826722							1.349	97.4	Relax the third-refinement sheet-thickness gate from 0.10 to 0.16875 local radii
222	discard	17.317114		9.54656	12.221437	25.279114	38.150573	9.87828	8.826722							1.351	113.5	Relax the third-refinement sheet-thickness gate from 0.10 to 0.165625 local radii
223	discard	17.315156		9.5464	12.217109	25.273021	38.140074	9.883626	8.830707							1.349	97.5	Relax the third-refinement sheet-thickness gate from 0.10 to 0.159375 local radii
224	discard	17.315522		9.546256	12.218626	25.274106	38.140563	9.883614	8.829967							1.384	97.4	Relax the third-refinement sheet-thickness gate from 0.10 to 0.1609375 local radii
225	discard	17.344199		9.640021	12.275525	25.233398	38.11711	9.906791	8.892348							1.387	113.6	Tighten the third-refinement sheet-thickness gate from 0.10 to 0.0875 local radii
226	discard	17.337041		9.622879	12.267609	25.233492	38.117261	9.893317	8.887686							1.363	105.5	Tighten the third-refinement sheet-thickness gate from 0.10 to 0.09375 local radii
227	discard	17.335149		9.617092	12.269493	25.233702	38.117547	9.892052	8.881011							1.369	113.6	Tighten the third-refinement sheet-thickness gate from 0.10 to 0.096875 local radii
