iteration	status	dev_rmse	val_rmse	dev_clean	dev_low	dev_medium	dev_high	dev_stripe	dev_gradient	val_clean	val_low	val_medium	val_high	val_stripe	val_gradient	runtime_s	memory_mb	description
0	keep	19.189958	16.316211	12.51424	13.654685	25.827248	39.456737	12.406353	11.280486	14.0578	14.324811	18.203646	25.289574	13.950822	12.070614	0.496	61.4	fixed k=112 PCA
1	keep	18.881278	15.673184	11.467993	12.930186	26.728685	40.538226	11.246736	10.375841	12.928023	13.251048	18.02386	25.797207	12.856646	11.182321	0.467	65.3	Gaussian distance-weighted PCA over the existing 112-neighbor patch
2	crash																	Per-query surface-variation selection among 32-, 64-, and 112-neighbor Gaussian-weighted PCA fits (failed: CalledProcessError)
3	discard	18.980142		12.010469	13.301114	26.104124	39.749797	11.880433	10.834917							0.499	65.3	Reduce the Gaussian PCA distance-decay coefficient from 2.0 to 1.0
4	crash																	Gaussian-weighted quadratic jet refinement in the local PCA frame (failed: CalledProcessError)
5	discard	19.010716		10.961	12.592576	27.846634	41.975914	10.713788	9.974382							0.489	66.0	Increase the Gaussian PCA distance-decay coefficient from 2.0 to 3.0
6	discard	18.659968	16.256665	12.560939	13.695058	24.30852	37.592444	12.542513	11.260333	14.185551	14.436622	18.134133	24.376034	14.191721	12.215929	0.511	77.1	Increase the Gaussian-weighted PCA neighborhood from 112 to 160 neighbors
7	provisional	18.735248		13.733729	14.645704	23.192077	35.017165	13.529916	12.292894							0.581	77.5	Increase the Gaussian-weighted PCA neighborhood from 112 to 224 neighbors
8	discard	19.589027		10.672644	12.370827	30.331627	44.197667	10.298139	9.663262							0.457	65.4	Reduce the Gaussian-weighted PCA neighborhood from 224 to 80 neighbors
9	discard	18.367378	16.817228	12.989264	14.565899	23.192077	35.017165	12.763239	11.676621	15.116433	15.603469	18.552867	23.880496	15.001139	12.748963	0.678	71.3	Select between 80- and 224-neighbor Gaussian PCA using small-scale surface variation
10	keep	18.672701	15.375965	10.973759	12.676787	26.935962	40.673865	10.81413	9.961702	12.385435	12.797494	17.99356	25.888841	12.414488	10.775975	0.682	78.4	One-step Cauchy residual reweighting of the retained 112-neighbor Gaussian PCA
11	discard	18.638573		10.88909	12.636968	26.979219	40.698092	10.740032	9.888034							0.658	70.2	Reduce the one-step Cauchy residual cutoff from 2.5 to 2.0 sigma
12	discard	18.702036		11.046121	12.7121	26.900192	40.652488	10.877286	10.024027							0.664	77.2	Increase the one-step Cauchy residual cutoff from 2.5 to 3.0 sigma
13	discard	18.37989	15.914907	11.970245	13.291809	24.400275	37.682085	12.096309	10.838616	13.60451	13.926909	18.057591	24.4021	13.728805	11.76953	0.768	78.0	Increase the retained robust Gaussian-PCA neighborhood from 112 to 160 neighbors
14	discard	18.69935		11.01092	12.702438	26.949367	40.661211	10.861906	10.010255							0.726	70.2	Center Cauchy reweighting on the median signed plane residual
15	keep	18.609693	15.275942	10.80331	12.5931	27.036479	40.738023	10.672651	9.814593	12.199279	12.647664	17.985286	25.932021	12.258449	10.632953	0.826	72.8	Add a second Cauchy residual-reweighting step to the retained robust Gaussian PCA
16	discard	18.589854		10.732106	12.574338	27.090524	40.771083	10.617084	9.753986							1.021	72.9	Increase Cauchy residual reweighting from two to three IRLS steps
17	crash																	Freeze the Cauchy residual scale from the initial Gaussian-PCA fit across both IRLS steps
18	discard	18.631545		10.847126	12.60805	27.03352	40.737056	10.708061	9.855456							0.756	83.2	Hold the initial MAD residual scale fixed during both Cauchy plane refinements
19	crash																	Gate the second Cauchy refinement by initial PCA surface variation
20	discard	18.667599		10.96254	12.676863	26.935962	40.673865	10.80526	9.951107							0.831	81.6	Use initial surface variation to conditionally accept the second Cauchy IRLS refinement
21	discard	18.642562		10.892238	12.638587	26.982398	40.705526	10.747048	9.889577							0.828	78.3	Relax the Cauchy cutoff from 2.5 to 3.0 sigma only during the second IRLS refinement
22	discard	18.573155		10.699968	12.544213	27.103405	40.778162	10.586136	9.727048							0.848	73.0	Tighten the Cauchy cutoff from 2.5 to 2.0 sigma only during the second IRLS refinement
23	discard	18.790807		11.294515	12.848593	26.726016	40.535182	11.098462	10.242076							0.894	80.1	Replace Cauchy residual weights with Huber weights in both robust PCA refinements
24	discard	21.199881		11.924836	13.438769	31.857784	47.228304	11.92181	10.827785							0.909	78.0	Use provisional tangent-plane distance in the Gaussian kernel for both robust PCA refinements
25	discard	17.869984	15.711446	11.599311	13.15205	23.769633	36.464585	11.661852	10.57247	13.272627	13.683379	18.103797	24.177355	13.484999	11.546519	1.227	101.1	Extend robust Gaussian-PCA support to 224 neighbors while retaining the 112th-neighbor kernel bandwidth
26	discard	18.157194	15.468579	11.264631	12.840361	24.8014	38.340467	11.363323	10.332984	12.80705	13.227472	17.975308	24.669421	12.98709	11.145133	1.018	78.3	Use a 160-neighbor Gaussian tail while retaining the 112th-neighbor kernel bandwidth
27	discard	23.827748		12.603854	15.325856	39.859284	51.854093	12.313313	11.010086							0.811	74.0	Anchor each robust Gaussian-PCA plane at the query instead of the weighted neighborhood centroid
28	discard	18.584173		10.807809	12.598524	26.941128	40.675399	10.672978	9.809197							0.877	73.1	Gate the second Cauchy refinement by the initial normal eigengap
29	discard	18.423357	15.273004	10.878196	12.590974	26.306482	39.950378	10.893602	9.920511	12.271997	12.701398	17.974945	25.663654	12.349972	10.676056	0.959	78.5	Initialize local robust PCA from a 160-neighbor Gaussian tail, then retain 112-neighbor IRLS refinements
30	discard	18.584703		10.731517	12.559153	27.085076	40.766441	10.612164	9.75387							0.837	73.0	Use a decreasing 3.0-to-2.0 sigma Cauchy cutoff schedule across the two robust PCA refinements
31	provisional	18.534534		10.586437	12.497821	27.179849	40.823407	10.490951	9.628741							0.846	81.9	Tighten only the second Cauchy refinement cutoff from 2.5 to 1.5 sigma
32	discard	18.500528		10.487469	12.467782	27.246354	40.859829	10.404918	9.536815							0.879	73.0	Tighten only the second Cauchy refinement cutoff from 1.5 to 1.0 sigma
33	discard	18.495918		10.481589	12.492625	27.236342	40.84881	10.3924	9.523742							0.855	74.8	Tighten only the second Cauchy refinement cutoff from 1.5 to 0.5 sigma
34	discard	18.519192		10.543973	12.477568	27.20702	40.840533	10.456628	9.589434							0.887	81.6	Tighten the first Cauchy refinement cutoff from 2.5 to 2.0 sigma while retaining the 1.5-sigma second cutoff
35	discard	18.501064		10.4974	12.455882	27.234001	40.85637	10.417071	9.545659							0.877	73.0	Tighten the first Cauchy refinement cutoff from 2.5 to 1.5 sigma to match the retained second cutoff
36	discard	18.530493		10.633503	12.525278	27.078297	40.758444	10.526422	9.661015							0.831	80.9	Smoothly relax the second Cauchy cutoff using initial normal eigengap ambiguity
37	keep	18.117488	15.142221	10.680058	12.560788	25.889379	39.084313	10.674182	9.816209	12.053857	12.551116	18.007935	25.499444	12.213512	10.527459	0.988	78.7	Initialize robust local PCA from a 224-neighbor Gaussian tail, then refine on 112 neighbors
38	discard	18.093078		10.640583	12.537831	25.875139	39.084259	10.641535	9.779122							1.002	85.9	Recenter the broad provisional normal on the local 112-neighbor Gaussian centroid before robust refinement
39	discard	18.230178		10.559616	12.438349	26.372184	39.92467	10.462653	9.623597							1.001	85.6	Tighten only the 224-neighbor initialization kernel from Gaussian decay 2.0 to 3.0
40	crash																	Relax only the 224-neighbor initialization kernel from Gaussian decay 2.0 to 1.0
41	discard	18.095621		10.878451	12.657387	25.698507	38.548242	10.845916	9.945224							1.044	93.2	Relax only the 224-neighbor initialization kernel from Gaussian decay 2.0 to 1.0
42	discard	18.285766		10.345726	12.269917	27.026494	40.416996	10.183702	9.471758							1.003	81.2	Reduce the robust refinement neighborhood and Gaussian bandwidth anchor from 112 to 96 neighbors
43	discard	18.175115		10.602814	12.494226	26.232815	39.44853	10.542406	9.7299							1.034	88.6	Use 96 neighbors only for the final Cauchy PCA refinement
44	keep	17.97892	15.090036	10.599116	12.546449	25.65961	38.712875	10.59565	9.759817	11.977157	12.496903	18.016659	25.430792	12.161079	10.457625	1.243	80.3	Use Gaussian-distance-weighted medians for residual location and MAD scale in both Cauchy refinements
45	discard	17.915474	15.040824	10.497519	12.503614	25.62137	38.688261	10.515491	9.66659	11.890774	12.427392	18.012721	25.43387	12.095971	10.384219	1.281	92.7	Center first-pass Cauchy residuals on their Gaussian-weighted median
46	discard	17.929403		10.513786	12.514622	25.643448	38.703039	10.520471	9.681051							1.265	81.1	Center second-pass Cauchy residuals on their Gaussian-weighted median
47	keep	17.889097	15.016975	10.449493	12.487665	25.615878	38.684347	10.470239	9.626961	11.848447	12.398743	18.011682	25.434062	12.058746	10.350167	1.311	92.6	Center both Cauchy refinement losses on the Gaussian-weighted residual median
48	discard	17.841476		10.283035	12.412846	25.764449	38.842135	10.274981	9.471408							1.285	83.4	Narrow only the robust-refinement Gaussian bandwidth from the 112th- to the 96th-neighbor radius while retaining 112-point support
49	discard	17.93498		10.57913	12.551377	25.522557	38.586119	10.615097	9.755598							1.299	97.6	Widen only the robust-refinement Gaussian bandwidth from the 112th- to the 128th-neighbor radius while retaining 112-point support
50	crash																	Add a Gaussian- and Cauchy-weighted quadratic jet refinement in the final robust PCA frame
51	discard	17.852589		10.418166	12.48803	25.571539	38.598388	10.442889	9.596524							1.284	80.5	Tighten the final Cauchy refinement cutoff from 1.5 to 1.25 weighted-MAD sigmas
52	discard	17.971906		10.464763	12.481274	25.806808	38.967342	10.484978	9.62627							1.276	82.2	Relax only the first Cauchy refinement cutoff from 2.5 to 3.0 weighted-MAD sigmas
53	provisional	17.834106		10.499058	12.52178	25.330333	38.42337	10.5457	9.684392							1.389	86.3	Extend only the final robust PCA refinement from 112 to 128 neighbors
54	provisional	17.763026		10.552872	12.566519	24.977546	38.078913	10.642151	9.760154							1.534	88.7	Extend only the final robust PCA refinement from 128 to 160 neighbors
55	discard	17.763026		10.552872	12.566519	24.977546	38.078913	10.642151	9.760154							1.48	88.8	Extend only the final robust PCA refinement from 160 to 224 neighbors
56	discard	17.786708		10.644638	12.615333	24.881245	37.981419	10.748038	9.849574							1.521	103.9	Widen only the 160-neighbor final-refinement Gaussian bandwidth from the 112th- to the 128th-neighbor radius
57	discard	17.775111		10.601423	12.590195	24.927366	38.026492	10.698553	9.806637							1.506	91.0	Widen only the final-refinement Gaussian bandwidth from the 112th- to the 120th-neighbor radius
58	crash																	Narrow only the 160-neighbor final-refinement Gaussian bandwidth from the 112th- to the 104th-neighbor radius
59	discard	17.749612		10.500074	12.536964	25.036248	38.134919	10.580574	9.708895							1.504	100.8	Narrow only the 160-neighbor final-refinement Gaussian bandwidth from the 112th- to the 104th-neighbor radius
60	discard	17.756779		10.527522	12.551952	25.00502	38.106349	10.614371	9.735457							1.49	93.9	Narrow only the 160-neighbor final-refinement Gaussian bandwidth from the 112th- to the 108th-neighbor radius
61	discard	17.733021		10.435808	12.504265	25.101665	38.200768	10.50575	9.64987							1.531	90.8	Narrow only the 160-neighbor final-refinement Gaussian bandwidth from the 112th- to the 96th-neighbor radius
62	discard	17.797892		10.534278	12.546346	25.132386	38.232688	10.606737	9.734917							1.462	105.4	Reduce only the final robust PCA refinement from 160 to 144 neighbors
63	discard	17.778734		10.544358	12.554361	25.052854	38.143808	10.627693	9.749329							1.45	88.1	Reduce only the final robust PCA refinement from 160 to 152 neighbors
64	discard	17.739042		10.509917	12.54531	24.984879	38.082702	10.596035	9.715409							1.328	86.7	Estimate the final-pass robust residual location and scale from the core 112-neighbor patch while retaining 160-neighbor covariance support
65	discard	17.749163		10.530223	12.553893	24.981453	38.081242	10.614554	9.733616							1.384	90.3	Estimate final-pass Cauchy location and scale from 128 core neighbors while retaining 160-neighbor covariance support
66	discard	17.725096		10.483577	12.531593	24.988161	38.086335	10.570923	9.689986							1.314	86.8	Estimate final-pass Cauchy location and scale from 96 core neighbors while retaining 160-neighbor covariance support
67	discard	17.707436	14.994009	10.445237	12.519083	24.991669	38.088594	10.542038	9.657993	11.938608	12.50067	17.960915	24.953256	12.191844	10.41876	1.274	101.9	Estimate final-pass Cauchy location and scale from 80 core neighbors while retaining 160-neighbor covariance support
68	crash																	Shrink the final robust local normal 10% toward the sign-aligned broad provisional PCA normal
69	discard	17.866365		10.594978	12.571559	25.335926	38.369328	10.593854	9.732546							1.256	80.5	Blend 10% of the sign-aligned 224-neighbor provisional PCA normal into the final local robust normal
70	discard	17.910922		10.395542	12.436614	25.917692	38.971585	10.237078	9.507024							1.326	85.5	Use an area-preserving anisotropic Gaussian kernel for both robust local PCA refinements
71	crash																	Apply the area-preserving anisotropic Gaussian kernel only in the final robust PCA refinement
72	discard	18.064942		10.71642	12.657567	25.64294	38.618279	10.897622	9.856824							1.302	88.8	Apply an area-preserving anisotropic Gaussian kernel only in the final robust PCA refinement
73	keep	17.812142	14.850593	10.180751	12.353957	25.816757	38.879045	10.266919	9.375423	11.506434	12.101423	18.030109	25.540189	11.826237	10.099166	1.272	80.5	Replace Cauchy residual weights with matched Tukey-biweight rejection in both robust PCA refinements
74	discard	17.775517		10.222437	12.391822	25.670918	38.68241	10.27843	9.407084							1.296	89.6	Use Cauchy reweighting for the first robust PCA correction and Tukey rejection only for the final refinement
75	discard	17.92221		10.209145	12.350696	26.050905	39.247777	10.285224	9.38951							1.325	80.5	Relax only the first Tukey-biweight cutoff from 4.62 to 5.54 weighted-MAD sigmas
76	discard	17.907287		10.292221	12.362321	25.867143	39.06351	10.364369	9.494161							1.277	90.7	Relax only the final Tukey-biweight cutoff from 2.77 to 3.69 weighted-MAD sigmas
77	discard	17.772818		10.178484	12.442841	25.719877	38.66435	10.272212	9.359145							1.3	80.2	Tighten only the final Tukey-biweight cutoff from 2.77 to 1.85 weighted-MAD sigmas
78	discard	17.781557		10.154571	12.384223	25.782301	38.780723	10.244994	9.342529							1.278	93.4	Tighten only the final Tukey-biweight cutoff from 2.77 to 2.31 weighted-MAD sigmas
79	provisional	17.690178		10.15021	12.371053	25.545813	38.459631	10.256811	9.357547							1.282	87.8	Tighten only the first Tukey-biweight cutoff from 4.62 to 3.69 weighted-MAD sigmas
80	discard	17.583765	14.805164	10.131525	12.409033	25.272498	38.058923	10.27749	9.353119	11.444318	12.072738	18.072169	25.291835	11.841974	10.107951	1.301	82.4	Tighten the first Tukey-biweight cutoff from 3.69 to 2.77 weighted-MAD sigmas
81	provisional	17.633485		10.136742	12.385217	25.41331	38.253681	10.261715	9.350243							1.311	86.9	Tighten only the first Tukey-biweight cutoff from 4.62 to 3.23 weighted-MAD sigmas
82	discard	17.607057		10.129682	12.394774	25.344132	38.154353	10.268652	9.350749							1.31	80.4	Tighten only the first Tukey-biweight cutoff from 3.23 to 3.0 weighted-MAD sigmas
83	discard	17.613678		10.120692	12.399753	25.386847	38.19077	10.250703	9.333302							1.263	94.1	Tighten only the final Tukey-biweight cutoff from 2.77 to 2.54 weighted-MAD sigmas
84	discard	17.618118		10.131935	12.38961	25.374245	38.198179	10.264812	9.34993							1.262	80.3	Tighten only the first Tukey-biweight cutoff from 3.23 to 3.1 weighted-MAD sigmas
85	discard	17.748073		10.094953	12.259032	25.695629	38.796594	10.303775	9.338456							1.245	80.2	Reduce broad Tukey-PCA initialization support from 224 to 192 neighbors
86	discard	17.697872		10.133013	12.329018	25.543351	38.538124	10.296892	9.346831							1.285	95.0	Reduce broad Tukey-PCA initialization support from 224 to 208 neighbors
87	discard	17.660994		10.130825	12.283759	25.490316	38.422844	10.297087	9.341133							1.275	88.4	Reduce broad Tukey-PCA initialization support from 224 to 216 neighbors
88	discard	17.645685		10.139013	12.377839	25.440447	38.305898	10.264706	9.346205							1.332	80.3	Reduce broad Tukey-PCA initialization support from 224 to 220 neighbors
89	discard	17.562944	14.80762	10.138451	12.425555	25.200844	37.964261	10.294649	9.353904	11.445114	12.090631	18.080996	25.253762	11.856735	10.118484	1.303	93.5	Tighten only the first Tukey-biweight cutoff from 3.23 to 2.54 weighted-MAD sigmas
90	discard	17.799541		10.194984	12.2736	25.840057	38.844538	10.26163	9.38244							1.275	81.0	Leave the query sample out of the broad and robust weighted PCA covariances
91	discard	17.810594		10.193182	12.325853	25.837274	38.866069	10.263871	9.377314							1.28	81.0	Give the query sample half Gaussian weight in all three weighted PCA fits
92	discard	17.798905		10.180491	12.292817	25.829005	38.865705	10.257234	9.36818							1.278	82.0	Leave the query sample out of only the broad provisional PCA initialization
93	discard	17.815099		10.19559	12.352952	25.806644	38.862509	10.277076	9.395821							1.282	87.1	Leave the query sample out of only the final Tukey-PCA refinement
94	discard	17.81062		10.181624	12.335204	25.843066	38.877889	10.258664	9.367271							1.322	81.5	Leave the query sample out of only the first local Tukey-PCA refinement
95	discard	17.916047		10.150487	12.259961	26.025987	39.37321	10.308456	9.378182							1.279	80.8	Use a rank-Gaussian kernel only for the broad provisional PCA initialization
96	discard	17.767349		10.191759	12.361645	25.679814	38.71628	10.272489	9.382109							1.262	80.7	Use final normal eigengap ambiguity to control shrinkage toward the broad provisional PCA normal
97	discard	17.774723		10.190841	12.360925	25.698467	38.741355	10.272282	9.384467							1.269	93.5	Gate broad-normal shrinkage by both final eigengap ambiguity and cross-scale agreement
98	discard	17.773264		10.184001	12.355475	25.711407	38.745354	10.263869	9.37948							1.263	80.7	Apply 10% broad-normal shrinkage only when the final robust PCA eigengap is ambiguous
99	discard	17.831596		10.313143	12.41868	25.640652	38.740266	10.38214	9.494695							1.281	81.1	Shrink the final robust local covariance 10% toward the normalized broad provisional covariance
100	discard	17.676831	14.848915	10.236184	12.37581	25.254196	38.367199	10.375648	9.451945	11.645083	12.230018	17.9569	25.084084	11.969195	10.20821	1.511	88.7	Extend only the final Tukey-PCA refinement from 112 to 160 neighbors
101	provisional	17.752443		10.207048	12.363953	25.566652	38.655655	10.314495	9.406855							1.431	100.2	Extend only the final Tukey-PCA refinement from 112 to 128 neighbors
102	discard	17.711135		10.226276	12.370559	25.386868	38.494325	10.351693	9.437087							1.481	102.8	Extend only the final Tukey-PCA refinement from 128 to 144 neighbors
103	discard	17.731052		10.217344	12.369112	25.468486	38.571358	10.337353	9.422662							1.483	98.1	Extend only the final Tukey-PCA refinement from 128 to 136 neighbors
104	discard	17.742641		10.166863	12.348666	25.609661	38.695063	10.26753	9.368063							1.451	98.3	Narrow only the 128-neighbor final Tukey-PCA Gaussian bandwidth from the 112th- to the 104th-neighbor radius
105	discard	17.747725		10.186623	12.355691	25.586623	38.674781	10.292974	9.389657							1.437	106.6	Narrow only the 128-neighbor final Tukey-PCA Gaussian bandwidth from the 112th- to the 108th-neighbor radius
106	discard	17.78095		10.19552	12.35885	25.688944	38.75669	10.294953	9.390745							1.429	95.4	Reduce only the final Tukey-PCA refinement from 128 to 120 neighbors
107	discard	17.76706		10.202424	12.363091	25.62634	38.704145	10.30532	9.401042							1.437	110.8	Reduce only the final Tukey-PCA refinement from 128 to 124 neighbors
108	discard	17.739822		10.185772	12.358108	25.564621	38.650491	10.295597	9.384345							1.384	96.0	Estimate final Tukey residual location and scale from the 112-neighbor core while retaining 128-neighbor covariance support
109	discard	17.724675		10.163754	12.348479	25.563515	38.645952	10.269388	9.35696							1.359	96.1	Estimate final Tukey residual location and scale from a 96-neighbor core while retaining 128-neighbor covariance support
110	discard	17.706787		10.128368	12.344933	25.560397	38.638456	10.241265	9.327303							1.306	95.8	Estimate final Tukey residual location and scale from an 80-neighbor core while retaining 128-neighbor covariance support
111	keep	17.683331	14.779952	10.079867	12.343174	25.555994	38.626216	10.206136	9.288601	11.423862	12.055618	18.007697	25.391661	11.76375	10.037123	1.269	104.8	Estimate final Tukey residual location and scale from a 64-neighbor core while retaining 128-neighbor covariance support
112	discard	17.653775		10.029592	12.333031	25.542871	38.617203	10.178059	9.221897							1.245	96.8	Estimate final Tukey residual location and scale from a 48-neighbor core while retaining 128-neighbor covariance support
