iteration	status	dev_rmse	val_rmse	dev_clean	dev_low	dev_medium	dev_high	dev_stripe	dev_gradient	val_clean	val_low	val_medium	val_high	val_stripe	val_gradient	runtime_s	memory_mb	description
228	discard	17.331258		9.611026	12.267729	25.233906	38.117559	9.885978	8.871349							1.33	97.4	Tighten the third-refinement sheet-thickness gate from 0.10 to 0.0984375 local radii
229	discard	17.33415		9.621588	12.264857	25.234654	38.117959	9.886814	8.87903							1.324	97.6	Leave the query sample out of the gated third-pass residual location and scale statistics
230	discard	17.332469		9.618943	12.265039	25.234376	38.117875	9.883964	8.874615							1.492	103.3	Exclude the query only from the third-refinement thin-sheet confidence statistic
231	discard	17.329494		9.60987	12.26471	25.234454	38.117833	9.877728	8.872367							1.375	97.4	Give the query half weight only in the third-refinement thin-sheet confidence statistic
232	discard	17.329342		9.611495	12.262514	25.234105	38.1177	9.879615	8.870621							1.372	111.6	Give the query three-quarter weight only in the third-refinement thin-sheet confidence statistic
233	discard	17.329674		9.608197	12.262859	25.233989	38.1177	9.884769	8.870532							1.365	97.5	Give the query seven-eighths weight only in the third-refinement thin-sheet confidence statistic
234	discard	17.329945		9.605558	12.264523	25.234812	38.117537	9.886504	8.870732							1.361	97.5	Give the query fifteen-sixteenths weight only in the third-refinement thin-sheet confidence statistic
235	discard	17.320824		9.589322	12.245621	25.236456	38.11965	9.882215	8.851679							1.316	113.5	Relax the third-refinement sheet-thickness gate from 0.10 to 0.1125 local radii
236	discard	17.327213		9.595848	12.263957	25.235364	38.117961	9.890594	8.859552							1.346	113.5	Relax the third-refinement sheet-thickness gate from 0.10 to 0.10625 local radii
237	discard	17.360576		9.672613	12.279532	25.231956	38.116983	9.922092	8.940281							1.381	105.1	Estimate the gated third Tukey refinement's residual location and scale from 64 rather than 32 neighbors
238	discard	17.344392		9.617908	12.261198	25.232055	38.117122	9.918962	8.919104							1.4	97.6	Estimate the gated third Tukey refinement's residual statistics from 48 rather than 32 neighbors
239	discard	17.340841		9.620207	12.274316	25.232516	38.117112	9.902311	8.898583							1.348	97.4	Estimate gated third-pass Tukey residual statistics from 40 rather than 32 neighbors
240	discard	17.333056		9.608002	12.260781	25.234071	38.116848	9.899663	8.878973							1.338	97.3	Estimate gated third-pass Tukey residual statistics from 36 rather than 32 neighbors
241	discard	17.335595		9.621025	12.265166	25.234736	38.117047	9.895294	8.880305							1.305	97.3	Estimate gated third-pass Tukey residual statistics from 34 rather than 32 neighbors
242	discard	17.33031		9.604796	12.26443	25.234888	38.117221	9.881566	8.878958							1.329	105.4	Estimate gated third-pass Tukey residual statistics from 33 rather than 32 neighbors
243	discard	17.33423		9.61454	12.262265	25.232095	38.116983	9.901821	8.877677							1.331	97.6	Estimate the gated third-pass Tukey residual median from 32 neighbors and MAD scale from 48 neighbors
244	discard	17.345937		9.639504	12.267656	25.234162	38.117186	9.907146	8.909967							1.35	97.6	Estimate the gated third-pass Tukey residual median from 48 neighbors while retaining the 32-neighbor MAD scale
245	discard	17.32896		9.598766	12.252816	25.232209	38.116955	9.890949	8.882064							1.344	97.5	Estimate the gated third-pass Tukey residual median from 32 neighbors and MAD scale from 40 neighbors
246	discard	17.327019		9.592482	12.256735	25.232671	38.116963	9.890459	8.872802							1.311	113.4	Estimate the gated third-pass Tukey residual median from 32 neighbors and MAD scale from 36 neighbors
247	discard	17.329056		9.601321	12.263797	25.234564	38.117101	9.885435	8.872118							1.349	98.6	Estimate the gated third-pass Tukey residual median from 32 neighbors and MAD scale from 34 neighbors
248	discard	17.329052		9.60127	12.264697	25.234791	38.117361	9.879197	8.876995							1.324	97.5	Estimate the gated third-pass Tukey residual median from 32 neighbors and MAD scale from 33 neighbors
249	discard	17.329164		9.603701	12.263346	25.234025	38.117598	9.885544	8.870772							1.328	97.6	Estimate the gated third-pass Tukey residual median from 32 neighbors and MAD scale from 31 neighbors
250	discard	17.331108		9.611037	12.258614	25.233886	38.117809	9.891531	8.873772							1.304	97.6	Estimate the gated third-pass Tukey residual median from 32 neighbors and MAD scale from 30 neighbors
251	discard	17.326848		9.605208	12.25192	25.234174	38.118592	9.880477	8.870717							1.337	113.8	Estimate the gated third-pass Tukey residual median from 32 neighbors and MAD scale from 28 neighbors
252	discard	17.324242		9.588811	12.248149	25.237218	38.12077	9.88295	8.867557							1.329	97.5	Estimate the gated third-pass Tukey residual median from 32 neighbors and MAD scale from 24 neighbors
253	discard	17.323119		9.575824	12.246229	25.249751	38.131139	9.872237	8.863531							1.316	113.6	Estimate the gated third-pass Tukey residual median from 32 neighbors and MAD scale from 16 neighbors
254	discard	17.354662		9.624826	12.253864	25.29179	38.159539	9.899526	8.898428							1.43	113.6	Estimate the gated third-pass Tukey residual median from 32 neighbors and MAD scale from 8 neighbors
255	discard	17.330355		9.605103	12.23938	25.265469	38.133629	9.873925	8.864627							1.3	97.5	Estimate the gated third-pass Tukey residual median from 32 neighbors and MAD scale from 12 neighbors
256	discard	17.327579		9.586706	12.249061	25.254825	38.131833	9.87791	8.865139							1.307	113.6	Estimate the gated third-pass Tukey residual median from 32 neighbors and MAD scale from 14 neighbors
257	discard	17.327728		9.588346	12.250896	25.252743	38.128205	9.87549	8.870689							1.347	113.5	Estimate the gated third-pass Tukey residual median from 32 neighbors and MAD scale from 15 neighbors
258	discard	17.323664		9.59089	12.244709	25.242422	38.122802	9.870005	8.871154							1.323	97.5	Estimate the gated third-pass Tukey residual median from 32 neighbors and MAD scale from 20 neighbors
259	discard	17.324954		9.585831	12.253833	25.239934	38.121243	9.878478	8.870404							1.301	106.2	Estimate the gated third-pass Tukey residual median from 32 neighbors and MAD scale from 22 neighbors
260	discard	17.328802		9.598257	12.262551	25.237472	38.121031	9.8796	8.873898							1.308	97.6	Estimate the gated third-pass Tukey residual median from 32 neighbors and MAD scale from 23 neighbors
261	discard	17.32634		9.58976	12.260373	25.241084	38.122487	9.874721	8.869614							1.334	113.5	Estimate the gated third-pass Tukey residual median from 32 neighbors and MAD scale from 21 neighbors
262	discard	17.436978		9.847982	12.307031	25.231909	38.117244	10.058445	9.059256							1.317	105.8	Require a material robust residual offset before accepting the thin-sheet third Tukey refinement
263	discard	17.331623		9.607193	12.26303	25.234757	38.117551	9.894179	8.87303							1.331	105.7	Accept the thin-sheet third Tukey refinement only when consecutive normal corrections have consistent direction
264	crash																	Accept the thin-sheet third Tukey refinement only when it improves the normal eigengap
265	discard	17.334714		9.608175	12.271304	25.234517	38.117422	9.898957	8.877909							1.325	97.5	Accept the thin-sheet third Tukey refinement only when it improves the normal eigengap
266	discard	17.365505		9.695215	12.277438	25.233883	38.117065	9.933889	8.935544							1.47	113.7	Require split-half normal stability before accepting the thin-sheet third Tukey refinement
267	discard	17.341269		9.632204	12.266588	25.234451	38.117487	9.905106	8.891776							1.323	114.4	Shrink the gated third-pass robust covariance 10% toward the preceding two-step covariance
268	discard	17.33535		9.618649	12.264755	25.234604	38.117518	9.896719	8.879856							1.316	105.3	Shrink the gated third-pass covariance 5% toward the preceding two-step covariance
269	discard	17.332476		9.612045	12.263879	25.23468	38.117534	9.892682	8.874036							1.319	113.5	Shrink the gated third-pass covariance 2.5% toward the preceding two-step covariance
270	discard	17.331061		9.608787	12.263451	25.234719	38.117543	9.890704	8.871161							1.337	105.3	Shrink the gated third-pass covariance 1.25% toward the preceding two-step covariance
271	discard	17.330358		9.607169	12.26324	25.234738	38.117547	9.889724	8.869732							1.369	113.5	Shrink the gated third-pass covariance 0.625% toward the preceding two-step covariance
272	discard	17.330009		9.606363	12.263135	25.234748	38.117549	9.889237	8.86902							1.372	97.5	Shrink the gated third-pass covariance 0.3125% toward the preceding two-step covariance
273	discard	17.329834		9.60596	12.263083	25.234752	38.11755	9.888994	8.868664							1.324	95.5	Shrink the gated third-pass covariance 0.15625% toward the preceding two-step covariance
274	discard	17.329747		9.605759	12.263056	25.234755	38.11755	9.888873	8.868487							1.349	97.4	Shrink the gated third-pass covariance 0.078125% toward the preceding two-step covariance
275	discard	17.324171		9.592522	12.261247	25.234918	38.117584	9.881032	8.857723							1.32	97.7	Extrapolate the accepted thin-sheet third Tukey normal 5% beyond its two-step correction
276	discard	17.318931		9.579969	12.259576	25.23508	38.117618	9.873772	8.847574							1.34	97.6	Extrapolate accepted thin-sheet third-step normal corrections by 10%
277	discard	17.309203		9.556325	12.25657	25.235409	38.117687	9.860635	8.828594							1.433	102.6	Extrapolate accepted thin-sheet third-step normal corrections by 20%
278	discard	17.29277		9.514963	12.251908	25.236088	38.11783	9.839899	8.795931							1.367	111.7	Extrapolate accepted thin-sheet third-step normal corrections by 40%
279	keep	17.268683	14.444381	9.439152	12.248003	25.237526	38.11814	9.817447	8.751832	10.825132	11.577301	18.087696	25.313388	11.383021	9.479746	1.332	105.2	Extrapolate accepted thin-sheet third-step normal corrections by 80%
280	discard	17.267139		9.380535	12.261715	25.240721	38.118848	9.854724	8.746291							1.337	113.7	Extrapolate accepted thin-sheet third-step normal corrections by 160%
281	discard	17.260117		9.393665	12.251301	25.239071	38.118479	9.822537	8.735649							1.329	97.4	Extrapolate accepted thin-sheet third-step normal corrections by 120%
282	discard	17.26241		9.412314	12.248755	25.238286	38.118306	9.816494	8.740304							1.375	104.6	Extrapolate accepted thin-sheet third-step normal corrections by 100%
283	discard	17.265045		9.424707	12.248154	25.237903	38.118222	9.816084	8.745201							1.361	105.2	Extrapolate accepted thin-sheet third-step normal corrections by 90%
284	discard	17.266738		9.431673	12.248022	25.237714	38.118181	9.816542	8.748299							1.384	113.7	Extrapolate accepted thin-sheet third-step normal corrections by 85%
285	discard	17.267679		9.435348	12.247998	25.23762	38.11816	9.816939	8.750011							1.32	105.4	Extrapolate accepted thin-sheet third-step normal corrections by 82.5%
286	discard	17.275221		9.478318	12.244978	25.235711	38.117855	9.816195	8.758271							1.338	105.6	Extrapolate the gated third-step normal only when Tukey rejection retains at least half of the Gaussian weight mass
287	discard	17.268636		9.440355	12.247503	25.236991	38.118088	9.816755	8.752122							1.338	97.8	Smoothly scale third-step normal extrapolation by retained Tukey weight mass
288	discard	17.268709		9.437873	12.247876	25.237531	38.11814	9.818261	8.752574							1.321	113.8	Extrapolate accepted third-step normal corrections along the unit sphere
289	discard	17.234654		9.450026	12.268716	25.120054	37.991191	9.822333	8.755606							1.308	98.0	Blend 5% of the broad provisional PCA normal into non-thin local patches
290	discard	17.251486		9.444616	12.258129	25.178433	38.054198	9.819826	8.753711							1.361	103.3	Blend 2.5% of the broad provisional PCA normal into non-thin local patches
291	discard	17.260055		9.441967	12.253008	25.207909	38.086056	9.81862	8.75277							1.342	97.8	Blend 1.25% of the broad provisional PCA normal into non-thin local patches
292	discard	17.264357		9.440555	12.250491	25.22269	38.102077	9.81803	8.752301							1.326	113.9	Blend 0.625% of the broad provisional PCA normal into non-thin local patches
293	discard	17.266518		9.439852	12.249243	25.230101	38.110109	9.817737	8.752066							1.321	97.7	Blend 0.3125% of the broad provisional PCA normal into non-thin local patches
294	discard	17.267601		9.439502	12.248622	25.233812	38.114127	9.817592	8.751949							1.331	97.8	Blend 0.15625% of the broad provisional PCA normal into non-thin local patches
295	discard	17.268142		9.439327	12.248312	25.235669	38.116133	9.817519	8.751891							1.336	113.0	Blend 0.078125% of the broad provisional PCA normal into non-thin local patches
296	discard	17.268412		9.439239	12.248157	25.236598	38.117136	9.817483	8.751862							1.343	97.6	Blend 0.0390625% of the broad provisional PCA normal into non-thin local patches
297	discard	17.233266		9.443386	12.25584	25.128747	37.998705	9.817947	8.754973							1.36	97.7	Smoothly increase broad-normal stabilization with robust residual thickness on non-thin patches
298	discard	17.238113		9.44065	12.249274	25.149559	38.019027	9.81809	8.752079							1.337	105.2	Blend 5% of the broad provisional normal only into very thick local patches
299	discard	17.248998		9.373818	12.26244	25.239846	38.11837	9.811803	8.687711							1.67	103.6	Add a fourth Tukey-PCA refinement on thin coherent sheets before extrapolating the final normal correction
300	discard	17.252996		9.394496	12.253148	25.238649	38.11824	9.803402	8.710038							1.557	104.2	Blend half of a fourth Tukey-PCA continuation into the retained thin-sheet normal
301	discard	17.25939		9.413873	12.250047	25.238079	38.118186	9.807619	8.728539							1.557	95.8	Blend one quarter of a fourth Tukey-PCA continuation into the retained thin-sheet normal
302	discard	17.263678		9.425783	12.248892	25.2378	38.118162	9.811834	8.739593							1.559	95.7	Blend one eighth of a fourth Tukey-PCA continuation into the retained thin-sheet normal
303	discard	17.266091		9.432286	12.248414	25.237663	38.118151	9.814467	8.745565							1.548	111.9	Blend one sixteenth of a fourth Tukey-PCA continuation into the retained thin-sheet normal
304	discard	17.267365		9.435674	12.2482	25.237594	38.118145	9.815913	8.748662							1.574	100.1	Blend one thirty-second of a fourth Tukey-PCA continuation into the retained thin-sheet normal
305	discard	17.268018		9.437401	12.248099	25.23756	38.118142	9.816669	8.750238							1.55	111.9	Blend one sixty-fourth of a fourth Tukey-PCA continuation into the retained thin-sheet normal
306	crash																	agent invocation failed
307	discard	17.270633		9.442336	12.24803	25.237492	38.118204	9.821941	8.755795							1.321	113.8	Scale thin-sheet third-normal extrapolation by agreement between consecutive robust PCA corrections
308	discard	17.261952		9.405496	12.25244	25.239026	38.118301	9.818021	8.738428							1.327	106.1	Add 25% directional momentum from the preceding Tukey-PCA normal correction on accepted thin sheets
309	discard	17.267936		9.454016	12.250176	25.237526	38.11814	9.808182	8.739579							1.31	97.6	Cap the retained third-normal extrapolation to a five-degree unit-normal chord
310	discard	17.276722		9.479095	12.240926	25.237544	38.11805	9.814606	8.770114							1.354	107.4	Extrapolate the thin-sheet third Tukey correction only when successive normal-update magnitudes contract
311	discard	17.279924		9.484289	12.261489	25.234758	38.117537	9.807737	8.773733							1.389	110.3	Apply 80% third-normal extrapolation only to very thin accepted sheets
312	discard	17.274757		9.464266	12.251532	25.23582	38.117738	9.816091	8.763095							1.323	97.6	Linearly taper third-normal extrapolation across marginally thin sheets
313	crash																	Extrapolate only the component of the third Tukey-PCA correction orthogonal to the preceding correction
314	discard	17.335016		9.612266	12.262943	25.235493	38.11719	9.901131	8.88107							1.325	105.8	Orthogonalize thin-sheet third-normal extrapolation against the preceding robust PCA update
315	discard	17.270819		9.445686	12.248607	25.237454	38.118194	9.820826	8.754147							1.327	113.9	Extrapolate only the persistent component shared by consecutive thin-sheet Tukey-PCA normal corrections
316	discard	17.268951		9.441845	12.248253	25.237489	38.118166	9.816789	8.751162							1.328	105.6	Half-damp only the transverse component of thin-sheet third-normal extrapolation
317	discard	17.268773		9.440417	12.248115	25.237508	38.118152	9.817025	8.751423							1.341	105.6	Quarter-damp the transverse component of thin-sheet third-normal extrapolation
318	crash																	Damp the transverse component of thin-sheet third-normal extrapolation from 80% to 70%
319	discard	17.268717		9.439764	12.248056	25.237517	38.118146	9.817212	8.751609							1.353	106.1	Damp the transverse component of thin-sheet third-normal extrapolation from 80% to 70%
320	discard	17.268698		9.439453	12.248028	25.237522	38.118143	9.817324	8.751716							1.428	106.7	Damp the transverse component of thin-sheet third-normal extrapolation from 80% to 75%
321	discard	17.26869		9.439301	12.248015	25.237524	38.118141	9.817384	8.751773							1.341	105.9	Damp the transverse component of thin-sheet third-normal extrapolation from 80% to 77.5%
322	crash																	Damp the transverse component of thin-sheet third-normal extrapolation from 80% to 78.75%
