iteration	candidate_commit	dev_rmse	val_rmse	runtime_s	memory_mb	status	failure_stage	failure_message	complexity	description	rationale	source
303	5f52032644ebcc64678b31a91e542e406beaa2da	17.266091		1.548	111.9	discard			medium	Blend one sixteenth of a fourth Tukey-PCA continuation into the retained thin-sheet normal	The retained three-step Tukey fit and 80% extrapolation reduce curvature-, asymmetric-density-, and outlier-induced tangent bias on thin coherent sheets, while measured full, half, quarter, and eighth-strength fourth continuations further improved clean, stripe, and gradient accuracy but regressed low-, medium-, and high-noise conditions. For patches passing the existing thickness gate, compute the same fourth robust covariance, extrapolate its measured fourth-minus-third normal correction by the retained 80%, sign-align it to the retained frontier normal, and return their normalized 6.25/93.75 blend. This next damping anchor should retain a smaller clean, stripe, and gradient benefit while reducing the noise regression relative to the measured one-eighth blend. The cost is one weighted median/MAD, covariance, and 3-by-3 eigendecomposition per query. Ablate by removing the fourth cutoff/count entries and continuation branch, exactly recovering the retained three-step extrapolated estimator; changing the blend to 0.125 independently recovers the preceding candidate. The ordered quadratic-jet retry remains skipped because its prior prediction failure has no precise diagnostic to address.	https://doi.org/10.1080/00401706.1974.10489171
304	3b6297cd14a77090699dbb89c536eeb58b80b0f5	17.267365		1.574	100.1	discard			medium	Blend one thirty-second of a fourth Tukey-PCA continuation into the retained thin-sheet normal	The retained three-step Tukey fit and 80% extrapolation reduce curvature-, asymmetric-density-, and outlier-induced tangent bias on thin coherent sheets, while measured full through one-sixteenth fourth continuations further improved clean, stripe, and gradient accuracy but regressed low-, medium-, and high-noise conditions. For patches passing the existing thickness gate, compute the same fourth robust covariance, extrapolate its measured fourth-minus-third normal correction by 80%, sign-align it to the retained frontier normal, and return their normalized 3.125/96.875 blend. This next ordered damping anchor should retain a still smaller clean, stripe, and gradient benefit while reducing the noise regression relative to the measured one-sixteenth blend. The cost is one weighted median/MAD, covariance, and 3-by-3 eigendecomposition per query. Ablate by removing the fourth cutoff/count entries and continuation branch, exactly recovering the retained three-step extrapolated estimator; changing the blend to 0.0625 independently recovers the preceding candidate. The quadratic-jet retry remains skipped because its prior prediction failure has no precise diagnostic to address.	https://doi.org/10.1080/00401706.1974.10489171
305	d2297e5ff085413e13ece86ad434cb6afb9f6266	17.268018		1.55	111.9	discard			medium	Blend one sixty-fourth of a fourth Tukey-PCA continuation into the retained thin-sheet normal	The retained three-step Tukey fit and 80% normal extrapolation reduce curvature-, asymmetric-density-, and outlier-induced tangent bias on thin coherent sheets, while measured fourth-step blends from full strength through 1/32 consistently improved clean, stripe, and gradient accuracy but regressed low-, medium-, and high-noise conditions. This next ordered damping anchor computes the same independently ablatable fourth robust covariance, extrapolates its measured fourth-minus-third correction by 80%, and blends only 1/64 of that continuation into the retained normal. Clean, stripe, and gradient should retain a still smaller benefit; low, medium, and high noise may regress, but less than at 1/32. The cost is one weighted median/MAD, covariance, and 3-by-3 eigendecomposition per query. Ablate by removing the fourth cutoff/count entries and continuation branch, exactly recovering the retained three-step estimator; setting the blend to 1/32 independently recovers the preceding candidate.	https://doi.org/10.1080/00401706.1974.10489171
306						crash	proposal.validation	Extra data: line 8 column 1 (char 1233)	baseline	agent invocation failed	no valid bounded proposal was produced	original
307	8dac37ec83a11becfd31e46d0a173a10071a82b1	17.270633		1.321	113.8	discard			medium	Scale thin-sheet third-normal extrapolation by agreement between consecutive robust PCA corrections	The retained fixed 80% extrapolation assumes every third Tukey-PCA correction continues toward the query-local tangent, but medium/high-noise patches can produce oscillating IRLS directions whose extrapolation amplifies variance. After sign alignment, compute the cosine between the first-to-second and second-to-third normal updates and multiply the retained extrapolation by max(0, cosine): aligned corrections retain up to the full 80%, orthogonal or reversing corrections retain the measured third normal without extrapolation. Medium and high noise should improve by suppressing amplification of inconsistent updates; clean, low-noise, stripe, and gradient should retain most curvature-, density-, and outlier-bias gains when robust iterations converge consistently, but may regress where a useful correction changes direction. The cost is two vector differences, norms, and a dot product per query with no additional fit. Ablate by replacing the agreement factor with one, exactly recovering fixed 80% extrapolation; setting the global extrapolation to zero independently removes extrapolation.	original
308	64865fed437aece7e31080f198937926a1a3a33c	17.261952		1.327	106.1	discard			low	Add 25% directional momentum from the preceding Tukey-PCA normal correction on accepted thin sheets	The ordered quadratic-jet retry remains blocked because its prediction crash has no precise diagnostic to address. The retained 80% extrapolation treats only the latest robust normal update as evidence of under-corrected curvature, asymmetric-density, or outlier bias. Iteration 307 showed that suppressing extrapolation by the angle between consecutive updates loses clean, stripe, and gradient accuracy, but it did not test whether the preceding update itself contains useful directional signal. On patches already accepted by the retained thin-sheet gate, sign-align n1, n2, and n3 and return normalize(n3 + 0.8(n3 - n2) + 0.25(n2 - n1)). This constant-coefficient two-step continuation preserves the validated latest-update extrapolation while adding a small, independently interpretable memory of the earlier robust correction. Clean, low-noise, stripe, and gradient conditions should improve when successive IRLS updates jointly track persistent neighborhood bias; medium and high noise may regress if the older update carries sampling variance or opposes a useful latest correction. The cost is one saved normal, sign alignment, vector addition, and normalization per query, with no new fit. Ablate by setting THIRD_DIRECTION_MOMENTUM to zero, exactly recovering the validated estimator; removing THIRD_NORMAL_EXTRAPOLATION separately isolates the retained mechanism.	original
309	996ff19e1f10c0eac42f5f6e9bc42fab6e88e005	17.267936		1.31	97.6	discard			low	Cap the retained third-normal extrapolation to a five-degree unit-normal chord	The retained 80% extrapolation improves clean, low-noise, stripe, and gradient patches by continuing an underrelaxed robust correction, but it slightly worsens medium and high noise because an unusually large noise-driven third-step rotation is amplified without bound. Keep the established extrapolation direction and gain, but clip the added vector 0.8 (n3 - n2) to length 2 sin(2.5 degrees), the chord length corresponding to five degrees between unit normals. Small, consistent curvature-, density-, and outlier-bias corrections are therefore unchanged, while large corrections cannot receive more than a bounded continuation. Medium and high noise should improve by limiting amplification of unstable rotations; clean, low-noise, stripe, and gradient should remain unchanged on small updates but may regress where a genuinely useful correction exceeds the cap. The cost is one vector norm and scalar clip per query, with no new fit. Ablate by removing the norm clip, exactly recovering the retained fixed 80% extrapolation; setting THIRD_NORMAL_EXTRAPOLATION to zero independently removes extrapolation.	original
310	889bb294da04278dfe098be3dad3fe437ab502e8	17.276722		1.354	107.4	discard			low	Extrapolate the thin-sheet third Tukey correction only when successive normal-update magnitudes contract	The retained 80% extrapolation assumes the latest robust-PCA update is a converging correction of curvature, asymmetric-density, or outlier bias, but a growing third update is evidence that redescending rejection may be amplifying sampling noise rather than approaching a stable tangent. After sign alignment, compare the unit-normal chord lengths ||n3-n2|| and ||n2-n1||: thin sheets with a nonincreasing correction retain the validated extrapolation, thin sheets with a growing correction return n3 without amplification, and thick sheets remain at n2. Medium and high noise should improve by avoiding amplification of divergent updates; clean, low-noise, stripe, and gradient may regress where a useful geometric correction grows between iterations. The cost is two saved scalar chord lengths and one comparison per query, with no new fit. Ablate by forcing the contraction test true, exactly recovering the retained fixed 80% extrapolation; forcing the extrapolation coefficient to zero independently removes extrapolation. The ordered quadratic-jet retry remains skipped because its prior prediction crash has no precise diagnostic to address.	original
311	cc0707f0c85b0dd52b3b608c9bcbbe135e91c702	17.279924		1.389	110.3	discard			low	Apply 80% third-normal extrapolation only to very thin accepted sheets	The retained third Tukey fit is useful up to robust thickness sigma/r_112 <= 0.10, but extrapolating its normal correction by 80% is a stronger assumption that can amplify residual sampling noise near that acceptance boundary. Keep the third-step normal for every patch passing the established 0.10 thin-sheet gate, but apply extrapolation only when sigma/r_112 <= 0.075; patches between 0.075 and 0.10 receive the measured robust correction without amplification. Medium and high noise should improve by bounding amplification on marginally coherent patches. Clean, low-noise, stripe, and gradient conditions may regress if their useful underrelaxed corrections occur in that thickness band. The cost is one scalar comparison and selection with no new fit. Ablate by setting THIRD_EXTRAPOLATION_MAX_THICKNESS to 0.10, exactly recovering the validated fixed-80% extrapolation; setting THIRD_NORMAL_EXTRAPOLATION to zero independently removes extrapolation.	original
312	fceae8d5c84e380878fbd51c09cfc929bebbfcbd	17.274757		1.323	97.6	discard			medium	Linearly taper third-normal extrapolation across marginally thin sheets	The retained third Tukey fit is useful for every coherent sheet with robust thickness sigma/r_112 <= 0.10, but its additional 80% normal extrapolation assumes that the measured correction is nearly noise-free. The preceding hard restriction to sigma/r_112 <= 0.075 improved medium noise, high noise, and stripe sampling but lost too much clean, low-noise, and gradient accuracy. This change keeps the third-step normal throughout the established 0.10 acceptance range, applies full extrapolation at thickness at most 0.075, and linearly reduces only the extrapolation gain to zero at 0.10. Medium and high noise and stripe should improve by attenuating amplification on marginal sheets; clean, low-noise, and gradient may regress, but less than under the measured hard cutoff because they retain partial continuation. The cost is scalar confidence arithmetic with no new fit. Ablate by replacing the confidence with one, exactly recovering the validated fixed-80% extrapolation; thresholding it at 0.075 independently recovers the preceding hard-gate probe.	original
313						crash	quality.ruff-fix	Ruff exited with status 1	low	Extrapolate only the component of the third Tukey-PCA correction orthogonal to the preceding correction	The retained 80% extrapolation treats the full second-to-third normal update as new evidence of under-corrected curvature, asymmetric-density, or outlier bias, even though its component parallel to the first-to-second update can repeat a direction already incorporated by two robust fits and amplify sampling noise. On accepted thin sheets, sign-align n1, n2, and n3, remove from d3 = n3 - n2 its projection onto d2 = n2 - n1, rescale the remaining direction to ||d3||, and extrapolate it by the retained 80%; a vanishing orthogonal component receives no extrapolation. This should reduce repeated noise amplification and improve medium/high noise, while clean, low-noise, stripe, and gradient may regress when a persistent same-direction correction genuinely tracks neighborhood bias. The cost is saved normals plus vector projections and norms, with no new fit. Ablate by replacing the orthogonalized direction with d3, exactly recovering fixed 80% extrapolation.	original
314	71be0621b6ff042e2ae158c8a4985d36ab478b96	17.335016		1.325	105.8	discard			low	Orthogonalize thin-sheet third-normal extrapolation against the preceding robust PCA update	The retained 80% extrapolation improves clean, low-noise, stripe, and gradient patches by continuing the latest Tukey-PCA correction, but its component parallel to the preceding correction can repeat a direction already incorporated by two robust fits and amplify sampling noise. On accepted thin sheets, sign-align n1, n2, and n3, project d3 = n3 - n2 off d2 = n2 - n1, rescale the orthogonal remainder to ||d3||, and extrapolate that component by 80%; a vanishing orthogonal remainder receives no extrapolation. Medium and high noise should improve through less repeated noise amplification, while clean, low-noise, stripe, and gradient may regress when a persistent same-direction update genuinely tracks curvature, density, or outlier bias. The cost is retaining one normal plus vector projections and norms, with no new neighborhood fit. Ablate by replacing the orthogonalized update with d3, exactly recovering the retained fixed-80% extrapolation. Iteration 313 failed during Ruff processing before evaluation, so this hypothesis remains unmeasured and is retried with explicit shaped arrays.	original
315	845eef7a1ecda4aefb1b191fc654c2dcae4f7f7d	17.270819		1.327	113.9	discard			low	Extrapolate only the persistent component shared by consecutive thin-sheet Tukey-PCA normal corrections	The retained 80% extrapolation assumes the entire latest robust normal update continues a correction of curvature, asymmetric-density, or outlier bias, but a component newly appearing orthogonal to the preceding update is more likely to be sampling noise. The complementary orthogonal-only experiment improved medium and high noise but strongly regressed clean, low-noise, stripe, and gradient conditions, directly showing that the parallel component carries the useful geometric trend. On accepted thin sheets, sign-align n1, n2, and n3, project d3 = n3 - n2 onto d2 = n2 - n1, keep that projection only when it has positive coefficient, and extrapolate it by the retained 80%. Persistent same-direction convergence is continued, while reversing or newly transverse motion receives no amplification. Clean, low-noise, stripe, and gradient should retain more of the frontier benefit than the rejected orthogonalization; medium and high noise may improve by suppressing transient correction components, though geometry whose true correction turns between iterations may regress. The cost is saved normals plus one projection and normalization per query, with no new fit. Ablate by replacing the persistent projection with d3, exactly recovering fixed 80% extrapolation.	original
316	3ba5786ef4fcd40dc36ffb3d01e71b55ae372285	17.268951		1.328	105.6	discard			low	Half-damp only the transverse component of thin-sheet third-normal extrapolation	The retained 80% extrapolation improves clean, low-noise, stripe, and gradient patches, but can amplify sampling noise in medium/high-noise patches. The two complementary measured ablations show that the component of the latest Tukey-PCA update parallel to the preceding update carries most of the useful curvature-, density-, and outlier-bias correction, while suppressing either component completely loses too much geometric accuracy. On accepted thin sheets, sign-align n1, n2, and n3, decompose d3 = n3 - n2 into its projection parallel to d2 = n2 - n1 and its transverse remainder, then extrapolate the parallel component by the retained 0.8 but the transverse component by only 0.4. Persistent geometric convergence is left unchanged while newly turning motion, which is more likely to contain sampling variance, is only partially amplified rather than discarded. Medium and high noise should improve; clean, low-noise, stripe, and gradient may regress slightly if a turning correction is genuinely geometric, but should retain more of the frontier benefit than either projection-only ablation. The cost is one projection and vector decomposition per query with no new fit. Ablate by setting THIRD_TRANSVERSE_EXTRAPOLATION to 0.8, exactly recovering the retained fixed-80% extrapolation; setting it to zero isolates the previously measured persistent-only endpoint.	original
317	a0caf30e31ac1861d58bc33ab05b85a15b677568	17.268773		1.341	105.6	discard			baseline	Quarter-damp the transverse component of thin-sheet third-normal extrapolation	The retained 80% extrapolation improves clean, low-noise, stripe, and gradient patches by continuing an underrelaxed Tukey-PCA correction, but newly turning motion between consecutive robust updates can contain sampling variance. The measured 40% transverse coefficient improved medium, stripe, and gradient while slightly regressing clean, low, and high conditions; 60% is the untested midpoint between that candidate and the retained 80% coefficient. On accepted thin sheets, sign-align n1, n2, and n3, decompose d3 = n3 - n2 into its projection along d2 = n2 - n1 and its transverse remainder, then extrapolate the persistent component by 0.8 and the transverse component by 0.6. Medium, stripe, and gradient should retain smaller gains, while clean, low, and high should regress less than with 0.4. The cost is one vector projection per query with no new fit. Ablate by setting THIRD_TRANSVERSE_EXTRAPOLATION to 0.8, for which the components recombine to exactly recover fixed 80% extrapolation.	original
318						crash	quality.ruff-fix	Ruff exited with status 1	low	Damp the transverse component of thin-sheet third-normal extrapolation from 80% to 70%	The retained 80% extrapolation continues an underrelaxed Tukey-PCA correction on thin sheets, but the part of the latest update that turns away from the preceding update is more likely to contain sampling variance than the persistent component. The measured 40% and 60% transverse coefficients improved medium-noise, stripe, and gradient accuracy but regressed clean, low-noise, and high-noise accuracy, with 60% reducing most trade-offs; 70% is the next untested midpoint toward the retained 80% endpoint. Sign-align n1, n2, and n3, decompose d3 = n3 - n2 into its projection along d2 = n2 - n1 and a transverse remainder, then extrapolate the persistent component by 0.8 and the transverse component by 0.7. Medium noise, stripe, and gradient should retain smaller gains, while clean, low noise, and high noise should regress less than at 0.6. The cost is one vector projection per query and no new fit. Ablate by setting THIRD_TRANSVERSE_EXTRAPOLATION to 0.8, for which the two components recombine to exactly recover the validated fixed-80% extrapolation.	original
319	99deb25b40704216111aa85a1fe30e5e90b6611b	17.268717		1.353	106.1	discard			low	Damp the transverse component of thin-sheet third-normal extrapolation from 80% to 70%	The retained 80% extrapolation continues an underrelaxed Tukey-PCA correction on thin coherent sheets, but the component of the latest update that turns away from the preceding robust update is more likely to contain sampling variance than the persistent component. Sign-align the first three robust normals, decompose d3 = n3 - n2 into its projection along d2 = n2 - n1 and a transverse remainder, then extrapolate the persistent component by 0.8 and the transverse component by 0.7. The measured 0.4 and 0.6 transverse coefficients improved medium-noise, stripe, and gradient accuracy but regressed clean, low-noise, and high-noise accuracy; 0.7 is the untested midpoint toward the retained 0.8 endpoint and should preserve smaller medium, stripe, and gradient gains while reducing those regressions. The prior 0.7 attempt failed during Ruff processing before evaluation, so it did not test the hypothesis; this implementation uses explicit shaped arrays to avoid ambiguous broadcasting. The cost is retaining one normal and one vector projection per query, with no new neighborhood fit. Ablate by setting THIRD_TRANSVERSE_EXTRAPOLATION to 0.8, for which the components recombine to exactly recover the validated fixed-80% extrapolation.	original
