iteration	candidate_commit	dev_rmse	val_rmse	runtime_s	memory_mb	status	failure_stage	failure_message	complexity	description	rationale	source
114	717c1408dbb795d80d5f4e29b052e6b715125815	17.682077		1.274	110.2	discard			low	Estimate final Tukey residual scale from 48 core neighbors while retaining the 64-neighbor location estimate	Curvature and asymmetric density can inflate the final residual MAD when samples farther from the query define the rejection scale, but the prior 48-neighbor location-only probe showed that making the center equally local destabilizes high-noise patches. This complementary separation keeps the retained Gaussian-weighted residual median from 64 neighbors, computes sigma = 1.4826 weighted_median(|e - m_64|) from the nearest 48, and applies the resulting Tukey weights to all 128 covariance samples. The earlier joint 48-neighbor probe improved every development condition, while removing its local scale in the location-only probe specifically lost high-noise accuracy, so clean, low-noise, stripe, and gradient conditions should improve through less curvature-inflated leverage and medium/high noise may also improve; they could regress if 48 samples make MAD unstable. The cost is one smaller median slice with unchanged covariance support and eigendecomposition count. Ablate by setting FINAL_SCALE_COUNT back to 64, exactly recovering the frontier estimator.	original
115	aaa14167439bb3ca5e216dd3f4aea39c386072a7	17.946627		1.359	113.4	discard			low	Use corrected tangent-plane distance for the final robust PCA spatial kernel	Euclidean distance mixes lateral surface separation with normal-direction positional noise, so noisy samples can lose Gaussian weight even when they are laterally close and useful for tangent estimation. Keep the broad initialization and first Tukey correction unchanged, then project query-to-neighbor offsets onto the first corrected tangent and use exp(-2 ||P_T(p-q)||^2 / r_112^2) only for the final 128-neighbor fit; the final Tukey weights still reject large normal residuals. Medium and high noise should improve through greater effective covariance support, while clean, low-noise, stripe, and gradient conditions may regress if curvature or a still-inaccurate corrected normal makes geometrically distant points appear close. The cost is one projection and final kernel recomputation with no extra eigendecomposition. Ablate by using the cached Euclidean-distance Gaussian weights in the final pass, exactly recovering the frontier estimator. The ordered quadratic-jet item remains deferred because its prior prediction crash has no precise diagnostic to address; the earlier tangent-distance failure applied the kernel in both refinements from the provisional plane, whereas this independently tests it only after robust correction.	original
116	4827e6b23ec56e8021ac8b05633254a22568c419	17.632223		1.179	96.8	provisional			baseline	Estimate final Tukey residual location and scale from a 32-neighbor core while retaining 128-neighbor covariance support	The final 128-neighbor covariance provides useful positional-noise averaging, but curved or density-biased samples farther from the query can shift and inflate the robust residual distribution that controls their own Tukey leverage. Reducing only the final weighted-median and MAD core from 64 to 32 neighbors makes that reference distribution more query-local while leaving covariance support, Gaussian weighting, Tukey cutoffs, and all three eigendecompositions unchanged. The prior 48-neighbor probe still improved every development condition over the retained 64-neighbor estimator, but by less overall, so this next scale anchor tests whether additional curvature-bias reduction outweighs less stable robust statistics. Clean, stripe, and gradient conditions should improve if locality dominates; low, medium, and high noise may regress if 32 samples make location or scale estimation unstable. The cost is a smaller median sort and no added asymptotic complexity. Ablate by restoring FINAL_STATISTIC_COUNT to 64, exactly recovering the frontier estimator.	original
117	6af681697f75b1d1e4bad939678eea283febff1e	17.665592		1.18	96.8	discard			baseline	Estimate final Tukey residual location and scale from a 16-neighbor core while retaining 128-neighbor covariance support	The final 128-neighbor covariance provides positional-noise averaging, but curved or density-biased samples farther from the query can shift and inflate the robust residual distribution that controls their own Tukey leverage. Reducing only the final weighted-median and MAD core from 32 to 16 neighbors makes that reference distribution more query-local while leaving covariance support, Gaussian weighting, Tukey cutoffs, and all three eigendecompositions unchanged. The measured 32-neighbor probe improved every development condition over the validated 64-neighbor estimator, so 16 is the next untested scale anchor. Clean, stripe, and gradient conditions should improve if reduced neighborhood bias dominates; low, medium, and high noise may regress if 16 samples make location and scale estimates unstable. The cost is a smaller median sort with no added asymptotic complexity. Ablate by restoring FINAL_STATISTIC_COUNT to 32, exactly recovering the current provisional frontier. The ordered quadratic-jet item remains deferred because its prior prediction crash has no precise diagnostic to address, as required by the batch strategy.	original
118	b006c22df53ebe25030c4c2c11b3280fb8ed7e25	17.636826		1.184	96.8	discard			baseline	Estimate final Tukey residual location and scale from a 24-neighbor core while retaining 128-neighbor covariance support	Curved or density-biased samples far from the query can shift and inflate the robust residual distribution that controls their own Tukey leverage. The retained 32-neighbor statistic core improved all six development conditions over the validated 64-neighbor estimator, while the measured 16-neighbor core improved medium and high noise but regressed clean, low-noise, stripe, and gradient accuracy; 24 neighbors is the untested midpoint that localizes the weighted median and MAD without the full instability of 16 samples. Medium and high noise should improve through the more local rejection reference, while clean, low-noise, stripe, and gradient may regress modestly if the smaller robust-statistic sample is noisy. The cost is only a smaller median sort, with unchanged 128-neighbor covariance support and eigendecomposition count. Ablate by restoring FINAL_STATISTIC_COUNT to 32, exactly recovering the current frontier. The ordered quadratic-jet item remains deferred because its prior prediction failure has no precise diagnostic to address, as required by the batch strategy.	original
119	30d61b87c92be1e9b5cb787358465a6b13f51ac6	17.630768		1.239	104.8	discard			baseline	Estimate final Tukey residual location and scale from a 28-neighbor core while retaining 128-neighbor covariance support	The final 128-neighbor covariance averages positional noise, but curved or density-biased outer samples can shift and inflate the robust residual distribution that controls their own Tukey leverage. The retained 32-neighbor statistic core improved all six development conditions, while the measured 24-neighbor core improved medium and high noise but modestly regressed clean, low-noise, stripe, and gradient accuracy; 28 neighbors is the untested midpoint that may preserve some noise benefit without making the weighted median and MAD as unstable as at 24. Medium and high noise should improve, while clean, low-noise, stripe, and gradient may regress slightly. The cost is only a smaller median sort, with unchanged 128-neighbor covariance support and eigendecomposition count. Ablate by restoring FINAL_STATISTIC_COUNT to 32, exactly recovering the current frontier. The ordered quadratic-jet item remains deferred because its prior prediction failure has no precise diagnostic to address, as required by the batch strategy.	original
120	74523654af09c4f9bf9039a173333765d1aec8e4	17.630704		1.226	96.5	discard			baseline	Estimate final Tukey residual location and scale from a 30-neighbor core while retaining 128-neighbor covariance support	The final 128-neighbor covariance averages positional noise, but curved or density-biased outer samples can shift and inflate the robust residual distribution that determines their own Tukey leverage. The retained 32-neighbor core improved all six development conditions, while reducing it to 28 improved medium, high, and gradient but slightly regressed clean, low-noise, and stripe; 30 is the next untested midpoint. Computing the Gaussian-weighted residual median and MAD from 30 nearest samples should retain part of the medium/high-noise gain from a more query-local rejection reference, with smaller possible clean, low-noise, stripe, and gradient regressions than at 28. The cost is only a slightly smaller median sort, with unchanged 128-neighbor covariance support and three eigendecompositions. Ablate by restoring FINAL_STATISTIC_COUNT to 32, exactly recovering the current frontier.	original
121	0c301b97330c7b2b536027d1c3ac27ccd2bed373	17.624252		1.216	96.9	discard			low	Estimate final Tukey residual location from 32 neighbors and scale from 48 neighbors	The retained 32-neighbor statistic core makes the residual center query-local, reducing curvature and density bias, but using the same small core for MAD can make the rejection scale noisy. Keep the Gaussian-weighted residual median on the nearest 32 samples, estimate sigma = 1.4826 weighted_median(|e - m_32|) from the nearest 48, and apply Tukey weights to all 128 final-covariance samples. Low-, medium-, and high-noise conditions should improve through a stabler scale; clean, stripe, and gradient may regress if the broader scale reflects curvature and preserves biased tail samples. The cost is a 48-value scale sort instead of 32 values, with unchanged support and eigendecomposition count. Ablate by setting FINAL_SCALE_COUNT to 32, exactly recovering the frontier estimator.	original
122	894948dfb7913302206414fba60fad48ae296af7	17.623986		1.184	96.9	discard			low	Estimate final Tukey residual location from 24 neighbors while retaining the 32-neighbor scale estimate	The retained 32-neighbor weighted residual median and MAD balance query locality against statistical stability, but curvature or asymmetric density can still offset the residual center while the scale itself benefits from all 32 samples. The measured joint 24-neighbor location-scale probe improved medium and high noise but regressed clean, low-noise, stripe, and gradient conditions, so this independently separates those roles: compute the final residual median from 24 neighbors, compute MAD around that median from 32 neighbors, and apply the resulting Tukey weights to all 128 covariance samples. Medium and high noise should improve if their measured gain came from a more local residual center; clean, low-noise, stripe, and gradient may regress if the 24-sample location is unstable. The cost is a smaller location sort with unchanged covariance support and eigendecomposition count. Ablate by setting FINAL_LOCATION_COUNT to 32, exactly recovering the frontier estimator.	original
123	83ae5c635255b44a370449bd33ca965f477fa625	17.642633		1.179	99.4	discard			baseline	Estimate final Tukey residual location from 32 neighbors and scale from 24 neighbors	The retained 32-neighbor residual median is query-local, but estimating MAD over the same radius can let curvature or asymmetric density inflate the rejection scale and preserve biased outer samples. Keep the final residual location fixed at its retained 32-neighbor weighted median, estimate sigma = 1.4826 weighted_median(|e - m_32|) from only the nearest 24 samples, and apply the resulting Tukey weights to all 128 covariance samples. The joint 24-neighbor probe improved medium and high noise while the 24-neighbor location-only probe lost high-noise accuracy, so isolating the more local scale should test whether it supplies that noise gain without destabilizing the center. Medium and high noise should improve; clean, low-noise, stripe, and gradient may regress if the 24-sample MAD is noisy or too small. The cost is a smaller scale sort with unchanged covariance support and eigendecomposition count. Ablate by restoring FINAL_SCALE_COUNT to 32, exactly recovering the frontier estimator.	original
124	8883a5187798a39b4aef1825f24a5eeb626c556e	17.539547	14.705215	1.09	97.3	keep			baseline	Estimate first-pass Tukey residual location and scale from a 64-neighbor core while retaining 112-neighbor covariance support	The first robust refinement currently lets all 112 residuals define their own weighted median and MAD, so curved or density-biased outer samples can shift or inflate the rejection reference before the local plane is corrected. Compute the first-pass Gaussian-weighted residual median and MAD from the nearest 64 samples, then apply the resulting Tukey weights to all 112 covariance samples; mathematically this separates the locality of the robust reference distribution from the support used for noise averaging, as already beneficial in the final refinement. Clean, low-noise, stripe, and gradient conditions should improve through lower neighborhood bias; medium and high noise may regress because residuals come from the broad provisional normal and 64 samples give a less stable first-pass scale. The cost is only a smaller median sort, with unchanged covariance support and eigendecomposition count. Ablate by restoring FIRST_STATISTIC_COUNT to 112, exactly recovering the current frontier estimator. The ordered quadratic-jet item remains deferred because its prior prediction crash has no precise diagnostic to address, as required by the batch strategy.	original
125	dee737d4500ad58aca07a82fba835e0d97c62dcb	17.436335		1.046	97.2	provisional			baseline	Reduce the first-pass Tukey residual-statistic core from 64 to 32 neighbors while retaining 112-neighbor covariance support	The retained 64-neighbor first-pass statistic core improved every condition, showing that curved or density-biased outer residuals had been shifting and inflating the robust reference distribution before the local plane was corrected. Reducing only that core to 32 neighbors tests the next query-local scale anchor: compute the Gaussian-weighted residual median m and MAD scale sigma from the nearest 32 samples, then apply Tukey weights (1 - ((e - m)/(4.62 sigma))^2)^2 to all 112 covariance samples. Clean, stripe, and gradient conditions should improve through lower curvature and neighborhood bias; low, medium, and high noise may also improve if tail contamination dominates, but may regress because residuals from the broad provisional plane make a 32-sample location and scale less stable. The cost is a smaller median sort with unchanged covariance support and eigendecomposition count. Ablate by restoring FIRST_STATISTIC_COUNT to 64, exactly recovering the current frontier estimator.	original
126	b9fe9aae2529793d9481d9a4ac2dbb5addefcd91	17.418577		1.048	98.4	discard			baseline	Reduce the first-pass Tukey residual-statistic core from 32 to 16 neighbors while retaining 112-neighbor covariance support	The retained 64-neighbor first-pass statistic core improved all conditions, and the provisional 32-neighbor core further improved low, medium, high, and gradient accuracy, indicating that curved or density-biased outer residuals still shift or inflate the robust reference distribution before the local plane is corrected. Reducing only this core to 16 neighbors is the next untested scale anchor: compute the Gaussian-weighted residual median and MAD from the nearest 16 samples, then apply the same Tukey weights to all 112 covariance samples. Medium and high noise and gradient may improve if removing tail contamination dominates; clean, low-noise, and stripe may regress because residuals from the broad provisional plane make a 16-sample location and scale less stable. The cost is a smaller median sort with unchanged covariance support, fit count, and asymptotic complexity. Ablate by restoring FIRST_STATISTIC_COUNT to 32, exactly recovering the current provisional frontier.	original
127	7a657db5b4cf4317e5750c9335fd6a2acc2934c5	17.414162		1.069	97.1	discard			baseline	Reduce the first-pass Tukey residual-statistic core from 32 to 24 neighbors while retaining 112-neighbor covariance support	The first robust refinement uses residuals from the broad provisional plane, and curved or density-biased outer samples can shift and inflate the Tukey location and scale that determine their own leverage. The retained 32-neighbor core improved low, medium, high, and gradient accuracy over 64 neighbors, while the measured 16-neighbor core further improved medium and high noise but regressed clean, low-noise, stripe, and gradient conditions through unstable statistics; 24 is the next untested midpoint. Compute the Gaussian-weighted residual median and MAD from the nearest 24 samples, then apply the unchanged Tukey weights to all 112 covariance samples. Medium and high noise may improve through a more query-local rejection reference, while clean, low-noise, stripe, and gradient may regress modestly if the smaller first-pass statistic is less stable. The cost is a smaller median sort with unchanged covariance support, fit count, and asymptotic complexity. Ablate by restoring FIRST_STATISTIC_COUNT to 32, exactly recovering the current frontier estimator.	original
128	8c80d62e3a01e11dcc1e521d5d9205fbcbc90baf	17.434364		1.015	108.1	discard			baseline	Reduce the first-pass Tukey residual-statistic core from 32 to 28 neighbors while retaining 112-neighbor covariance support	Curved or density-biased outer residuals from the broad provisional plane can shift and inflate the first Tukey location and scale, allowing those samples to preserve their own leverage. The retained 32-neighbor core improved low, medium, high, and gradient accuracy over 64 neighbors, while the measured 24-neighbor core further improved medium and high noise but regressed stripe; 28 is the next untested midpoint. Compute the Gaussian-weighted residual median and MAD from the nearest 28 samples, then apply the unchanged Tukey weights to all 112 covariance samples. Medium and high noise and gradient should improve through a more query-local rejection reference; clean and low noise should remain near the frontier, while stripe may regress if the smaller statistic core is unstable. The cost is only a smaller median sort, with unchanged covariance support, fit count, and asymptotic complexity. Ablate by restoring FIRST_STATISTIC_COUNT to 32, exactly recovering the current frontier estimator.	original
129	11e8b7ec7d7ba99b80220e0cece566148b9572f1	17.418637		1.016	110.2	discard			low	Estimate first-pass Tukey residual location from 32 neighbors and scale from 24 neighbors	The retained 32-neighbor first-pass residual core improves noise robustness and gradient accuracy, but using one radius for both robust location and scale conflates two roles: the median needs enough samples to stably locate the provisional surface sheet, whereas MAD measured farther from the query can be inflated by curvature or asymmetric density and preserve biased samples. Keep the first-pass Gaussian-weighted residual median on 32 neighbors, estimate sigma = 1.4826 weighted_median(|e - m_32|) from the nearest 24, and apply the unchanged Tukey weights to all 112 covariance samples. Medium and high noise should improve if the measured gains from smaller joint cores came from a more local rejection scale; clean, low-noise, stripe, and gradient may regress if the 24-sample MAD is unstable or too small. The cost is only a smaller scale sort, with unchanged covariance support and eigendecomposition count. Ablate by setting FIRST_SCALE_COUNT to 32, exactly recovering the current frontier estimator.	original
130	a91941d4bfc3d5e3ff706b1a68ad3719c2522c6b	17.43673		1.03	97.4	discard			low	Estimate first-pass Tukey residual location from 24 neighbors while retaining the 32-neighbor scale estimate	The broad provisional plane can leave the query-local residual sheet offset by curvature or asymmetric density, so its robust location should be more local than the scale used to judge residual spread. Compute the first-pass Gaussian-weighted residual median from the nearest 24 samples, retain the MAD scale from 32 samples around that median, and apply the resulting Tukey weights to all 112 covariance samples. This independently tests whether the medium/high gains of smaller joint statistic cores came from localizing the center rather than destabilizing the scale; the complementary 32-location/24-scale experiment worsened clean, low, and stripe. Clean, low-noise, and gradient conditions should improve through lower offset bias, while medium/high noise and stripe may regress if the 24-sample center is unstable; the complementary scale-only probe indicates its noise gains came from localizing scale rather than location. The cost is one smaller median sort with unchanged covariance support and eigendecomposition count. Ablate by setting FIRST_LOCATION_COUNT to 32, exactly recovering the frontier estimator. The ordered quadratic-jet item remains deferred because its prior prediction crash has no precise diagnostic to address.	original
