iteration	candidate_commit	dev_rmse	val_rmse	runtime_s	memory_mb	status	failure_stage	failure_message	complexity	description	rationale	source
167	9bc1810a85900763efb4c6b791722f3cb752265d	17.316307		1.326	97.5	discard			baseline	Relax the third-refinement sheet-thickness gate from 0.10 to 0.125 local radii	The retained thickness gate captures most of the unconditional third Tukey step's large clean, low-noise, stripe, and gradient gains while nearly eliminating its medium/high-noise losses, but it also leaves measurable geometry-sensitive gains unused. Raising the dimensionless acceptance boundary from sigma / r_112 <= 0.10 to <= 0.125 is the next modest parameter anchor: it admits slightly thicker coherent sheets to the already-computed third redescending fit, reducing residual curvature, asymmetric-density, and outlier leverage. Clean, low-noise, stripe, and gradient conditions should improve; medium and high noise may regress as more noise-dominated patches lose effective covariance support. The fit count, runtime order, and memory are unchanged. Ablate by restoring the boundary to 0.10, exactly recovering the current frontier estimator; forcing it false still removes the third-step mechanism entirely.	original
168						crash	quality.ruff-fix	Ruff exited with status 1	medium	Require angular stability before accepting the gated third Tukey refinement	The retained thickness gate identifies coherent sheets where a third redescending fit removes curvature, density, and outlier leverage, but it still causes tiny medium/high-noise regressions because a low residual thickness does not guarantee that the resulting eigendirection is stable. In addition to sigma / r_112 <= 0.10, accept the third normal only when its sign-invariant angle from the two-step normal is at most 5 degrees, equivalently |n_2 dot n_3| >= cos(5 degrees). This preserves small corrective rotations on clean, low-noise, stripe, and gradient patches while rejecting large noise-driven changes; unusually biased geometry requiring a correction above 5 degrees may regress. The cost is one dot product and comparison per query, with no extra fit. Ablate by removing the angular condition, exactly recovering the retained thickness-gated estimator.	original
169	83656714c6193c86b14ad0451c383b79033849dd	17.372323		1.313	113.7	discard			medium	Require five-degree angular stability before accepting the gated third Tukey refinement	The retained residual-thickness gate identifies coherent local sheets where a third redescending fit reduces curvature, density, and outlier bias, but it still causes tiny medium- and high-noise regressions because low thickness alone does not ensure a stable normal update. In addition to sigma / r_112 <= 0.10, accept the third normal only when its sign-invariant rotation from the two-step normal is at most five degrees, equivalently |n_2 dot n_3| >= cos(5 degrees). This should preserve small corrective rotations and improve clean, low-noise, stripe, and gradient patches while rejecting large noise-driven updates to protect medium and high noise; geometry requiring a correction above five degrees may regress. The cost is one dot product and comparison per query with no extra fit. Ablate by removing the angular condition, exactly recovering the retained thickness-only gate. The prior attempt failed during Ruff processing and produced no measurement, so this remains an untested conceptual hypothesis implemented with explicit shaped arrays and formatted NumPy expressions.	original
170	1436c5524577a1ba2d76662afc18e0529ffeef34	17.468493		1.326	97.5	discard			medium	Require sufficient effective sample support before accepting the gated third Tukey refinement	The retained thin-sheet gate lets a third redescending fit remove curvature-, density-, and outlier-induced leverage, but measured medium/high-noise regressions are attributed to that fit reducing covariance support; the rejected angular gate also blocked useful geometric corrections rather than measuring this failure directly. In addition to sigma / r_112 <= 0.10, accept the third normal only when the normalized final weights have Kish effective count 1 / sum_i w_i^2 at least 64, half of the 128-point patch. This directly rejects poorly supported updates while permitting large, well-supported corrections. Medium and high noise should improve; clean, low-noise, stripe, and gradient should retain most third-step gains, though patches with genuine sparse inlier sheets may regress. The cost is one sum of squared weights per query and a scalar comparison. Ablate by removing the effective-count condition, exactly recovering the retained thickness-only gate.	original
171	e1a61d74dc1747f25c479517662b795c69c8aaab	17.330179		1.33	97.6	discard			medium	Require a modest 32-sample effective support before accepting the thin-sheet third Tukey refinement	The retained thickness gate identifies sheets where a third redescending fit removes curvature, density, and outlier bias, but its small medium/high-noise regressions indicate that some accepted fits have too little covariance support. The prior 64-sample Kish-count gate directly addressed that issue and improved both noisy conditions, but rejected too many useful geometry corrections and substantially regressed clean, low-noise, stripe, and gradient cases. This untested lower threshold requires N_eff = 1 / sum_i(w_i^2) >= 32 after weight normalization, only one quarter of the 128-point final patch, so it rejects severely collapsed noise-driven fits while retaining more coherent sparse sheets than the measured 64 threshold. Medium and high noise should improve modestly; clean, low-noise, stripe, and gradient may regress slightly if useful third-step fits have low effective support, but should retain more of the frontier gain than at 64. The cost is one sum of squared weights and comparison per query. Ablate by removing the effective-count condition, exactly recovering the retained thickness-only gate.	original
172	afeab7d644d6b9d3435a5317b8bdbaf561fd4101	17.402337		1.323	113.7	discard			medium	Replace hard third-refinement acceptance with a residual-thickness confidence blend	The retained hard gate applies the entire third Tukey update to every patch just below sigma / r_112 = 0.1 and none just above it, although residual thickness is continuous and near-boundary patches are the most likely to be noise- or curvature-ambiguous. Sign-align the third normal to the two-step normal and return normalize((1-a) n_2 + a n_3), where a = clip(1 - sigma / (0.1 r_112), 0, 1). Very thin coherent sheets retain most of the extra curvature-, density-, and outlier-bias correction, while thicker accepted sheets receive an attenuated update rather than a full support-reducing refit. Medium and high noise should improve by limiting marginal third-step corrections; clean, low-noise, stripe, and gradient may regress slightly because patches near the old boundary receive less correction. The cost is one dot product, blend, and normalization per query with no extra fit. Ablate by replacing a with the hard indicator sigma / r_112 <= 0.1, exactly recovering the current frontier selection.	original
173	3548e0e007c3d7d0f2a14985ddba877cf8397e65	17.326664		1.371	100.8	discard			baseline	Relax only the gated third Tukey-biweight cutoff from 2.77 to 3.23 weighted-MAD sigmas	The retained thin-sheet gate makes a third redescending refinement highly beneficial on clean, low-noise, stripe, and gradient patches, but its small medium/high-noise regressions indicate that repeating the strict 2.77-sigma rejection can remove too much valid covariance support. Raise only the third-pass Tukey boundary to 3.23 while leaving initialization, both retained refinements, the 0.10 thickness gate, and all statistic cores unchanged. Because Tukey weights are (1 - u^2)^2 inside the cutoff, the larger denominator downweights ordinary residuals less while still giving zero leverage to extreme outliers. Medium and high noise should improve through greater effective support; clean, low-noise, stripe, and gradient may regress if curvature- or density-biased residuals regain leverage. This changes one scalar with no runtime or asymptotic cost. Ablate by restoring the third cutoff to 2.77, exactly recovering the frontier estimator. The ordered quadratic-jet retry remains skipped because its prior prediction crash has no precise diagnostic to address.	original
174	c836e9651637e7fc5deec69c274a101e550d1794	17.337933		1.325	113.5	discard			baseline	Tighten only the thin-sheet third Tukey cutoff from 2.77 to 2.31 weighted-MAD sigmas	The retained thickness gate restricts the third refinement to coherent local sheets, but moderate curvature-, asymmetric-density-, or outlier-induced residuals can still influence its covariance at the 2.77-sigma redescending boundary. The preceding relaxation to 3.23 slightly improved support-sensitive low/high noise but regressed stripe accuracy, so this independently tests the unmeasured opposite direction only in the gated third pass. Lowering its Tukey boundary to 2.31 gives zero leverage to moderate geometric residuals earlier, while the first two fits, statistic cores, and 0.10 thickness gate remain unchanged. Clean, stripe, and gradient conditions should improve through lower neighborhood bias; low noise may also improve on coherent sheets, while medium and high noise may regress if valid residuals lose effective support. This changes one scalar with no runtime or asymptotic cost. Ablate by restoring the third cutoff to 2.77, exactly recovering the frontier estimator. The ordered quadratic-jet retry remains skipped because its prior prediction crash has no precise diagnostic to address.	original
175	c071fd4ad542d73ea7dbdfe1c9fec402663e9d23	17.357907		1.321	103.6	discard			baseline	Tighten the third-refinement sheet-thickness gate from 0.10 to 0.075 local radii	The retained third Tukey refinement removes substantial curvature, density, and outlier bias on thin coherent sheets, but still causes small medium- and high-noise regressions when a noise-affected patch happens to satisfy the 0.10 residual-thickness gate. Lowering the dimensionless acceptance threshold from sigma / r_112 <= 0.10 to <= 0.075 restricts the already-computed third fit to more confidently thin sheets, directly targeting this noise misclassification without changing its robust objective. Medium and high noise should improve by retaining the two-step estimate on more uncertain patches; clean, low-noise, stripe, and gradient conditions may regress because fewer useful geometric corrections are accepted. This changes one scalar with no runtime or asymptotic cost. Ablate by restoring the threshold to 0.10, exactly recovering the validated frontier estimator.	original
176	00c8f57d8c127248b0b26d5da8161f7084225e0d	17.315233		1.317	102.0	discard			baseline	Relax the third-refinement sheet-thickness gate from 0.10 to 0.15 local radii	The retained third Tukey refinement removes curvature-, density-, and outlier-induced leverage on coherent local sheets, but the 0.10 residual-thickness gate leaves some useful geometric corrections unused. The measured relaxation to 0.125 improved clean, low-noise, stripe, and gradient conditions with only small medium/high-noise regressions, so 0.15 is the next untested scale anchor in that supported direction. Accepting the already-computed third normal when sigma / r_112 <= 0.15 should further improve those four geometry-sensitive conditions; medium and high noise may regress because more noise-affected patches undergo another redescending fit and lose effective support. This changes one dimensionless scalar with no runtime or asymptotic cost. Ablate by restoring the threshold to 0.10, exactly recovering the validated frontier estimator.	original
177	0efad5b87fe16c928dc4a94b6bd7824b2426271f	17.353052		1.342	113.7	discard			medium	Require local residual thickness to contract from the broad PCA thickness before accepting the third Tukey refinement	The retained absolute thin-sheet gate can misclassify a noise-affected patch whose 32-neighbor residual MAD happens to fall below 0.10 local radii, causing an unnecessary third redescending fit and the measured medium/high-noise regressions. This change additionally requires sigma_local <= 0.5 sqrt(lambda_min,broad), where sqrt(lambda_min,broad) is the RMS thickness of the 224-neighbor provisional PCA patch. The dimensionless contraction test accepts the third fit only when robust localization has exposed a sheet substantially thinner than its broad neighborhood, evidence that curvature, density variation, or outliers rather than spatially persistent noise inflated the broad fit. Medium and high noise should improve by retaining the two-step normal when thickness persists across scales; clean, low-noise, stripe, and gradient conditions may regress if a useful third correction occurs without a twofold thickness contraction. The cost is retaining the initial smallest eigenvalue and one scalar comparison per query, with no extra fit. Ablate by removing the contraction condition, exactly recovering the validated absolute-thickness gate.	original
178	f85c57566305a70adcc2d0873d62fb88651667dc	17.34545		1.41	105.6	discard			medium	Require the third Tukey refinement to reduce query-local robust residual thickness	The retained absolute thin-sheet gate can accept a noise-driven third normal whenever its pre-refit 32-neighbor weighted-MAD thickness happens to be below 0.10 local radii. After computing the existing third fit, measure the same query-local weighted-MAD thickness around its new plane and accept that normal only if the thickness does not increase. This directly checks that the update better explains the coherent local sheet rather than merely rotating a redescending covariance with reduced support. Medium and high noise should improve by rejecting locally destabilizing updates; clean, low-noise, stripe, and gradient conditions may regress when a useful tangent correction slightly increases MAD despite reducing angular bias. The cost is one additional 32-value weighted median after the already-computed third eigendecomposition. Ablate by removing the post-fit contraction condition, exactly recovering the validated absolute-thickness gate.	original
179	b964422ded021ac4c7cc208c706437840105bd96	17.324384		1.314	97.4	discard			baseline	Reduce only the gated third Tukey refinement from 128 to 112 neighbors	The retained third refinement targets curvature, asymmetric-density, and outlier leverage on thin coherent sheets, but using the full 128-neighbor final patch can let coherent curvature in its outer Gaussian tail survive redescending rejection and tilt the extra correction. Compute the first two retained fits and the 32-neighbor thickness gate unchanged, then form only the already-gated third covariance from the nearest 112 samples; this makes the final correction more query-local without weakening the 128-neighbor second fit that supplies positional-noise averaging. Clean, low-noise, stripe, and gradient conditions should improve through lower neighborhood bias; medium and high noise may regress if accepted third fits need the extra 16 samples, though the thin-sheet gate should limit that exposure. The change reduces third-pass median and covariance work and adds no mechanism or eigendecomposition. Ablate by restoring the third refinement support to 128, exactly recovering the validated frontier. The ordered quadratic-jet retry remains skipped because its prior prediction crash has no precise diagnostic to address.	original
180	8dccd272e4932ba165a0e6224ee0aa29a8c02064	17.327358		1.352	105.5	discard			baseline	Reduce only the gated third Tukey refinement from 128 to 120 neighbors	The thin-sheet third refinement targets residual curvature, asymmetric-density, and outlier leverage, but its outer 128-neighbor Gaussian tail can still rotate the extra correction away from the query-local tangent. The measured 112-neighbor third pass improved clean, high-noise, stripe, and gradient conditions but slightly regressed low and medium noise, establishing a locality-versus-support trade-off; 120 neighbors is the untested midpoint. Forming only the already-gated third covariance from 120 samples should retain part of the clean, stripe, gradient, and possibly high-noise improvement while losing less low/medium-noise averaging than 112. The change removes eight samples only from the third median and covariance, with no new fit or mechanism. Ablate by restoring THIRD_REFINEMENT_COUNT to 128, exactly recovering the validated frontier estimator.	original
181	f9beb15229a5846a6a3a35f09dad6ea3ebd28d25	17.328536		1.326	113.3	discard			baseline	Reduce only the gated third Tukey refinement from 128 to 124 neighbors	The thin-sheet third refinement targets residual curvature, asymmetric-density, and outlier leverage, but its outer 128-neighbor Gaussian tail can rotate the extra correction away from the query-local tangent. Measured 112- and 120-neighbor third passes both improved clean, high-noise, stripe, and gradient conditions while slightly regressing low and medium noise; 124 is the untested midpoint between the retained 128 support and the measured 120 support. Forming only the already-gated third covariance from 124 samples should preserve part of those geometry-sensitive gains while retaining more low/medium-noise averaging than 120. The change removes four samples only from the third median and covariance, with no new fit or mechanism. Ablate by restoring THIRD_REFINEMENT_COUNT to 128, exactly recovering the validated frontier estimator.	original
182	0082731bbab09bc1f99db9af92ae1af053bf4965	17.329265		1.318	97.5	discard			baseline	Reduce only the gated third Tukey refinement from 128 to 126 neighbors	The thin-sheet third refinement targets residual curvature, asymmetric-density, and outlier leverage, but its outer 128-neighbor Gaussian tail can rotate the extra correction away from the query-local tangent. Measured 112-, 120-, and 124-neighbor third passes all improved clean, high-noise, stripe, and gradient conditions while slightly regressing low and medium noise; 126 is the next untested midpoint between the retained 128 support and the measured 124 support. Forming only the already-gated third covariance from 126 samples should preserve a smaller part of those geometry-sensitive gains while retaining more low/medium-noise averaging than 124. The change removes two samples only from the third median and covariance, with no new fit or mechanism. Ablate by restoring THIRD_REFINEMENT_COUNT to 128, exactly recovering the validated frontier estimator.	original
183						crash	quality.ruff-fix	Ruff exited with status 1	baseline	Reduce only the gated third Tukey refinement from 128 to 127 neighbors	The thin-sheet third refinement targets residual curvature, asymmetric-density, and outlier leverage, but the outermost sample of its 128-neighbor Gaussian tail can still rotate the extra correction away from the query-local tangent. Measured third-pass supports of 112, 120, 124, and 126 consistently improved clean, high-noise, stripe, and gradient conditions while slightly regressing low- and medium-noise conditions; 127 is the final untested support point between 126 and the retained 128 endpoint. Removing only neighbor 128 should preserve a minimal part of those geometry-sensitive gains while sacrificing less low/medium-noise averaging than every measured narrower support. The change removes one sample only from the already-gated third median and covariance, with no new fit or asymptotic cost. Ablate by restoring THIRD_REFINEMENT_COUNT to 128, exactly recovering the validated frontier estimator. The ordered quadratic-jet retry remains skipped because its prior prediction crash has no precise diagnostic to address.	original
184	882a2fb32caa0c5dc4891bb1d879bfb36c226b1c	17.329567		1.32	105.6	discard			baseline	Reduce only the gated third Tukey refinement from 128 to 127 neighbors	The thin-sheet third refinement targets residual curvature, asymmetric-density, and outlier leverage, but the outermost sample of its 128-neighbor Gaussian tail can still rotate the correction away from the query-local tangent. Supports of 112, 120, 124, and 126 consistently improved clean, high-noise, stripe, and gradient conditions while slightly regressing low- and medium-noise conditions; 127 is the final unmeasured support point because the previous attempt failed during Ruff processing rather than evaluation. Removing only neighbor 128 should preserve a minimal geometry-sensitive gain with less loss of low/medium-noise averaging than narrower supports. The cost is one fewer sample in only the already-gated third covariance, with no new fit or asymptotic complexity. Ablate by restoring THIRD_REFINEMENT_COUNT to 128, exactly recovering the validated frontier estimator.	original
