iteration	candidate_commit	dev_rmse	val_rmse	runtime_s	memory_mb	status	failure_stage	failure_message	complexity	description	rationale	source
79	c14adf67c0054f78192df94440cf582ceb2b502a	17.690178		1.282	87.8	provisional			baseline	Tighten only the first Tukey-biweight cutoff from 4.62 to 3.69 weighted-MAD sigmas	Residuals from the broad provisional PCA can contain curvature-, asymmetric-density-, and outlier-induced deviations that retain substantial leverage before the final robust fit. Lowering only the first Tukey cutoff from 4.62 to 3.69 moves its half-weight point from approximately 2.5 to 2.0 robust-scale sigmas, rejecting moderate geometric contamination earlier while leaving the retained final cutoff unchanged. The opposite first-pass relaxation to 5.54 worsened clean, medium, high, stripe, and gradient accuracy, so this tests the unmeasured stricter direction. Clean, stripe, and gradient conditions should improve through a less biased intermediate plane; low, medium, and high noise may regress if widespread valid residuals lose covariance support, with the low-noise risk specifically indicated by the prior relaxed-cutoff result. This changes one scalar with no runtime or asymptotic cost. Ablate by restoring the first cutoff to 4.62 with every other computation unchanged. The quadratic-jet batch item is deferred because its prior prediction crash has no precise diagnostic to address.	original
80	9a21687ca4f9177550200e631b1d692aef0a3e16	17.583765	14.805164	1.301	82.4	discard			baseline	Tighten the first Tukey-biweight cutoff from 3.69 to 2.77 weighted-MAD sigmas	The broad provisional PCA plane can still pass moderate curvature-, asymmetric-density-, and outlier-induced residuals into the first robust covariance, biasing the intermediate normal used by the final fit. Lowering only the first Tukey cutoff from 3.69 to 2.77 moves its half-weight point from approximately 2.0 to 1.5 robust-scale sigmas and makes both refinements use the same redescending loss, while leaving neighborhood support, Gaussian weighting, and the final cutoff unchanged. The measured tightening from 4.62 to 3.69 improved clean, medium, high, stripe, and gradient conditions, so those conditions should improve further if moderate geometric contamination is dominant; low noise may regress, as it did in that probe, if valid residuals are rejected. This parameter adds no runtime or asymptotic cost. Ablate by restoring only the first cutoff to 3.69, exactly recovering the current frontier estimator. The quadratic-jet batch item remains skipped because its prior prediction crash has no precise diagnostic to address.	original
81	527f382d8b25aa3816b32eac979665145b0f4db5	17.633485		1.311	86.9	provisional			baseline	Tighten only the first Tukey-biweight cutoff from 4.62 to 3.23 weighted-MAD sigmas	Residuals from the broad provisional PCA plane can contain curvature-, asymmetric-density-, and outlier-induced deviations that bias the first robust covariance before the final fit. Lowering only the first Tukey cutoff to 3.23 rejects moderate geometric contamination earlier while leaving the 2.77 final cutoff and every neighborhood choice unchanged. The measured 3.69 and 2.77 first-pass anchors both substantially improved medium and high noise, clean, and gradient accuracy over 4.62, but 2.77 added low-noise and stripe losses; 3.23 is the untested midpoint intended to preserve most noise and neighborhood-bias gains with less over-rejection. Medium and high noise, clean, and gradient should improve; low noise may regress and stripe may remain near neutral because valid residuals lose support. This changes one scalar with no runtime or asymptotic cost. Ablate by restoring the first cutoff to 4.62. The quadratic-jet batch item remains deferred because its prior prediction crash has no precise diagnostic to address.	original
82	a3f0d846de65873ba82f59aa7ac00771fc7edc7f	17.607057		1.31	80.4	discard			baseline	Tighten only the first Tukey-biweight cutoff from 3.23 to 3.0 weighted-MAD sigmas	Residuals from the broad provisional PCA plane can contain moderate curvature-, asymmetric-density-, and outlier-induced deviations that bias the first robust covariance before the final fit. Lowering only the first Tukey cutoff from 3.23 to 3.0 moves its redescending boundary inward while leaving the final 2.77 cutoff, neighborhoods, Gaussian kernel, and weighted scale estimate unchanged. The measured 3.23 and 2.77 anchors both improved clean, medium, high, and gradient accuracy over the original 4.62 cutoff, while 2.77 incurred larger low-noise and stripe losses; 3.0 is the untested midpoint intended to gain additional medium/high noise and neighborhood-bias rejection without all of that over-rejection. Clean, medium, high, and gradient should improve; low noise and stripe may regress as valid residuals lose support. This changes one scalar with no runtime or asymptotic cost. Ablate by restoring the first cutoff to 3.23. The quadratic-jet item remains deferred because its prior prediction crash has no precise diagnostic to address.	original
83	2cbe1d3be57d8f9bf37a5ec814bcf2db79acae6c	17.613678		1.263	94.1	discard			baseline	Tighten only the final Tukey-biweight cutoff from 2.77 to 2.54 weighted-MAD sigmas	After the first 3.23-sigma Tukey refinement has corrected the broad provisional plane, moderate residuals from curvature, asymmetric density, or sparse outliers can still tilt the final covariance. Lowering only the final redescending cutoff from 2.77 to 2.54 removes that geometric leverage slightly earlier while preserving the current neighborhoods, Gaussian kernel, weighted location-scale estimate, and first-pass rejection. The earlier 2.31 final-cutoff probe improved clean, medium, high, stripe, and gradient conditions but regressed low noise; 2.54 is the untested midpoint toward that anchor and should recover part of those five gains with less valid-sample rejection, while low noise may still regress. This changes one scalar with no runtime or asymptotic cost. Ablate by restoring the final cutoff to 2.77 with every other computation unchanged. The quadratic-jet batch item remains deferred because its prior prediction crash has no precise diagnostic to address.	original
84	29656be2b0124c8900d28c98b5e96b19e57cbe66	17.618118		1.262	80.3	discard			baseline	Tighten only the first Tukey-biweight cutoff from 3.23 to 3.1 weighted-MAD sigmas	Residuals from the broad provisional PCA plane can include moderate curvature-, asymmetric-density-, and outlier-induced deviations that bias the first robust covariance before the final fit. Lowering only the first Tukey cutoff from 3.23 to 3.1 moves its redescending boundary inward while leaving the final 2.77 cutoff, neighborhoods, Gaussian kernel, and weighted location-scale estimate unchanged. The measured 3.0 probe improved clean, medium, and high conditions but slightly regressed low noise, stripe, and gradient; 3.1 is a simple intermediate anchor intended to retain most of the geometric-bias and noise gains with less valid-sample rejection. Clean, medium, and high should improve; low and stripe may regress, and gradient should remain near neutral. This changes one scalar with no runtime or asymptotic cost. Ablate by restoring the first cutoff to 3.23 with every other computation unchanged. The quadratic-jet item remains deferred because its prior prediction crash has no precise diagnostic to address.	original
85	0a75aa24069f71ffdaf924bb4e651cdd0f8e8649	17.748073		1.245	80.2	discard			baseline	Reduce broad Tukey-PCA initialization support from 224 to 192 neighbors	The provisional PCA normal is computed from a 224-neighbor Gaussian tail before the two query-local Tukey refinements. Under curvature or asymmetric density, its least-local samples can tilt the provisional tangent and make the first redescending residual classification reject valid local surface points. Reducing only this initialization support to 192 is an untested intermediate anchor between the measured 160- and 224-neighbor staged initializations; the Gaussian bandwidth remains fixed by neighbor 112, and both 112-neighbor robust refinements remain unchanged. Clean, low-noise, stripe, and gradient conditions should improve through lower provisional neighborhood bias, while medium and high noise may regress because the initial covariance averages fewer samples. The change reduces initialization storage and covariance work without adding a mechanism. Ablate by restoring INITIAL_NEIGHBOR_COUNT to 224 with every other setting unchanged. The quadratic-jet batch item remains deferred because its earlier prediction failure has no precise diagnostic to address.	original
86	ae513c64b5912ce8f18aef618f733a03cd02e7b7	17.697872		1.285	95.0	discard			baseline	Reduce broad Tukey-PCA initialization support from 224 to 208 neighbors	The broad provisional PCA uses a 224-neighbor Gaussian tail, whose least-local samples can tilt the initial tangent under curvature or asymmetric density and thereby distort the first redescending residual classification. The measured 192-neighbor probe improved clean, low-noise, and gradient conditions but lost too much medium/high-noise averaging; 208 is the untested midpoint between 192 and 224. Reducing only initialization support to 208 keeps the bandwidth anchored at neighbor 112 and leaves both local Tukey refinements unchanged. Clean, low-noise, and gradient conditions should improve modestly through lower provisional neighborhood bias; stripe may be near neutral, while medium and high noise may regress slightly because the initial covariance averages fewer samples. The change reduces initialization work and adds no mechanism. Ablate by restoring INITIAL_NEIGHBOR_COUNT to 224 with every other setting fixed. The quadratic-jet batch item remains deferred because its prior prediction failure has no precise diagnostic to address.	original
87	24d2a09905206c732789f83b936ce3405d3711c0	17.660994		1.275	88.4	discard			baseline	Reduce broad Tukey-PCA initialization support from 224 to 216 neighbors	The 224-neighbor Gaussian tail stabilizes the provisional PCA normal under positional noise, but its least-local samples can add curvature and asymmetric-density bias before the first redescending residual classification. The measured 192- and 208-neighbor probes improved clean, low-noise, and gradient accuracy while progressively smaller support caused progressively larger medium/high-noise losses; 216 is the next untested midpoint between 208 and the retained 224 anchor. Reducing only initialization support to 216 keeps the Gaussian bandwidth fixed at neighbor 112 and leaves both 112-neighbor Tukey refinements unchanged. Clean, low-noise, and gradient conditions should improve modestly through lower provisional neighborhood bias; stripe may remain near neutral, while medium and high noise may regress slightly from reduced covariance averaging. The change removes eight initialization samples and adds no mechanism or asymptotic complexity. Ablate by restoring INITIAL_NEIGHBOR_COUNT to 224 with every other setting fixed. The quadratic-jet item remains deferred because its prior prediction failure has no precise diagnostic to address.	original
88	86a0b4e479fce0b1c262ee82abe93b93253a4131	17.645685		1.332	80.3	discard			baseline	Reduce broad Tukey-PCA initialization support from 224 to 220 neighbors	The broad provisional PCA uses a 224-neighbor Gaussian tail to stabilize its normal under positional noise, but the least-local samples can add curvature and asymmetric-density bias before the first redescending residual classification. The measured 192-, 208-, and 216-neighbor probes improved clean, low-noise, and gradient accuracy while increasingly reduced support caused increasingly large medium/high-noise losses; 220 is the next untested midpoint between 216 and the retained 224 anchor. Reducing only initialization support to 220 keeps the Gaussian bandwidth fixed at neighbor 112 and leaves both local Tukey refinements unchanged. Clean, low-noise, and gradient conditions should improve slightly through lower provisional neighborhood bias; stripe should remain near neutral, while medium and high noise may regress slightly from reduced covariance averaging. The change removes four initialization samples and adds no mechanism or asymptotic complexity. Ablate by restoring INITIAL_NEIGHBOR_COUNT to 224 with every other setting fixed.	original
89	b8de9eeb7f95a4f4266f0b8ed2aba2b904c7deb6	17.562944	14.80762	1.303	93.5	discard			baseline	Tighten only the first Tukey-biweight cutoff from 3.23 to 2.54 weighted-MAD sigmas	Residuals from the broad provisional PCA can contain moderate curvature-, asymmetric-density-, and outlier-induced deviations that bias the first robust covariance before the final local fit. Lowering only the first Tukey cutoff from 3.23 to 2.54 moves its redescending boundary inward, while leaving the final 2.77 cutoff, neighborhoods, Gaussian kernel, and weighted location-scale estimate unchanged. Measured tightening through 3.0 and 2.77 improved clean, medium, and high conditions, so 2.54 is the next untested strict anchor and should further reduce geometric leverage in those conditions; low noise and stripe may regress because valid residuals from an uncertain provisional plane can be rejected. This changes one scalar with no runtime or asymptotic cost. Ablate by restoring the first cutoff to 3.23 with every other computation unchanged. The quadratic-jet batch item remains deferred because its prior prediction failure has no precise diagnostic to address.	original
90	d03395e2fe3a89b67cfe503110f0b1750dd46c57	17.799541		1.275	81.0	discard			low	Leave the query sample out of the broad and robust weighted PCA covariances	When the cached neighborhood contains the query itself, its zero distance gives it the maximum Gaussian weight even though its positional-noise displacement is the error source shared by every query-relative offset. Masking that one sample produces a leave-one-out local plane from independent neighboring observations, reducing query-induced tangent tilt without changing the neighborhood radius, robust loss, or number of eigendecompositions. Medium and high noise should improve most; clean, low-noise, stripe, and gradient conditions may regress slightly because one exact on-surface sample and a small amount of effective support are removed. The cost is one deterministic index mask per patch. Ablate by retaining the query's Gaussian weight, exactly recovering the frontier estimator. The ordered quadratic-jet item remains deferred because its prior prediction crash has no precise diagnostic to address.	original
91	a8880b296490154ff2b78e6b7bc6384569dfe406	17.810594		1.28	81.0	discard			baseline	Give the query sample half Gaussian weight in all three weighted PCA fits	The query is normally its own zero-distance neighbor and therefore receives maximum Gaussian weight, even though its positional displacement is the noise source shared by all query-relative measurements. The measured leave-one-out probe improved low-noise, high-noise, and stripe conditions but slightly regressed clean, medium-noise, and gradient cases by removing one useful surface sample entirely. Multiplying only the query's spatial weight by 0.5 tests the intermediate bias-variance point: it should retain part of those noise and density gains while preserving more covariance support, with possible small regressions on clean, medium, and gradient conditions. The cost is one deterministic equality mask and multiplication per patch. Ablate by setting QUERY_WEIGHT to 1.0, exactly recovering the frontier estimator.	original
92	f3a11184a766ef3bea478febf87202807fed3e16	17.798905		1.278	82.0	discard			low	Leave the query sample out of only the broad provisional PCA initialization	The query is normally its own maximum-weight neighbor, so its positional displacement can tilt the broad provisional plane whose residuals drive redescending rejection. The measured all-pass leave-one-out probe improved low-noise, high-noise, and stripe conditions but lost clean, medium-noise, and gradient support; this change isolates that mechanism to the 224-neighbor initialization, while both 112-neighbor Tukey refinements retain the query. Low and high noise, and possibly stripe sampling, should improve through less query-induced residual misclassification; clean, medium, and gradient may regress slightly, but retaining the query in both final covariances should reduce the losses seen when all three fits excluded it. The cost is one deterministic index mask and a separate local weight normalization. Ablate by removing the initialization mask, exactly recovering the frontier estimator.	original
93	40a6f83b8bd12e683c316f781706627b21e099db	17.815099		1.282	87.1	discard			low	Leave the query sample out of only the final Tukey-PCA refinement	A cached neighborhood normally contains the query itself at zero distance, giving its positional error maximum Gaussian leverage in the final covariance. The all-pass leave-one-out probe improved low-noise, high-noise, and stripe conditions, while the initialization-only probe showed that removing the query before robust correction does not resolve the medium-noise trade-off. This change preserves the query's stabilizing support in the 224-neighbor initialization and first 112-neighbor refinement, then assigns it zero spatial weight only when estimating the final weighted residual median, MAD, centroid, and covariance. Low and high noise and stripe sampling should improve through less query-induced tangent anchoring; clean, medium, and gradient may regress slightly from losing one final surface sample. The cost is one deterministic equality mask and final-pass weight normalization. Ablate by retaining the query's final Gaussian weight, exactly recovering the frontier estimator.	original
94	4351028bbe54e2f645a8f15b2339d28409361d71	17.81062		1.322	81.5	discard			low	Leave the query sample out of only the first local Tukey-PCA refinement	The query is normally its own zero-distance neighbor and therefore has maximum Gaussian leverage, even though its positional displacement is the error source that can tilt the first query-local correction. Retain the query in the 224-neighbor initialization for a stable provisional normal, assign it zero spatial weight only in the first 112-neighbor Tukey fit so that the corrected plane is estimated from independent neighbors, then restore it in the final fit to recover covariance support. The all-pass and initialization-only leave-one-out probes improved low noise, high noise, and stripe sampling, while the final-only probe traded clean/stripe/gradient accuracy for noise gains; isolating the remaining first refinement should identify whether query-induced residual correction supplies those benefits without permanently discarding the sample. Low and high noise and stripe should improve; clean, medium, and gradient may regress if the omitted sample is useful support. The cost is one deterministic equality mask and one extra local weight normalization. Ablate by retaining the query's first-pass Gaussian weight, exactly recovering the frontier estimator.	original
95	9554a5786af50e73cc169904d72ba966525a823f	17.916047		1.279	80.8	discard			low	Use a rank-Gaussian kernel only for the broad provisional PCA initialization	The 224-neighbor provisional covariance currently weights samples by measured Euclidean distance, but positional noise perturbs those distances and can randomly suppress useful samples before Tukey refinement. On a locally two-dimensional surface, squared radius is approximately proportional to neighbor rank, so exp(-2 j / 111) preserves the intended Gaussian profile (weight exp(-2) at neighbor 112) while making its effective averaging support deterministic. Medium and high noise should improve through a more stable provisional normal, and gradient density may improve because local spacing no longer changes the weight profile; clean, low-noise, and stripe cases may regress because rank ignores genuine geometric distance variation and curvature. The two 112-neighbor refinements retain metric Gaussian weights, confining this low-cost mechanism to initialization. Ablate by restoring exp(-2 d_j^2 / d_112^2) for the provisional covariance.	original
96	ff2a9512d5bf1c8f4a4c3aa13856ce416d9bc68e	17.767349		1.262	80.7	discard			medium	Use final normal eigengap ambiguity to control shrinkage toward the broad provisional PCA normal	The 112-neighbor robust normal is query-local but variance-limited under positional noise, whereas the existing 224-neighbor provisional normal averages noise more effectively but carries curvature and density bias. A previous fixed 10% broad-normal blend substantially improved medium and high noise but regressed clean, low-noise, stripe, and gradient patches. This change makes that shrinkage confidence-dependent: after sign alignment, return normalize((1-a) n_local + a n_broad), where a = 0.1 clip(lambda_0/lambda_1, 0, 1) from the final robust covariance. A well-separated local normal has lambda_0/lambda_1 near zero and remains nearly unchanged; an ambiguous, noise-dominated normal borrows more broad-scale stability. Medium and high noise should improve, while clean, low, stripe, and gradient should regress less than under fixed blending; highly curved patches with a weak eigengap may still inherit broad-neighborhood bias. The cost is one eigenvalue ratio, vector blend, and normalization per query, with no new fit. Ablate by setting the maximum blend to zero, exactly recovering the retained estimator.	original
