iteration	candidate_commit	dev_rmse	val_rmse	runtime_s	memory_mb	status	failure_stage	failure_message	complexity	description	rationale	source
149	fb60db29fdf5e3a8a66cfa097907847c8d00177a	17.472633		1.138	102.1	discard			baseline	Widen only the 224-neighbor provisional-PCA Gaussian bandwidth from the 112th- to the 120th-neighbor radius	The broad provisional PCA supplies the normal whose residuals drive the first redescending refinement, but its Gaussian kernel is still anchored at neighbor 112, so much of the 224-neighbor tail has negligible weight and the initial normal can remain variance-limited under positional noise. Normalize only the provisional weights by the 120th-neighbor radius, while explicitly retaining the 112th-neighbor bandwidth in both robust refinements. This modestly increases effective initialization support without directly broadening either final covariance. Medium and high noise should improve through a stabler provisional tangent; clean, low-noise, stripe, and gradient conditions may regress if coherent curvature or asymmetric density in the broad tail biases the first residual classification. The cost is one additional Gaussian weight vector and no extra eigendecomposition. Ablate by setting INITIAL_BANDWIDTH_COUNT to 112, which makes the initial and refinement kernels identical and exactly recovers the current estimator.	original
150	88ae191a35106ce33aa3115f3ba19def625bbb6c	17.480103		1.132	102.0	discard			baseline	Narrow only the 224-neighbor provisional-PCA Gaussian bandwidth from the 112th- to the 108th-neighbor radius	The broad provisional PCA supplies the normal whose residuals drive the first redescending refinement, but coherent curvature or asymmetric density in its 224-neighbor tail can tilt that normal and misclassify query-local samples. The measured opposite probe, widening the initialization bandwidth to neighbor 120, improved medium/high noise but worsened clean, low-noise, stripe, and gradient accuracy, giving a concrete reason to test a modest narrowing to neighbor 108. Using exp(-2 d^2 / r_108^2) only for initialization suppresses biased tail leverage, while both robust refinements retain the established r_112 kernel. Clean, low-noise, stripe, and gradient should improve; medium and high noise may regress because the provisional covariance averages less effective support. The cost is one separate Gaussian weight vector and no extra eigendecomposition. Ablate by setting INITIAL_BANDWIDTH_COUNT to 112, which makes the initialization kernel match the refinement kernel and exactly recovers the frontier estimator.	original
151	f2d6f66ea48f9025785a49882724dfd0d10ba710	17.484743		1.14	102.1	discard			baseline	Narrow only the 224-neighbor provisional-PCA Gaussian bandwidth from the 112th- to the 110th-neighbor radius	The broad provisional PCA supplies the normal used for first-pass redescending residual classification, but coherent curvature or asymmetric density in its 224-neighbor tail can tilt that normal. The measured r108 initialization improved clean, low-noise, stripe, and gradient accuracy while reducing medium/high-noise averaging, whereas widening to r120 showed the opposite trade-off; r110 is the untested midpoint toward the retained r112 radius. Use exp(-2 d^2 / r110^2) only for the provisional covariance, then explicitly preserve the established r112 Gaussian kernel in both robust refinements. Clean, low-noise, stripe, and gradient conditions should improve through lower neighborhood bias; medium and high noise may regress slightly because initialization has less effective support, but less than at r108. The cost is one separate Gaussian weight vector and no extra eigendecomposition. Ablate by setting INITIAL_BANDWIDTH_COUNT to 112, which makes the initialization and refinement kernels identical and exactly recovers the frontier estimator.	original
152	194828cee90d846398d82ea956967e1142d62365	17.476743		1.159	120.9	discard			baseline	Widen only the 224-neighbor provisional-PCA Gaussian bandwidth from the 112th- to the 116th-neighbor radius	The broad provisional PCA normal drives first-pass Tukey residual classification, but its Gaussian kernel is anchored at neighbor 112, leaving the added tail with limited effective weight and the initialization variance-limited under positional noise. The measured r120 initialization improved medium and high noise but introduced too much clean, low-noise, stripe, and gradient neighborhood bias, while r108 and r110 showed the opposite trade-off; r116 is the untested midpoint between the retained r112 and measured r120 anchors. Use exp(-2 d^2 / r116^2) only for the provisional covariance and preserve exp(-2 d^2 / r112^2) in both robust refinements. Medium and high noise should improve through a stabler provisional tangent; clean, low-noise, stripe, and gradient may regress through curvature or asymmetric-density bias, but less than at r120. The cost is one separate Gaussian weight vector and no extra eigendecomposition. Ablate by setting INITIAL_BANDWIDTH_COUNT to 112, which makes the initialization and refinement kernels identical and exactly recovers the frontier estimator.	original
153	c1eff30de17f9db261edc55e954e3a2ac3891476	17.480433		1.176	101.9	discard			baseline	Widen only the 224-neighbor provisional-PCA Gaussian bandwidth from the 112th- to the 114th-neighbor radius	The broad provisional PCA normal drives first-pass Tukey residual classification, but its Gaussian kernel is anchored at neighbor 112, limiting effective noise averaging in the 224-neighbor tail. The measured r116 initialization improved medium and high noise but added too much curvature and asymmetric-density bias to clean, low-noise, stripe, and gradient patches, while r108 and r110 showed the opposite trade-off; r114 is the next untested midpoint between the retained r112 and measured r116 anchors. Use exp(-2 d^2 / r114^2) only for the provisional covariance, while preserving exp(-2 d^2 / r112^2) in both robust refinements. Medium and high noise should improve through a stabler provisional tangent; clean, low-noise, stripe, and gradient may regress through neighborhood bias, but less than at r116. The cost is one separate Gaussian weight vector and no extra eigendecomposition. Ablate by setting INITIAL_BANDWIDTH_COUNT to 112, which makes the initialization and refinement kernels identical and exactly recovers the frontier estimator.	original
154	6455a95a7fd74d2e96828bbd761e972abb098e01	17.400428	14.713823	1.045	98.0	discard			baseline	Reduce the first-pass Tukey residual-statistic core from 64 to 32 neighbors while retaining 120-neighbor covariance support	The 120-neighbor first robust covariance improves positional-noise averaging, but allowing 64 residuals from the broad provisional plane to define Tukey location and scale can still let curvature- or density-biased samples shift or inflate their own rejection reference. Compute the Gaussian-weighted residual median m and MAD scale sigma from only the nearest 32 samples, then apply w = (1 - ((e - m)/(4.62 sigma))^2)^2 inside the cutoff to all 120 covariance samples. The earlier 32-core probe at 112-point support improved low, medium, high, and gradient conditions while slightly regressing clean and stripe, so combining that independently measured locality with the retained 120-point covariance should strengthen noise and gradient accuracy without giving up averaging support; clean and stripe may regress from less stable statistics. The cost is a smaller median sort and no additional fit or asymptotic complexity. Ablate by restoring FIRST_STATISTIC_COUNT to 64 while leaving 120-point support and all other settings unchanged.	original
155	876bd5f3b04435d3ed3b573460050aeb52f6d461	17.518309		1.06	97.3	discard			baseline	Reduce the first-pass Tukey residual-statistic core from 64 to 56 neighbors	The retained first robust refinement estimates Tukey location and scale from 64 residuals, so curvature- or density-biased samples near that core's boundary can shift or inflate their own rejection reference before the local plane is corrected. Using the nearest 56 samples for the Gaussian-weighted median and MAD, while still applying the resulting Tukey weights to all 112 covariance samples, is an untested midpoint toward the measured 48-neighbor anchor: it should preserve more statistical stability than 48 while reducing neighborhood bias relative to 64. Medium/high noise and gradient may improve if a more local reference rejects biased residuals; clean, low-noise, and stripe may regress if fewer samples destabilize the robust statistics. The cost is a smaller median sort with unchanged covariance support and eigendecomposition count. Ablate by restoring FIRST_STATISTIC_COUNT to 64 with every other setting unchanged.	original
156	b352a75e70d39fd0cd0016470390a0bc842f4d8c	17.526526		1.1	97.4	discard			baseline	Reduce the first-pass Tukey residual-statistic core from 64 to 60 neighbors	The first robust refinement estimates Tukey location and scale from 64 residuals, so curvature- or density-biased samples near the core boundary can shift or inflate the rejection reference before the local plane is corrected. The measured 56-neighbor probe improved clean, medium-noise, high-noise, stripe, and gradient accuracy but slightly regressed low noise; 60 neighbors is the untested midpoint between 56 and the retained 64, intended to preserve more statistical stability while removing some boundary bias. Medium and high noise, clean, stripe, and gradient should improve through a more local robust reference, while low noise may regress slightly if the smaller sample makes location or scale less stable. The cost is a four-value smaller median sort with unchanged covariance support and eigendecomposition count. Ablate by restoring FIRST_STATISTIC_COUNT to 64 with every other setting unchanged.	original
157	e5ac95030c849093961366d0716f10fe1443b612	17.534231		1.093	97.4	discard			baseline	Reduce the first-pass Tukey residual-statistic core from 64 to 62 neighbors	The first robust refinement estimates Tukey location and scale from 64 provisional-plane residuals, so curvature- or density-biased samples near the core boundary can shift or inflate the rejection reference and preserve their own covariance leverage. The measured 56- and 60-neighbor probes improved clean, medium-noise, high-noise, and gradient accuracy, while 60 retained more statistical support than 56; 62 is the next untested midpoint toward the retained 64-neighbor anchor. Computing the Gaussian-weighted residual median and MAD from 62 samples should preserve small clean, medium/high-noise, and gradient gains through lower neighborhood bias, while low noise and stripe may regress slightly if removing two samples destabilizes the robust statistics. The cost is a two-value smaller median sort with unchanged covariance support and eigendecomposition count. Ablate by restoring FIRST_STATISTIC_COUNT to 64 with every other setting unchanged.	original
158	ba446df092669001b2d8841aa55de924a523f91e	17.536265		1.119	100.1	discard			baseline	Reduce the first-pass Tukey residual-statistic core from 64 to 63 neighbors	The first robust refinement estimates Tukey location and scale from 64 residuals of the broad provisional plane, so a curvature- or density-biased boundary sample can shift or inflate the rejection reference and preserve its own covariance leverage. The measured 56-, 60-, and 62-neighbor probes consistently improved medium/high-noise and gradient accuracy, while 62 also slightly improved clean and low noise but slightly regressed stripe; 63 is the final untested one-sample midpoint toward the retained 64-neighbor anchor. Computing the Gaussian-weighted residual median m and MAD scale sigma from 63 samples, then applying w = (1 - ((e - m)/(4.62 sigma))^2)^2 within the cutoff to all 112 covariance samples, should preserve smaller clean, low, medium, high, and gradient gains with less stripe risk than 62. The cost is one fewer value in each first-pass median sort, with unchanged covariance support and eigendecomposition count. Ablate by restoring FIRST_STATISTIC_COUNT to 64 with every other setting unchanged.	original
159	413c41c2c5dba60423498b2728be9f7e367d3b88	17.48463		1.117	97.2	provisional			baseline	Tighten only the first Tukey-biweight cutoff from 4.62 to 4.15 weighted-MAD sigmas	The retained 64-neighbor first-pass statistic core makes residual location and scale query-local, but moderate curvature-, asymmetric-density-, or outlier-induced residuals can still retain leverage in the 112-neighbor covariance at the 4.62-sigma redescending boundary. Lowering only that boundary to the untested midpoint 4.15 moves Tukey's half-weight residual from about 2.50 to 2.25 robust-scale sigmas while leaving the final refinement, neighborhoods, and robust statistics unchanged. Prior stricter first-pass probes support improved clean, medium-noise, high-noise, and gradient accuracy through lower geometric leverage; low-noise and stripe conditions may regress if valid residuals are rejected. This changes one scalar with no runtime or asymptotic cost. Ablate by restoring the first cutoff to 4.62. The ordered quadratic-jet item remains deferred because its prior prediction failure has no precise diagnostic to address.	original
160	14f49a70953b3228a1167d79eaa957cb6662411b	17.460977		1.132	110.4	discard			baseline	Tighten only the first Tukey-biweight cutoff from 4.15 to 3.92 weighted-MAD sigmas	The retained 64-neighbor first-pass statistic core is query-local, but moderate curvature-, asymmetric-density-, or outlier-induced residuals can still influence the 112-neighbor covariance before the final refinement. Lowering only the first Tukey boundary from 4.15 to 3.92 is the untested midpoint toward the previously measured 3.69 anchor: w(u) = (1 - u^2)^2 for |u| < 1 becomes zero at a slightly smaller robust residual while the final fit and all neighborhoods remain fixed. The 4.15 probe improved clean, medium-noise, high-noise, stripe, and gradient conditions, so those should improve further if geometric leverage remains dominant; low noise may regress because valid residuals lose support. This changes one scalar with no runtime or asymptotic cost. Ablate by restoring the first cutoff to 4.15, exactly recovering the current frontier estimator.	original
161	12e3ea97ab6f1ba04adb289f69bcac9c092b3301	17.473028		1.088	97.3	discard			baseline	Tighten only the first Tukey-biweight cutoff from 4.15 to 4.04 weighted-MAD sigmas	The query-local 64-neighbor residual statistic reduces curvature and density bias, but moderate geometric residuals still retain leverage in the first 112-neighbor covariance at the 4.15-sigma Tukey boundary. The measured 3.92 cutoff improved medium and high noise substantially but slightly regressed clean, low-noise, stripe, and gradient conditions, so 4.04 is the untested midpoint between 4.15 and 3.92. Moving the redescending boundary inward should reject curvature-, asymmetric-density-, and outlier-induced leverage a little earlier, preserving part of the medium/high-noise gain while limiting valid-sample rejection; low noise may regress, and clean, stripe, and gradient should remain near the frontier. This changes one scalar with no runtime or asymptotic cost. Ablate by restoring the first cutoff to 4.15 while leaving the final cutoff, neighborhoods, and robust statistics unchanged.	original
162	e0af643a37da7e428c27f54855d8d0468d32bd61	17.479341		1.075	110.4	discard			baseline	Tighten only the first Tukey-biweight cutoff from 4.15 to 4.10 weighted-MAD sigmas	Moderate curvature-, asymmetric-density-, or outlier-induced residuals can still influence the first 112-neighbor covariance at the retained 4.15-sigma Tukey boundary. The measured 4.04 cutoff improved medium and high noise but slightly regressed clean, low-noise, stripe, and gradient conditions, so 4.10 is the untested midpoint between 4.15 and 4.04: moving the redescending boundary inward by only 0.05 should preserve part of the noise and geometric-leverage reduction while limiting rejection of valid samples. Medium and high noise should improve modestly; low noise may regress, while clean, stripe, and gradient should remain near the frontier. This changes one scalar with no runtime or asymptotic cost. Ablate by restoring the first cutoff to 4.15 while leaving the final cutoff, neighborhoods, and robust statistics unchanged.	original
163	7d49f099fcde4632e0b23d0a1e0d69fff5a0995b	17.510985		1.091	97.4	discard			baseline	Relax only the first Tukey-biweight cutoff from 4.15 to 4.38 weighted-MAD sigmas	The retained 4.15-sigma first-pass Tukey boundary strongly reduces curvature-, asymmetric-density-, and outlier-induced leverage, but it is the only recent cutoff anchor that regresses low-noise accuracy; every tighter probe from 4.10 through 3.92 further reduced valid-sample support without earning retention. Moving the first boundary halfway back toward the measured 4.62 setting, to 4.38, raises Tukey's half-weight residual from about 2.25 to 2.37 robust-scale sigmas while leaving the final refinement, neighborhoods, and robust statistics unchanged. Low-noise accuracy should improve through greater first-covariance support; clean, medium-noise, high-noise, stripe, and gradient conditions may regress if moderate geometric residuals regain leverage. This changes one scalar with no runtime or asymptotic cost. Ablate by restoring the first cutoff to 4.15, exactly recovering the current frontier estimator. The quadratic-jet batch item remains deferred because its prior prediction failure has no precise diagnostic to address.	original
164	27e66e945b3f64052d7a5212ce9e3bd7b95068dc	17.486139		1.088	97.4	discard			baseline	Tighten only the final Tukey-biweight cutoff from 2.77 to 2.65 weighted-MAD sigmas	After the first robust correction, moderate curvature-, asymmetric-density-, or outlier-induced residuals can still tilt the final 128-neighbor covariance at the 2.77-sigma Tukey boundary. The quadratic-jet batch item remains blocked because its earlier prediction crash has no precise diagnostic to address, so this parameter-only probe uses the untested midpoint toward the previously measured 2.54 cutoff under the newer 64-neighbor first-pass statistics and retained 4.15 first cutoff. Moving only the final redescending boundary to 2.65 should improve clean, medium-noise, high-noise, stripe, and gradient conditions by removing moderate geometric leverage; low noise may regress if valid residuals lose support. The change has no runtime or asymptotic cost. Ablate by restoring the final cutoff to 2.77 while leaving all neighborhoods, statistic cores, and the first cutoff unchanged.	original
165	e9ef23c9d39f360be3acd66280deb21820963863	17.44921		1.343	106.5	discard			medium	Add a third Tukey-biweight refinement on the retained 128-neighbor final patch	The final robust plane is still the result of residual rejection measured from the first corrected plane, so curvature, asymmetric density, or sparse outliers that biased that residual classification can retain leverage. Recompute the same Gaussian-weighted 32-neighbor residual median and MAD from the current final plane, apply the unchanged 2.77-sigma Tukey biweight to all 128 final-patch samples, and refit the covariance once more; this is one additional IRLS step toward the existing redescending objective, with no new geometric rule or cutoff. Clean, stripe, and gradient conditions should improve if the better-centered residuals remove remaining neighborhood bias; low, medium, and high noise may regress because another redescending pass can reduce effective averaging support. The cost is one weighted-median/MAD calculation and one 3-by-3 eigendecomposition per query. Ablate by removing the third tuple entries, exactly recovering the current two-refinement estimator.	https://doi.org/10.1080/00401706.1974.10489171
166	d331d0b296885ca99adc14167951b89a511bd279	17.32966	14.510292	1.367	97.5	keep			medium	Accept a third Tukey refinement only on geometrically thin local sheets	The measured unconditional third Tukey step strongly reduced curvature, density, and outlier bias on clean, low-noise, stripe, and gradient patches, but harmed medium and high noise because another redescending pass reduced effective averaging support. This change computes that same independently useful third fit but accepts it only when the pre-refit 32-neighbor weighted-MAD residual thickness satisfies sigma / r_112 <= 0.1. This dimensionless gate treats a thin, coherent local sheet as reliable enough for further outlier rejection, while thicker noise-dominated or strongly curved patches keep the retained two-step normal. Clean, low-noise, stripe, and gradient conditions should recover part of the measured third-step gain; medium and high noise should remain closer to the frontier, though genuinely curved thin sheets or unusually coherent noisy patches may be misclassified. The cost is the third weighted median, covariance, and eigendecomposition already measured, plus one scalar comparison per query. Ablate by forcing the gate false, which exactly recovers the current two-refinement estimator; forcing it true recovers the measured unconditional third refinement.	original
