iteration	candidate_commit	dev_rmse	val_rmse	runtime_s	memory_mb	status	failure_stage	failure_message	complexity	description	rationale	source
288	6369b67bb1432c66474d807f3185b5a257f7cae0	17.268709		1.321	113.8	discard			low	Extrapolate accepted third-step normal corrections along the unit sphere	The retained normalized chord extrapolation does not increase the angular correction by exactly 80%; its effective gain depends nonlinearly on the angle between the two-step and third-step normals. For each thin-sheet patch, sign-align the normals, decompose the third normal into the preceding normal and its unit tangent direction, and rotate by exactly 1.8 times their angle. This geodesic extrapolation preserves unit length and gives the retained global parameter a direct angular meaning. Clean, low-noise, stripe, and gradient conditions should improve if curvature-, density-, and outlier-bias corrections are still underrelaxed; medium and high noise may regress because noise-driven rotations are also amplified slightly more consistently. The cost is one arccos and two trigonometric evaluations per query, with no additional neighborhood fit. Ablate by restoring the normalized chord formula n3 + 0.8 (n3 - n2), exactly recovering the validated frontier.	original
289	df9d54d7fc3ff95efdcfcf8e05dbe731074bb4ea	17.234654		1.308	98.0	discard			low	Blend 5% of the broad provisional PCA normal into non-thin local patches	The retained 128-neighbor robust normal is query-local but remains variance-limited under medium and high positional noise, while the 224-neighbor provisional PCA normal averages more samples but carries curvature and density bias. Reuse the existing dimensionless residual-thickness decision: thin coherent sheets retain the validated extrapolated third-step normal unchanged, while patches with weighted-MAD thickness above 0.1 times the 112th-neighbor radius return normalize(0.95 n_local + 0.05 n_broad) after sign alignment. This confidence-gated two-scale shrinkage should improve medium and high noise without exposing the thin clean, low-noise, stripe, and gradient patches that benefit from local extrapolation to broad-scale bias; genuinely curved thick patches may regress because thickness cannot distinguish curvature from noise. The cost is one saved normal, dot product, blend, and normalization per query, with no additional neighborhood fit. Ablate by setting THICK_SHEET_BROAD_NORMAL_BLEND to zero, exactly recovering the validated estimator.	original
290	89dbf33a7c9d2ef8f3069ea67e49bc9c5234d164	17.251486		1.361	103.3	discard			low	Blend 2.5% of the broad provisional PCA normal into non-thin local patches	The retained local robust normal is variance-limited under medium and high positional noise, while the existing 224-neighbor provisional PCA normal averages more samples but carries curvature and density bias. The measured 5% blend on non-thin patches improved medium and high noise substantially but regressed clean, low-noise, stripe, and gradient conditions, so halving the blend is the next simple parameter anchor on that measured trade-off. For patches failing the retained thin-sheet gate, sign-align the broad normal to the two-step local normal and return normalize(0.975 n_local + 0.025 n_broad); thin sheets retain the validated extrapolated third-step correction unchanged. Medium and high noise should retain part of the broad-scale variance reduction, while clean, low-noise, stripe, and gradient should regress less than at 5%; genuinely curved thick patches may still inherit broad-neighborhood bias. The cost is one saved normal, dot product, blend, and normalization per query, with no additional fit. Ablate by setting THICK_SHEET_BROAD_NORMAL_BLEND to zero, exactly recovering the validated frontier; setting it to 0.05 independently recovers the measured endpoint.	original
291	d5cf120f3308ba3d5291d4da7a736b913ee7120d	17.260055		1.342	97.8	discard			low	Blend 1.25% of the broad provisional PCA normal into non-thin local patches	The retained local robust normal is variance-limited under medium and high positional noise, whereas the existing 224-neighbor provisional PCA normal averages more samples but carries curvature and density bias. The measured 5% and 2.5% blends on patches failing the retained thin-sheet gate substantially improved medium and high noise, with the smaller blend approximately halving the clean, low-noise, stripe, and gradient regressions; 1.25% is the next simple halving on that measured bias-variance trade-off. For non-thin patches, sign-align the broad normal to the two-step local normal and return normalize(0.9875 n_local + 0.0125 n_broad); thin sheets retain the validated extrapolated third-step correction. Medium and high noise should retain a smaller variance reduction, while clean, low-noise, stripe, and gradient should regress less than at 2.5%; genuinely curved thick patches may still inherit broad-neighborhood bias. The cost is one saved normal, dot product, blend, and normalization per query, with no additional fit. Ablate by setting THICK_SHEET_BROAD_NORMAL_BLEND to zero, exactly recovering the validated frontier; setting it to 0.025 independently recovers the preceding measured endpoint.	original
292	b13562967940b2629114ac80d2e4b1883d3f9e45	17.264357		1.326	113.9	discard			low	Blend 0.625% of the broad provisional PCA normal into non-thin local patches	The retained local robust normal is variance-limited under medium and high positional noise, whereas the existing 224-neighbor provisional PCA normal averages more samples but carries curvature and density bias. Measured 5%, 2.5%, and 1.25% blends on patches failing the retained thin-sheet gate consistently improved medium and high noise, while each halving reduced the clean, low-noise, stripe, and gradient regressions; 0.625% is the next untested halving on that measured bias-variance curve. For non-thin patches, sign-align the broad normal to the two-step local normal and return normalize(0.99375 n_local + 0.00625 n_broad); thin sheets retain the validated extrapolated third-step correction. Medium and high noise should retain a small variance reduction, while clean, low-noise, stripe, and gradient should regress less than at 1.25%; genuinely curved thick patches may still inherit slight broad-neighborhood bias. The cost is one saved normal, dot product, blend, and normalization per query, with no additional fit. Ablate by setting THICK_SHEET_BROAD_NORMAL_BLEND to zero, exactly recovering the validated frontier; setting it to 0.0125 independently recovers the preceding measured endpoint.	original
293	1b7f11a604d94c5d663e3fd1a1a73df8ae480149	17.266518		1.321	97.7	discard			baseline	Blend 0.3125% of the broad provisional PCA normal into non-thin local patches	The retained local robust normal is variance-limited under medium and high positional noise, whereas the existing 224-neighbor provisional PCA normal averages more samples but carries curvature and density bias. Measured 5%, 2.5%, 1.25%, and 0.625% blends on patches failing the retained thin-sheet gate consistently improved medium and high noise, while each halving reduced the clean, low-noise, stripe, and gradient regressions; 0.3125% is the next untested halving on that measured bias-variance curve. For non-thin patches, sign-align the broad normal to the two-step local normal and return normalize(0.996875 n_local + 0.003125 n_broad); thin sheets retain the validated extrapolated third-step correction. Medium and high noise should retain a very small variance reduction, while clean, low-noise, stripe, and gradient should regress less than at 0.625%; genuinely curved thick patches may still inherit slight broad-neighborhood bias. The cost is one saved normal, dot product, blend, and normalization per query, with no additional fit. Ablate by setting THICK_SHEET_BROAD_NORMAL_BLEND to zero, exactly recovering the validated frontier; setting it to 0.00625 independently recovers the preceding measured endpoint.	original
294	e037e26c34dc6b360b9c698faf17c3aa76139ca8	17.267601		1.331	97.8	discard			baseline	Blend 0.15625% of the broad provisional PCA normal into non-thin local patches	The retained local robust normal is variance-limited under medium and high positional noise, whereas the existing 224-neighbor provisional PCA normal averages more samples but carries curvature and density bias. Measured 5%, 2.5%, 1.25%, 0.625%, and 0.3125% blends on patches failing the retained thin-sheet gate consistently improved medium and high noise, while each halving reduced the clean, low-noise, stripe, and gradient regressions; 0.15625% is the next untested halving on that measured bias-variance curve. For non-thin patches, sign-align the broad normal to the two-step local normal and return normalize(0.9984375 n_local + 0.0015625 n_broad); thin sheets retain the validated extrapolated third-step correction. Medium and high noise should retain a minute variance reduction, while clean, low-noise, stripe, and gradient should regress less than at 0.3125%; genuinely curved thick patches may still inherit slight broad-neighborhood bias. The cost is one saved normal, dot product, blend, and normalization per query, with no additional fit. Ablate by setting THICK_SHEET_BROAD_NORMAL_BLEND to zero, exactly recovering the validated frontier; setting it to 0.003125 independently recovers the preceding measured endpoint. The quadratic-jet batch item remains skipped because its prior prediction failure has no precise diagnostic to address.	original
295	d8046ec10607c17439751ee81526029c8c12e868	17.268142		1.336	113.0	discard			baseline	Blend 0.078125% of the broad provisional PCA normal into non-thin local patches	The retained local robust normal is variance-limited under medium and high positional noise, whereas the existing 224-neighbor provisional PCA normal averages more samples but carries curvature and density bias. Measured broad-normal blends from 5% down through 0.15625% on patches failing the retained thin-sheet gate consistently improved medium and high noise, while every halving reduced the clean, low-noise, stripe, and gradient regressions; 0.078125% is the next untested ordered halving. For non-thin patches, sign-align the broad normal to the two-step local normal and return normalize(0.99921875 n_local + 0.00078125 n_broad); thin sheets retain the validated extrapolated third-step correction. Medium and high noise should retain a minute variance reduction, while clean, low-noise, stripe, and gradient should regress less than at 0.15625%; genuinely curved thick patches may still inherit slight broad-neighborhood bias. The cost is one saved normal, dot product, blend, and normalization per query, with no additional fit. Ablate by setting THICK_SHEET_BROAD_NORMAL_BLEND to zero, exactly recovering the validated frontier; setting it to 0.0015625 independently recovers the preceding measured endpoint. The quadratic-jet batch item remains skipped because its prior prediction failure has no precise diagnostic to address.	original
296	362167c2b636a1100ff4d23b99bb57949b253884	17.268412		1.343	97.6	discard			low	Blend 0.0390625% of the broad provisional PCA normal into non-thin local patches	The retained local robust normal is variance-limited under medium and high positional noise, whereas the existing 224-neighbor provisional PCA normal averages more samples but carries curvature and density bias. Measured blends from 5% through 0.078125% on patches failing the retained thin-sheet gate consistently improved medium and high noise, while each halving reduced the clean, low-noise, stripe, and gradient regressions; 0.0390625% is the next untested ordered halving. For non-thin patches, sign-align the broad normal to the two-step local normal and return normalize(0.999609375 n_local + 0.000390625 n_broad); thin sheets retain the validated extrapolated third-step correction. Medium and high noise should retain a minute variance reduction, while clean, low-noise, stripe, and gradient should regress less than at 0.078125%; genuinely curved thick patches may still inherit slight broad-neighborhood bias. The cost is one saved normal, dot product, blend, and normalization per query, with no additional fit. Ablate by setting THICK_SHEET_BROAD_NORMAL_BLEND to zero, exactly recovering the validated frontier. The quadratic-jet batch item remains skipped because its prior prediction failure has no precise diagnostic to address.	original
297	82e323463e05e78a00563bad4a677cd1599580b9	17.233266		1.36	97.7	discard			low	Smoothly increase broad-normal stabilization with robust residual thickness on non-thin patches	The retained local Tukey-PCA normal is accurate on thin coherent geometry but remains variance-limited under positional noise, while the 224-neighbor provisional normal is stabler but curvature-biased. Fixed broad-normal blends on every non-thin patch measured a strict trade-off: medium and high noise improved, but even tiny blends regressed clean, low-noise, stripe, and gradient patches near the thin-sheet boundary. This change uses residual thickness as a continuous noise-ambiguity confidence: patches at sigma/r_112 <= 0.10 keep the extrapolated local correction, non-thin patches ramp linearly from zero broad-normal weight at 0.10 to 5% at 0.20, and thicker patches receive the full 5% after sign alignment. Thus only increasingly thick patches borrow increasing broad-scale covariance averaging. Medium and high noise should improve, while clean, low-noise, stripe, and gradient should regress less than under the measured fixed 5% blend; genuinely curved thick patches may still regress because residual thickness cannot fully separate curvature from noise. The cost is scalar confidence arithmetic and one vector blend, with no additional neighborhood fit. Ablate by setting THICK_SHEET_BROAD_NORMAL_BLEND to zero, exactly recovering the validated frontier estimator; replacing the ramp by one on all non-thin patches independently recovers the measured fixed 5% endpoint.	original
298	2a9624feab8ff331153ebf45c046a8e572fba995	17.238113		1.337	105.2	discard			low	Blend 5% of the broad provisional normal only into very thick local patches	The two-step local Tukey-PCA normal remains variance-limited under medium and high positional noise, while the 224-neighbor provisional PCA normal has lower variance but carries curvature and density bias. Prior fixed and ramped broad-normal blends improved medium and high noise but regressed clean, low-noise, stripe, and gradient patches, including patches just above the thin-sheet boundary. This change leaves thin and moderately thick patches untouched and, only when the existing dimensionless robust thickness satisfies sigma / r_112 >= 0.20, returns normalize(0.95 n_local + 0.05 n_broad) after sign alignment. Medium and high noise should improve because the noisiest patches borrow broad-scale averaging; clean, low-noise, stripe, and gradient should regress less than under the measured all-non-thin and ramped blends, although genuinely curved very-thick patches may still inherit broad-neighborhood bias. The cost is one saved normal, dot product, blend, and normalization per query with no additional fit. Ablate by setting VERY_THICK_SHEET_BROAD_NORMAL_BLEND to zero, exactly recovering the validated frontier estimator. The ordered quadratic-jet retry remains skipped because its prior prediction failure has no precise diagnostic to address.	original
299	8955da37d39728fa10880d95a8032da98a88d7bf	17.248998		1.67	103.6	discard			medium	Add a fourth Tukey-PCA refinement on thin coherent sheets before extrapolating the final normal correction	The retained 80% extrapolation shows that successive robust normal corrections remain underrelaxed on thin patches affected by curvature, asymmetric density, or outliers, but fixed vector extrapolation assumes the next correction without remeasuring residual leverage. For patches passing the existing weighted-MAD thickness gate, perform one more identical Tukey IRLS covariance fit from the third plane, then extrapolate the measured fourth-minus-third normal correction by the retained 80%; non-thin patches still return the two-step normal. Clean, low-noise, stripe, and gradient conditions should improve if robust iterations continue toward the query-local tangent, while medium and high noise may regress because another redescending pass can reduce effective support. The cost is one weighted median/MAD, covariance, and 3-by-3 eigendecomposition per query in the current batched implementation. Ablate by omitting the fourth fit and extrapolating the third-minus-second correction, exactly recovering the current frontier. The ordered quadratic-jet item remains skipped because its prior prediction crash has no precise diagnostic to address.	https://doi.org/10.1080/00401706.1974.10489171
300	440ff0c59ae35c326622d3bd9d590b2967ad8864	17.252996		1.557	104.2	discard			medium	Blend half of a fourth Tukey-PCA continuation into the retained thin-sheet normal	The retained three-step fit and 80% extrapolation show that robust corrections on thin coherent sheets reduce curvature, asymmetric-density, and outlier bias, while the measured full fourth-pass continuation improved clean, stripe, and gradient accuracy but regressed low, medium, and high noise. For patches passing the existing thickness gate, compute the same fourth Tukey covariance, sign-align its extrapolated normal to the retained three-step output, and return their normalized midpoint. This damped continuation uses n = normalize(0.5 n_frontier + 0.5 n4_extrapolated), preserving half of the measured extra geometric correction while reducing amplification of noise-driven rotation. Clean, stripe, and gradient should improve; low, medium, and high noise may regress, but less than under the full fourth continuation. The cost is one weighted median/MAD, covariance, and 3-by-3 eigendecomposition per query. Ablate by removing the fourth fit and midpoint blend, exactly recovering the current estimator. The ordered quadratic-jet retry remains skipped because its prior prediction crash has no precise diagnostic to address.	https://doi.org/10.1080/00401706.1974.10489171
301	349ec2a1c1a2820a0795740bb2c7c8a76d891548	17.25939		1.557	95.8	discard			medium	Blend one quarter of a fourth Tukey-PCA continuation into the retained thin-sheet normal	The retained three-step fit and 80% extrapolation reduce curvature-, asymmetric-density-, and outlier-induced tangent bias on thin coherent sheets, while measured full and half-strength fourth continuations further improved clean, stripe, and gradient accuracy but regressed low-, medium-, and high-noise conditions. For patches passing the existing thickness gate, compute the same fourth Tukey covariance, extrapolate its measured fourth-minus-third normal correction by the retained 80%, sign-align it to the retained frontier normal, and return their normalized 25/75 blend. This is the next untested damping anchor: clean, stripe, and gradient should retain part of the measured continuation gain, while low, medium, and high noise may regress, but less than with the measured half blend. The cost is one weighted median/MAD, covariance, and 3-by-3 eigendecomposition per query. Ablate by setting FOURTH_CONTINUATION_BLEND to zero, which returns the retained three-step extrapolated estimator exactly; setting it to 0.5 independently recovers the measured half-continuation candidate.	https://doi.org/10.1080/00401706.1974.10489171
302	038547c6739961fc8c4f4ff8f512ab6ce839c45f	17.263678		1.559	95.7	discard			medium	Blend one eighth of a fourth Tukey-PCA continuation into the retained thin-sheet normal	The retained three-step Tukey fit and 80% extrapolation reduce curvature-, asymmetric-density-, and outlier-induced tangent bias on thin coherent sheets, while measured full, half, and quarter-strength fourth continuations further improved clean, stripe, and gradient accuracy but regressed low-, medium-, and high-noise conditions. For patches passing the existing thickness gate, compute the same fourth robust covariance, extrapolate its measured fourth-minus-third normal correction by the retained 80%, sign-align it to the retained frontier normal, and return their normalized 12.5/87.5 blend. This next damping anchor should retain a smaller clean, stripe, and gradient benefit while reducing the noise regression relative to the measured quarter blend. The cost is one weighted median/MAD, covariance, and 3-by-3 eigendecomposition per query. Ablate by removing the fourth cutoff/count entries and continuation branch, exactly recovering the retained three-step extrapolated estimator; changing the blend to 0.25 independently recovers the preceding candidate.	https://doi.org/10.1080/00401706.1974.10489171
