iteration	candidate_commit	dev_rmse	val_rmse	runtime_s	memory_mb	status	failure_stage	failure_message	complexity	description	rationale	source
0	b787b409d4250130d9519c528daded678b76910e	19.189958	16.316211	0.496	61.4	keep			baseline	fixed k=112 PCA	local covariance tangent plane	Hoppe1992
1	5baafd87111a9f77903f43b986f662e8cabbe277	18.881278	15.673184	0.467	65.3	keep			low	Gaussian distance-weighted PCA over the existing 112-neighbor patch	Uniform PCA gives distant samples the same leverage as nearby samples, increasing neighborhood bias where curvature changes across a patch. Weighting each point by exp(-2(d/r)^2), with r the 112th-neighbor distance, emphasizes query-local geometry while retaining all samples for noise averaging and automatically scales with density. The cost is one weight vector, a weighted centroid, and a weighted covariance per query. Ablate by replacing the weights with uniform values to recover the fixed-k PCA baseline.	original
2						crash			medium	Per-query surface-variation selection among 32-, 64-, and 112-neighbor Gaussian-weighted PCA fits (failed: CalledProcessError)	A fixed neighborhood cannot simultaneously average positional noise on planar regions and avoid neighborhood bias on curved regions. For each query, fit the retained Gaussian-weighted covariance at three nested scales and choose the normal whose covariance minimizes surface variation lambda_min / (lambda_0 + lambda_1 + lambda_2). Noise-dominated planar patches should favor broader support, whereas curvature raises the normal-direction variance of broad patches and should favor narrower support. The cost is three small symmetric eigendecompositions instead of one. Ablate the mechanism by restricting the candidate scales to 112 neighbors, exactly recovering the current weighted-PCA frontier.	original
3	329479de5203e3743aa4ed127827b9d61275d459	18.980142		0.499	65.3	discard			baseline	Reduce the Gaussian PCA distance-decay coefficient from 2.0 to 1.0	The current Gaussian kernel may over-localize the 112-neighbor patch: its boundary weight exp(-2) is only 0.135, reducing the effective sample support and making the covariance more sensitive to positional noise. Using exp(-(d/r)^2) raises the boundary weight to exp(-1) = 0.368, preserving a query-centered bias while averaging more observations; this should improve noisy cases at the possible cost of modestly greater curvature bias, with no asymptotic or implementation cost. Ablate by restoring the decay coefficient to 2.0 while leaving every other estimator choice unchanged.	original
4						crash			medium	Gaussian-weighted quadratic jet refinement in the local PCA frame (failed: CalledProcessError)	A planar PCA fit can tilt under smooth curvature or asymmetric sampling because it must explain the whole patch with one plane. After retaining the current weighted PCA frame, fit the normalized local height z = c0 + c1 x + c2 y + c3 x^2 + c4 xy + c5 y^2 with the same Gaussian weights; the query normal is proportional to (-c1, -c2, 1). The quadratic terms absorb curvature, so the linear gradient more directly estimates the tangent at the query, with expected gains on curved and density-biased patches. The added cost is one batched 6-by-6 regularized least-squares solve per query. Ablate by returning the initial PCA frame normal and omitting the polynomial fit, exactly recovering the current frontier estimator.	https://doi.org/10.1016/j.cagd.2004.09.008
5	eda652853d6c7214ee66eb4690035142f382a645	19.010716		0.489	66.0	discard			baseline	Increase the Gaussian PCA distance-decay coefficient from 2.0 to 3.0	The retained 112-neighbor estimator can still suffer curvature bias because points near the patch boundary retain weight exp(-2) = 0.135 and therefore influence the fitted plane despite being least representative of the query tangent. Using exp(-3(d/r)^2) lowers the boundary weight to exp(-3) = 0.050, strengthening query locality while preserving all neighbors and the density-adaptive radius; the preceding result that weakening decay to 1.0 reduced accuracy motivates testing the opposite direction. The expected benefit is less tangent bias on curved or nonuniform patches, with the possible cost of less noise averaging but no added runtime or algorithmic complexity. Ablate by restoring the coefficient to 2.0 with all other estimator choices unchanged.	original
6	708694325a3af890f82c0e999575a33ec3cc2fac	18.659968	16.256665	0.511	77.1	discard			baseline	Increase the Gaussian-weighted PCA neighborhood from 112 to 160 neighbors	The retained query-local weighting improves clean, low-noise, stripe, and gradient conditions but loses accuracy at medium and high noise, indicating insufficient sample support. Increasing k from 112 to 160 supplies more observations for covariance averaging, while the retained exp(-2(d/r)^2) kernel limits the leverage of the more distant samples and adapts its radius to local density. Medium and high noise should improve; clean and curved geometry may regress from the broader spatial support. The cost is 43% more neighborhood data in the same single weighted covariance and eigendecomposition. Ablate by restoring k=112 while keeping the decay coefficient and all other computations unchanged.	original
7	f762cb1b131914bc708fd09493dc0e0d5bfc3003	18.735248		0.581	77.5	provisional			baseline	Increase the Gaussian-weighted PCA neighborhood from 112 to 224 neighbors	The k=160 probe established that broader support substantially improves medium- and high-noise normals, but its support may still be too small to average strong positional noise. Increasing k to 224 tests the next ordered scale anchor while retaining exp(-2(d/r)^2) weighting to limit distant-point leverage and adapt the radius to density. Medium and high noise should improve further; clean, low-noise, stripe, gradient, and strongly curved patches may regress because the larger spatial footprint increases neighborhood bias. The cost is twice the neighborhood data of k=112 in the same single covariance and eigendecomposition. Ablate by restoring k=112 with the weighting and all other computations unchanged.	original
8	e08121db77f676832bc1603d012becdab0a3c0a9	19.589027		0.457	65.4	discard			baseline	Reduce the Gaussian-weighted PCA neighborhood from 224 to 80 neighbors	The broad 224-neighbor patch averages positional noise but measurably increases neighborhood bias on clean, low-noise, stripe, and gradient conditions because curved or spatially varying geometry farther from the query can tilt one fitted plane. Reducing k to 80 uses a smaller density-adaptive radius while retaining exp(-2(d/r)^2) weighting, so the covariance represents more query-local geometry. Clean, low-noise, stripe, and gradient accuracy should improve; medium and high noise may regress because fewer samples are available for averaging. The change reduces memory and covariance work without adding an algorithmic mechanism. Ablate by restoring k=224 while leaving the Gaussian decay and all computations unchanged.	original
9	8703d29f24c5d3c56b594dd3414ba773d90598d8	18.367378	16.817228	0.678	71.3	discard			low	Select between 80- and 224-neighbor Gaussian PCA using small-scale surface variation	The fixed-scale probes expose a strong bias-variance split: 80 neighbors improve clean, low-noise, stripe, and gradient cases by reducing curvature and neighborhood bias, while 224 neighbors improve medium and high noise through stronger averaging. This change computes both retained Gaussian-weighted PCA fits and uses the dimensionless small-scale surface variation lambda_min / sum(lambda) as confidence: values at or below 0.01 select the local 80-neighbor tangent, while less planar patches fall back to 224 neighbors for noise robustness. Expected gains are recovery of clean, low, stripe, and gradient accuracy without surrendering all medium/high-noise gains; genuinely curved small patches may be mistaken for noise and retain the broad biased fit. The cost is a second weighted covariance and eigendecomposition. Ablate by always selecting the 224-neighbor fit, exactly recovering the current frontier estimator.	original
10	57d87da2a580485c88f9dc94ced462aa9c5bc382	18.672701	15.375965	0.682	78.4	keep			low	One-step Cauchy residual reweighting of the retained 112-neighbor Gaussian PCA	The fixed-scale probes show that enlarging support improves medium and high noise but loses too much accuracy to neighborhood bias, so support size alone does not resolve the trade-off. Starting from the retained Gaussian-weighted PCA plane, this change estimates residual scale with the median absolute deviation and multiplies each distance weight by 1 / (1 + (e / (2.5 sigma))^2), then recomputes the weighted covariance once. Points with unusually large normal-direction residuals therefore have bounded leverage without broadening the patch. Medium/high-noise cases and patches containing geometric outliers should improve; clean, low-noise, stripe, and gradient cases should remain close to the frontier, while genuinely curved patches may regress if valid curvature is treated as residual contamination. The cost is residual statistics plus one additional 3-by-3 eigendecomposition per query. Ablate by omitting the Cauchy factors and final refit, which returns the initial retained Gaussian-PCA normal.	original
11	0f313fe210048604c9d823c0d77d39a4b659ba45	18.638573		0.658	70.2	discard			baseline	Reduce the one-step Cauchy residual cutoff from 2.5 to 2.0 sigma	The retained robust fit improved clean, low-noise, stripe, and gradient patches, suggesting that points far from the provisional tangent still carry enough leverage to bias the local plane through curvature, asymmetric sampling, or sparse outliers. Reducing the Cauchy cutoff from 2.5 to 2.0 sigma gives a 2-sigma residual weight of 0.5 instead of about 0.61, strengthening only the existing residual rejection without changing neighborhood support or adding a mechanism. Clean, low-noise, stripe, and gradient conditions should improve; medium and high noise may regress because widespread positional noise is valid signal rather than sparse contamination. Runtime and asymptotic cost are unchanged. Ablate this parameter by restoring the cutoff to 2.5 with every other computation fixed.	original
12	bef55454a2d0653b66acddca9de3c3eeba77f179	18.702036		0.664	77.2	discard			baseline	Increase the one-step Cauchy residual cutoff from 2.5 to 3.0 sigma	The retained robust fit improves query-local geometry but still regresses on medium and high noise, where widespread normal-direction displacement is not sparse contamination. The rejected 2.0-sigma probe strengthened rejection and measurably worsened both noisy conditions, motivating the untested opposite parameter direction. Raising the Cauchy cutoff from 2.5 to 3.0 sigma increases a 2.5-sigma residual's weight from 0.5 to about 0.59, preserving more valid noisy samples in the covariance while retaining bounded leverage for extreme residuals. Medium and high noise should improve; clean, low-noise, stripe, and gradient conditions may regress through increased curvature or outlier leverage. Runtime and asymptotic cost are unchanged. Ablate by restoring the cutoff to 2.5 with every other computation fixed.	original
13	20c760f98e606f35da4c1316997c9607aae10b2d	18.37989	15.914907	0.768	78.0	discard			baseline	Increase the retained robust Gaussian-PCA neighborhood from 112 to 160 neighbors	The retained one-step Cauchy fit improves query-local geometry but still loses accuracy at medium and high noise, where 112 samples provide limited covariance averaging. The earlier non-robust k=160 anchor substantially improved both noisy conditions but regressed clean, low-noise, stripe, and gradient patches through broader-neighborhood bias; applying that measured scale to the retained robust estimator tests whether residual reweighting can bound the leverage of curvature-biased or outlying boundary samples while the additional samples stabilize noisy covariance estimates. Medium and high noise should improve, while clean, low-noise, stripe, and gradient conditions may still regress if coherent curvature is not rejected as an outlier. The cost is 43% more neighborhood storage and weighted-covariance work in each of the existing two fits, with no new algorithmic mechanism. Ablate by restoring k=112 while leaving Gaussian decay, Cauchy cutoff, and both PCA passes unchanged.	original
14	46459d1592630fd61c8880c73eb19979cf56eb5d	18.69935		0.726	70.2	discard			low	Center Cauchy reweighting on the median signed plane residual	The retained fit estimates residual scale around the median but currently applies its Cauchy penalty around zero, an inconsistency that can give low weight to the coherent surface sheet when curvature or asymmetric density shifts the residual distribution away from the provisional PCA plane. This change uses u = (e - median(e)) / (2.5 sigma) in the existing Cauchy factor 1 / (1 + u^2), so rejection targets deviations from the robust residual center rather than the center's offset. Clean, low-noise, stripe, and gradient patches should improve through less curvature and neighborhood-bias misclassification; medium and high noise may regress slightly if median centering preserves more displaced samples. The cost is one subtraction with unchanged memory and asymptotic work. Ablate by removing the median subtraction, exactly recovering the retained estimator.	original
15	73c45e9db36f2892f6abf05b9932d2df7f830ce7	18.609693	15.275942	0.826	72.8	keep			medium	Add a second Cauchy residual-reweighting step to the retained robust Gaussian PCA	A single robust refit still computes its Cauchy weights from the Gaussian-PCA plane, which can itself be tilted by curvature, asymmetric sampling, or outliers; those provisional residuals may therefore under-identify the points biasing the tangent. Recomputing residuals and Cauchy weights once from the first robust plane is a second IRLS step toward the same bounded-influence fit, without changing the neighborhood, kernel, cutoff, or objective. Clean, low-noise, stripe, and gradient patches should improve if the refined plane separates coherent tangent samples from biased points more accurately; medium and high noise may regress because repeated rejection reduces effective noise-averaging support. The cost is one additional weighted covariance and 3-by-3 eigendecomposition per query. Ablate by setting the number of robust reweighting steps back to one, exactly recovering the retained estimator.	original
16	44e123ca699a69bd755bc0acd0b8545c0accf975	18.589854		1.021	72.9	discard			baseline	Increase Cauchy residual reweighting from two to three IRLS steps	The retained second IRLS step improved clean, low-noise, stripe, and gradient conditions, indicating that recomputing residuals from a less biased robust plane better isolates curvature-, density-, or outlier-induced leverage than stopping after one refinement. A third step continues the same bounded-influence objective: compute Cauchy factors from the second robust plane and refit the weighted covariance once more. Those four query-local conditions should improve if the fit has not converged, while medium and high noise may regress because repeated downweighting reduces effective averaging support. The cost is one additional weighted centroid, covariance, and 3-by-3 eigendecomposition per query, with no new mechanism or hyperparameter. Ablate by restoring two reweighting steps, exactly recovering the validated frontier.	original
17						crash	agent.edit-scope	expected only estimator.py to change; changed paths: ['README.md', 'experiments/normal-estimation/estimator.py']	medium	Freeze the Cauchy residual scale from the initial Gaussian-PCA fit across both IRLS steps	The retained second IRLS step improves clean, low-noise, stripe, and gradient patches but regresses medium and high noise, and a third step amplifies the same trade-off. Re-estimating MAD after each robust refit can shrink the scale as the plane follows its inliers, so ordinary positional-noise residuals receive progressively smaller Cauchy weights. This change estimates sigma = 1.4826 median(|e - median(e)|) once from the initial Gaussian-PCA residuals and holds it fixed during both plane refinements, isolating plane convergence from scale contraction. Medium and high noise should improve through greater effective sample support; clean, low-noise, stripe, and gradient conditions may regress because curvature-biased points retain more leverage. The cost is unchanged asymptotically and slightly lower in practice because the second MAD calculation is removed. Ablate by recomputing MAD inside each IRLS step, exactly recovering the current frontier estimator.	original
18	85e3a72d8108acce3fb8f3d852732529fc1dff9a	18.631545		0.756	83.2	discard			medium	Hold the initial MAD residual scale fixed during both Cauchy plane refinements	In two-step robust PCA, recomputing MAD after the first refit can contract the estimated noise scale as the plane follows its inliers, causing ordinary positional-noise residuals to be increasingly rejected in the second step. Estimate sigma = 1.4826 median(|e - median(e)|) once from the initial Gaussian-PCA plane and reuse it while updating only the plane and Cauchy residual weights. This should preserve effective support and improve medium- and high-noise conditions; clean, low-noise, stripe, and gradient conditions may regress because curvature-biased samples retain more leverage. It removes one median-scale calculation without changing asymptotic cost. Ablate by recomputing MAD from the current plane inside each reweighting step, which exactly recovers the retained frontier.	original
19						crash	quality.ruff-fix	Ruff exited with status 1	medium	Gate the second Cauchy refinement by initial PCA surface variation	The retained second IRLS step improves clean, low-noise, stripe, and gradient patches but reduces effective support and regresses medium and high noise. This change always performs the retained first robust refit, then applies the second refit only when the initial Gaussian covariance confidently describes a plane, using the dimensionless criterion lambda_min / (lambda_0 + lambda_1 + lambda_2) <= 0.01. On high-variation, noise-dominated patches it preserves the one-step fit and its greater effective support; on confident planar patches it retains the second step's removal of curvature-, density-, or outlier-induced leverage. Medium and high noise should improve, while clean, low, stripe, and gradient should remain near the frontier; genuinely curved patches with high surface variation may regress by stopping after one step. The cost is one scalar confidence per patch, with the current batched second eigendecomposition retained for readable vectorization. Ablate by forcing the gate true for every patch, exactly recovering the current two-step frontier.	original
20	464554cd961fda2d712ce71b3bef97204f2fd81c	18.667599		0.831	81.6	discard			medium	Use initial surface variation to conditionally accept the second Cauchy IRLS refinement	Two Cauchy refinements reduce curvature-, density-, and outlier-induced tangent bias on clean, low-noise, stripe, and gradient patches, but measured results show a small medium/high-noise regression because repeated residual rejection reduces effective support. This change computes the initial PCA surface variation lambda_min / sum(lambda) and accepts the second-step normal only when that dimensionless value is at most 0.01; noisier, weakly planar patches retain the always-computed one-step normal. Medium and high noise should improve while the four query-local conditions remain close to the frontier, though genuinely curved high-variation patches may regress by stopping early. The added mechanism is one scalar confidence and a selection per patch; the second fit remains batched, so runtime is not reduced. Ablate by accepting the second-step normal for every patch, exactly recovering the retained estimator.	original
21	2ca4859c9f3e6e2dd66e5a6962504f931713dc5f	18.642562		0.828	78.3	discard			baseline	Relax the Cauchy cutoff from 2.5 to 3.0 sigma only during the second IRLS refinement	The retained second Cauchy refinement improves clean, low-noise, stripe, and gradient patches, but its repeated rejection reduces effective covariance support and measurably regresses medium and high noise. Keep the first pass at 2.5 sigma to suppress gross curvature-, density-, and outlier-induced residuals, then use a more conservative 3.0-sigma cutoff after the plane has already been robustly corrected. This should retain more ordinary positional-noise samples in the final covariance and improve medium/high noise; clean, low, stripe, and gradient may regress slightly because moderate geometric residuals regain leverage. The change adds one global scalar and no eigendecompositions or asymptotic cost. Ablate by setting the refined cutoff back to 2.5, exactly recovering the retained two-step estimator.	original
