iteration	candidate_commit	dev_rmse	val_rmse	runtime_s	memory_mb	status	failure_stage	failure_message	complexity	description	rationale	source
97	e9cafd5095c081f199f5466ce5edcaca04b935be	17.774723		1.269	93.5	discard			medium	Gate broad-normal shrinkage by both final eigengap ambiguity and cross-scale agreement	The robust 112-neighbor normal is query-local but variance-limited under positional noise, while the 224-neighbor provisional normal is more stable but can be biased by curvature or asymmetric density. The prior eigengap-only 10% blend improved medium and high noise but slightly regressed clean, low, stripe, and gradient conditions, so this change keeps its maximum correction fixed and adds an independent curvature guard: after sign alignment, alpha = 0.10 clip(lambda_0/lambda_1, 0, 1) (n_local dot n_broad)^2 and n = normalize((1-alpha)n_local + alpha n_broad). Local eigengap ambiguity requests noise averaging, while cross-scale disagreement suppresses borrowing when the broad tangent likely crosses changing geometry. Medium and high noise should improve; clean, low, stripe, and gradient should regress less than with eigengap-only shrinkage, though similarly biased scales may evade the guard. The cost is scalar confidence arithmetic and one vector blend, with no new fit. Ablate by setting the maximum blend to zero, exactly recovering the frontier estimator.	original
98	67cd42aa3fafdc373b06f2142da839b288f23913	17.773264		1.263	80.7	discard			medium	Apply 10% broad-normal shrinkage only when the final robust PCA eigengap is ambiguous	The local 112-neighbor Tukey-PCA normal is query-local but variance-limited under positional noise, whereas the 224-neighbor provisional normal averages noise more effectively but carries curvature and density bias. The prior smooth eigengap shrinkage improved medium and high noise but slightly regressed clean, low-noise, stripe, and gradient conditions because every patch borrowed some broad-scale bias. This change uses a hard confidence guard: after sign alignment, blend 10% of the broad normal only when the final covariance has lambda_0 / lambda_1 >= 0.5; a well-separated tangent remains exactly unchanged. Medium and high noise should improve on genuinely ambiguous patches, while clean, low, stripe, and gradient should regress less than with smooth shrinkage; curved patches with an ambiguous eigengap may still inherit broad-neighborhood bias. The cost is one eigenvalue ratio, threshold, vector blend, and normalization per query, with no new fit. Ablate by setting BROAD_NORMAL_BLEND to zero, exactly recovering the retained estimator.	original
99	db3677830056472db0c74e38e1ba1efbd13146c9	17.831596		1.281	81.1	discard			low	Shrink the final robust local covariance 10% toward the normalized broad provisional covariance	The final 112-neighbor Tukey covariance is query-local and outlier-resistant but remains sample-variance limited at medium and high positional noise, while the existing 224-neighbor provisional covariance averages more observations but carries curvature and density bias. Before only the final eigendecomposition, divide both scatter matrices by their traces and use C = 0.9 C_local + 0.1 C_broad. Trace normalization makes the blend dimensionless, and blending geometric second moments rather than finished normal vectors lets all three broad-scale principal directions regularize the noisy local tensor. Medium and high noise should improve; clean, low-noise, stripe, and gradient conditions may regress if broad curvature or density bias rotates the smallest eigendirection. The cost is constant-time 3-by-3 trace normalization and blending with no new neighborhood or eigendecomposition. Ablate by setting FINAL_COVARIANCE_SHRINKAGE to zero, which exactly restores the retained final covariance and normal. The ordered quadratic-jet item remains deferred because its prior prediction crash has no precise diagnostic to address.	original
100	f027eb519ec8cd01605d9849efadbb23bb783090	17.676831	14.848915	1.511	88.7	discard			baseline	Extend only the final Tukey-PCA refinement from 112 to 160 neighbors	The final 112-neighbor robust covariance remains sample-variance limited at medium and high positional noise, while broad support used before the local plane is corrected risks curvature and density bias. Keep the 224-neighbor provisional PCA and first 112-neighbor Tukey correction unchanged, then admit neighbors 113 through 160 only in the final fit. The Gaussian bandwidth remains the 112th-neighbor radius, so the added samples form a decaying tail, and the corrected-plane Tukey weights reject large normal residuals. Medium and high noise should improve through additional covariance averaging; clean, low-noise, stripe, and gradient conditions may regress if coherent curvature or density bias survives redescending rejection. The cost is 48 extra samples in only the final weighted-median and covariance calculations, with no additional eigendecomposition. Ablate by setting FINAL_NEIGHBOR_COUNT to 112, exactly recovering the retained estimator.	original
101	2f34c8eb31ef2e4997f159f866695ecb403dc91e	17.752443		1.431	100.2	provisional			baseline	Extend only the final Tukey-PCA refinement from 112 to 128 neighbors	The retained final 112-neighbor covariance is variance-limited at medium and high positional noise, while the measured 160-neighbor final-support probe improved both noisy conditions but introduced clean-geometry, stripe, and gradient bias. This parameter probe uses the untested intermediate 128-neighbor endpoint only after the first 112-neighbor Tukey correction. The bandwidth remains the 112th-neighbor radius, so neighbors 113 through 128 form a rapidly decaying Gaussian tail, and final redescending weights remove samples with large corrected-plane residuals. Medium and high noise should improve through additional covariance averaging; clean, low-noise, stripe, and gradient may regress through coherent curvature or density bias, but less than at 160. The cost is 16 extra samples in only the final weighted-median and covariance calculations, with no additional eigendecomposition. Ablate by setting FINAL_NEIGHBOR_COUNT to 112, exactly recovering the retained estimator.	original
102	5fda45744a61c14f43c8d99b89f1026a49e16cd1	17.711135		1.481	102.8	discard			baseline	Extend only the final Tukey-PCA refinement from 128 to 144 neighbors	The provisional 224-neighbor PCA stabilizes the normal under positional noise, but the final 128-neighbor robust covariance remains variance-limited. The measured 128-neighbor endpoint improved medium and high noise with smaller geometry losses than 160, so 144 is the untested midpoint: after the first 112-neighbor Tukey correction, neighbors 129 through 144 enter only the final covariance. The bandwidth remains fixed at the 112th-neighbor radius, making the added samples a decaying Gaussian tail, while redescending Tukey weights remove large corrected-plane residuals. Medium and high noise should improve through additional averaging; clean, low-noise, stripe, and gradient may regress through coherent curvature or density bias, but less than at 160. The cost is 16 extra samples in only the final weighted-median and covariance calculations, with no extra eigendecomposition. Ablate by restoring FINAL_NEIGHBOR_COUNT to 128, exactly recovering the current frontier estimator.	original
103	bf51a5034503930814090b354e3acf29e8b80a9f	17.731052		1.483	98.1	discard			baseline	Extend only the final Tukey-PCA refinement from 128 to 136 neighbors	The final 128-neighbor robust covariance remains variance-limited at medium and high positional noise, but extending it to 144 neighbors measured additional noise gains alongside clean-geometry and density-bias losses. This single midpoint probe admits neighbors 129 through 136 only after the first 112-neighbor Tukey correction. The Gaussian bandwidth remains fixed at the 112th-neighbor radius, so the added samples form a low-leverage decaying tail, while final redescending weights reject large corrected-plane residuals. Medium and high noise should improve through additional covariance averaging; clean, low-noise, stripe, and gradient conditions may regress through coherent curvature or density bias, but less than at 144. The cost is eight extra samples in only the final weighted-median and covariance calculations, with no extra eigendecomposition. Ablate by restoring FINAL_NEIGHBOR_COUNT to 128, exactly recovering the current frontier estimator.	original
104	fdfde4c9bc6f0a3ccb36f95678a1728a7c39a3e8	17.742641		1.451	98.3	discard			baseline	Narrow only the 128-neighbor final Tukey-PCA Gaussian bandwidth from the 112th- to the 104th-neighbor radius	The retained 128-neighbor final covariance improves medium- and high-noise averaging, but its 112th-neighbor Gaussian radius gives curved or density-biased outer samples enough leverage to cause measured clean, low-noise, stripe, and gradient regressions. Recompute only the final spatial weights as exp(-2 d^2 / r_104^2), retaining all 128 samples as a more strongly decaying tail and leaving the 224-neighbor initialization, first 112-neighbor Tukey correction, robust cutoffs, and fit count unchanged. Clean, low-noise, stripe, and gradient conditions should improve through lower neighborhood bias; medium and high noise may regress because the effective averaging support shrinks. The cost is one final weight-vector recomputation with no new samples or eigendecomposition. Ablate by setting FINAL_BANDWIDTH_COUNT back to 112. The ordered quadratic-jet item remains deferred because its prior prediction crash has no precise diagnostic to address, as required by the batch rule.	original
105	c8440a31e9959a8097b6b369ff2c990608e9179f	17.747725		1.437	106.6	discard			baseline	Narrow only the 128-neighbor final Tukey-PCA Gaussian bandwidth from the 112th- to the 108th-neighbor radius	The retained 128-neighbor final covariance improves medium- and high-noise averaging, but its 112th-neighbor Gaussian radius gives curved or density-biased outer samples enough leverage to regress clean, low-noise, stripe, and gradient accuracy. The measured 104th-neighbor radius recovered all four geometry-sensitive conditions but slightly worsened both noisy conditions, so 108 is the untested midpoint between that anchor and the retained 112 radius. Recomputing only the final spatial weights as exp(-2 d^2 / r_108^2) keeps all 128 samples as a decaying tail and should recover part of the curvature and neighborhood-bias gains with less loss of noise averaging than r_104. Clean, low, stripe, and gradient should improve; medium and high may regress slightly. The cost is one final weight-vector recomputation with no new samples or eigendecomposition. Ablate by setting FINAL_BANDWIDTH_COUNT back to 112 with every other setting unchanged. The ordered quadratic-jet item remains deferred because its prior prediction crash has no precise diagnostic to address.	original
106	816cdceadce255960f48254c3e3e3e8918c8d854	17.78095		1.429	95.4	discard			baseline	Reduce only the final Tukey-PCA refinement from 128 to 120 neighbors	Extending the final robust covariance from 112 to 128 neighbors improved medium- and high-noise accuracy through additional averaging, but measurably worsened clean, low-noise, stripe, and gradient conditions through curvature and density bias. Using 120 neighbors is the untested midpoint between those measured anchors: after the first 112-neighbor Tukey correction, only neighbors 113 through 120 enter the final covariance, with the bandwidth still fixed by the 112th-neighbor radius so they form a short decaying Gaussian tail. Clean, low-noise, stripe, and gradient conditions should improve by removing the least local eight samples; medium and high noise may regress slightly because of reduced covariance support. The change reduces final weighted-median and covariance work and adds no mechanism. Ablate by restoring FINAL_NEIGHBOR_COUNT to 128 with every other setting unchanged. The ordered quadratic-jet item remains deferred because its prior prediction crash has no precise diagnostic to address.	original
107	bd5fad39463780bc78561770040276a074ec165c	17.76706		1.437	110.8	discard			baseline	Reduce only the final Tukey-PCA refinement from 128 to 124 neighbors	The retained 128-neighbor final covariance improves medium- and high-noise accuracy through extra averaging, but its outer tail measurably increases curvature and density bias on clean, low-noise, stripe, and gradient patches. The measured 120-neighbor endpoint recovered all four geometry-sensitive conditions but removed enough support to regress both noisy conditions; 124 is the untested midpoint between those anchors. After the first 112-neighbor Tukey correction, neighbors 113 through 124 enter the final covariance with the bandwidth still fixed by the 112th-neighbor radius, so they remain a short Gaussian-decaying tail. Clean, low-noise, stripe, and gradient conditions should improve modestly through lower neighborhood bias; medium and high noise may regress slightly through reduced covariance averaging, but less than at 120. The change removes four samples from only the final weighted-median and covariance calculations and adds no mechanism. Ablate by restoring FINAL_NEIGHBOR_COUNT to 128 with every other setting unchanged. The ordered quadratic-jet item remains deferred because its prior prediction crash provides no precise diagnostic to address, as required by the batch strategy.	original
108	af785b593d79e788754be340f0441d63c13016f1	17.739822		1.384	96.0	discard			low	Estimate final Tukey residual location and scale from the 112-neighbor core while retaining 128-neighbor covariance support	The retained 128-neighbor final covariance improves medium- and high-noise averaging, but letting its outer Gaussian tail define the weighted residual median and MAD allows curved or density-biased tail samples to shift or inflate the robust reference distribution and thereby preserve their own leverage. In the final refinement, estimate the Tukey location m and scale 1.4826 weighted_median(|e-m|) from the nearest 112 residuals, then apply the resulting redescending weights to all 128 covariance samples. Clean, low-noise, stripe, and gradient conditions should improve through lower neighborhood bias; medium and high noise may regress if the smaller core yields a less stable scale and rejects valid noisy tail samples. The cost is only slicing existing arrays, with unchanged covariance support, sorting order, and eigendecomposition count. Ablate by setting FINAL_STATISTIC_COUNT to 128, exactly recovering the current frontier estimator. The ordered quadratic-jet item is skipped because its prior prediction crash has no precise diagnostic to address, as required by the batch strategy.	original
109	17df3c43ec218e66dfda870d34616efe47be4e4f	17.724675		1.359	96.1	discard			low	Estimate final Tukey residual location and scale from a 96-neighbor core while retaining 128-neighbor covariance support	The retained 128-neighbor final covariance improves medium- and high-noise averaging, but curved or density-biased tail samples can shift and inflate the robust residual distribution that controls their own Tukey leverage. The measured 112-core version improved every development condition, directly supporting stronger separation between robust-statistic locality and covariance support; using the nearest 96 residuals is the next untested locality anchor and matches a previously useful scale. Compute the Gaussian-weighted median m and MAD scale from that core, then apply the resulting redescending weights to all 128 samples. Clean, low-noise, stripe, and gradient conditions should improve through lower neighborhood bias; medium and high noise may also improve as at 112, but could regress if the smaller core makes scale estimation less stable. The cost is only array slicing, with unchanged covariance support and eigendecomposition count. Ablate by setting FINAL_STATISTIC_COUNT to 128, exactly recovering the current frontier estimator.	original
110	0c63783a7d4e6935ce45fa30196b03479c26afa3	17.706787		1.306	95.8	discard			low	Estimate final Tukey residual location and scale from an 80-neighbor core while retaining 128-neighbor covariance support	The retained 128-neighbor final covariance improves medium- and high-noise averaging, but curved or density-biased tail samples can shift and inflate the robust residual distribution that controls their own Tukey leverage. The measured 112- and 96-neighbor statistic cores improved every development condition, with the 96-core version giving larger clean, low-noise, stripe, and gradient gains, so 80 neighbors is the next untested locality anchor. Compute the Gaussian-weighted residual median m and MAD scale from the nearest 80 samples, then apply the resulting redescending weights to all 128 covariance samples. Clean, low-noise, stripe, and gradient should improve through lower neighborhood bias; medium and high noise may remain improved as at the two broader cores, but could regress if the smaller core makes scale estimation unstable. The cost is only array slicing with unchanged covariance support and eigendecomposition count. Ablate by setting FINAL_STATISTIC_COUNT to 128, exactly recovering the current frontier estimator.	original
111	ec660c723a45e368820b254e0948bda4d6c048b9	17.683331	14.779952	1.269	104.8	keep			low	Estimate final Tukey residual location and scale from a 64-neighbor core while retaining 128-neighbor covariance support	The 128-neighbor final covariance improves positional-noise averaging, but curved or density-biased tail samples can shift and inflate the robust residual distribution that controls their own Tukey leverage. The measured 112-, 96-, and 80-neighbor statistic cores improved every development condition, with increasingly local cores giving larger clean, low-noise, stripe, and gradient gains, so 64 neighbors is the next untested locality anchor. Compute the Gaussian-weighted residual median m and MAD scale from the nearest 64 samples, then apply the resulting redescending weights to all 128 covariance samples. Clean, low-noise, stripe, and gradient should improve through lower neighborhood bias; medium and high noise may remain improved as at the broader cores, but could regress if 64 samples make scale estimation unstable. The cost is only array slicing, with unchanged covariance support and eigendecomposition count. Ablate by setting FINAL_STATISTIC_COUNT to 128, exactly recovering the current frontier estimator.	original
112	fcdd215654144448371a2755bf23c2957f97002a	17.653775		1.245	96.8	discard			baseline	Estimate final Tukey residual location and scale from a 48-neighbor core while retaining 128-neighbor covariance support	The 128-neighbor final covariance supplies useful positional-noise averaging, but curved or density-biased outer samples can shift and inflate the robust residual distribution that controls their own Tukey leverage. The measured 112-, 96-, 80-, and 64-neighbor statistic cores improved every development condition, with increasingly local cores giving larger clean, low-noise, stripe, and gradient gains; 48 neighbors is the next untested scale anchor. Compute the Gaussian-weighted residual median m and MAD scale from the nearest 48 samples, then apply the resulting redescending weights to all 128 covariance samples. Clean, low-noise, stripe, and gradient should improve through lower neighborhood bias; medium and high noise may remain improved as at broader cores, but could regress if 48 samples make scale estimation unstable. The cost is only a smaller array slice, with unchanged covariance support and eigendecomposition count. Ablate by setting FINAL_STATISTIC_COUNT back to 64, exactly recovering the current frontier estimator.	original
113	ff67f75617af30a129220f853eb8e47e282c68ec	17.655119		1.295	96.9	discard			low	Estimate final Tukey residual location from 48 core neighbors while retaining the 64-neighbor scale estimate	Curvature or asymmetric density can offset the final residual sheet, so its robust center should be highly query-local; however, estimating MAD from the same small core can make the rejection scale noisy. The measured 48-neighbor joint location-scale probe improved every development condition but less than the retained 64-neighbor version, motivating this independent separation: compute m as the Gaussian-weighted median of the nearest 48 residuals, compute sigma = 1.4826 weighted_median(|e - m|) from the nearest 64, and apply the resulting Tukey weights to all 128 covariance samples. Clean, low-noise, stripe, and gradient conditions should improve through a more local center, while medium and high noise should retain the stabler 64-sample scale but may regress if the 48-sample location is noisy. The cost is one smaller median sort with unchanged covariance support and eigendecomposition count. Ablate by setting FINAL_LOCATION_COUNT back to 64, exactly recovering the frontier estimator.	original
