iteration	candidate_commit	dev_rmse	val_rmse	runtime_s	memory_mb	status	failure_stage	failure_message	complexity	description	rationale	source
270	ac32a76b2ba66e373436c2bc3604a891f94aaf40	17.331061		1.337	105.3	discard			baseline	Shrink the gated third-pass covariance 1.25% toward the preceding two-step covariance	The thin-sheet third Tukey fit reduces curvature, density, and outlier bias, but redescending rejection lowers effective support and makes its covariance noisier. Measured shrinkage strengths of 10%, 5%, and 2.5% consistently improved medium- and high-noise conditions while increasingly smaller strengths caused increasingly smaller clean, low-noise, stripe, and gradient regressions; 1.25% is the next untested weaker anchor. For the third pass only, diagonalize C = 0.9875 C3 + 0.0125 C2, transferring a minimal amount of stability from the better-supported preceding covariance while preserving nearly all of the robust geometric correction. Medium and high noise should improve slightly; clean, low-noise, stripe, and gradient may regress, but less than at 2.5%. The cost is one 3-by-3 matrix blend per query with no extra eigendecomposition. Ablate by setting THIRD_COVARIANCE_SHRINKAGE to zero, exactly recovering the validated thickness-gated estimator; setting it to 0.025 independently recovers the measured stronger endpoint.	original
271	305c2be94c2bd1e8ff1c8fc1190aac0dbe09e2ef	17.330358		1.369	113.5	discard			baseline	Shrink the gated third-pass covariance 0.625% toward the preceding two-step covariance	The thin-sheet third Tukey fit reduces curvature, density, and outlier bias, but redescending rejection lowers effective support and makes its covariance noisier. Measured shrinkage strengths of 10%, 5%, 2.5%, and 1.25% consistently improved medium- and high-noise conditions while progressively weaker strengths caused progressively smaller clean, low-noise, stripe, and gradient regressions; 0.625% is the next untested halving. For the third pass only, diagonalize C = 0.99375 C3 + 0.00625 C2, transferring minimal stability from the better-supported preceding covariance while retaining nearly all of the robust geometric correction. Medium and high noise should improve slightly; clean, low-noise, stripe, and gradient may regress by an even smaller amount than at 1.25%. The cost is one 3-by-3 matrix blend per query with no extra eigendecomposition. Ablate by setting THIRD_COVARIANCE_SHRINKAGE to zero, exactly recovering the validated thickness-gated estimator; setting it to 0.0125 independently recovers the measured stronger endpoint.	original
272	cb3e7fbcee2ae4b8c779214c7055ea4c69687fb0	17.330009		1.372	97.5	discard			baseline	Shrink the gated third-pass covariance 0.3125% toward the preceding two-step covariance	The thin-sheet third Tukey fit reduces curvature, density, and outlier bias, but redescending rejection lowers effective support and makes its covariance noisier. Measured shrinkage strengths from 10% through 0.625% consistently improved medium- and high-noise conditions while progressively weaker strengths caused progressively smaller clean, low-noise, stripe, and gradient regressions; 0.3125% is the next untested halving. For the third pass only, diagonalize C = 0.996875 C3 + 0.003125 C2, transferring minimal stability from the better-supported preceding covariance while retaining nearly all of the robust geometric correction. Medium and high noise should improve slightly; clean, low-noise, stripe, and gradient may regress by less than at 0.625%. The cost is one 3-by-3 matrix blend per query with no extra eigendecomposition. Ablate by setting THIRD_COVARIANCE_SHRINKAGE to zero, exactly recovering the validated thickness-gated estimator; setting it to 0.00625 independently recovers the measured stronger endpoint.	original
273	9e06e07f5395d231fbe1b358505e9fab6f21d282	17.329834		1.324	95.5	discard			baseline	Shrink the gated third-pass covariance 0.15625% toward the preceding two-step covariance	The thin-sheet third Tukey fit reduces curvature, density, and outlier bias, but redescending rejection lowers effective support and makes its covariance noisier. Measured shrinkage strengths from 10% through 0.3125% consistently improved medium- and high-noise conditions while progressively weaker strengths caused progressively smaller clean, low-noise, stripe, and gradient regressions; 0.15625% is the next untested halving. For the third pass only, diagonalize C = 0.9984375 C3 + 0.0015625 C2, transferring minimal stability from the better-supported preceding covariance while retaining nearly all of the robust geometric correction. Medium and high noise should improve slightly; clean, low-noise, stripe, and gradient may regress by less than at 0.3125%. The cost is one 3-by-3 matrix blend per query with no extra eigendecomposition. Ablate by setting THIRD_COVARIANCE_SHRINKAGE to zero, exactly recovering the validated thickness-gated estimator; setting it to 0.003125 independently recovers the measured stronger endpoint.	original
274	e8b263188975f7179ee99cb6920df78fea1e9238	17.329747		1.349	97.4	discard			baseline	Shrink the gated third-pass covariance 0.078125% toward the preceding two-step covariance	The thin-sheet third Tukey fit reduces curvature, density, and outlier bias, but redescending rejection lowers effective support and makes its covariance noisier. Measured shrinkage strengths from 10% through 0.15625% consistently improved medium- and high-noise conditions while progressively weaker strengths caused progressively smaller clean, low-noise, stripe, and gradient regressions; 0.078125% is the next untested halving in that ordered parameter sequence. For the third pass only, diagonalize C = 0.99921875 C3 + 0.00078125 C2, transferring minimal stability from the better-supported preceding covariance while retaining nearly all of the robust geometric correction. Medium and high noise should improve slightly; clean, low-noise, stripe, and gradient may regress by less than at 0.15625%. The cost is one 3-by-3 matrix blend per query with no extra eigendecomposition. Ablate by setting THIRD_COVARIANCE_SHRINKAGE to zero, exactly recovering the validated thickness-gated estimator; setting it to 0.0015625 independently recovers the measured stronger endpoint. The ordered quadratic-jet retry remains skipped because its prior prediction failure has no precise diagnostic to address.	original
275	f1770480d3d994bc6fe3f2dd7de531e137a6ea7f	17.324171		1.32	97.7	discard			low	Extrapolate the accepted thin-sheet third Tukey normal 5% beyond its two-step correction	The gated third refinement corrects curvature-, asymmetric-density-, and outlier-induced tangent bias on thin coherent sheets, and the completed covariance-shrinkage sweep showed that attenuating this correction consistently worsens clean, low-noise, stripe, and gradient accuracy while only slightly helping medium/high noise. Test the unmeasured opposite direction: sign-align the third normal n3 with the two-step normal n2 and return normalize(n3 + 0.05 (n3 - n2)) only where the retained thickness gate accepts the third fit. This small geometric extrapolation assumes the successive robust correction still points toward the query-local tangent and may improve clean, low-noise, stripe, and gradient conditions; medium and high noise may regress if a residual noise-driven rotation is amplified. The cost is one dot product, vector update, and normalization per query, with no additional neighborhood fit. Ablate by setting THIRD_NORMAL_EXTRAPOLATION to zero, exactly recovering the validated estimator.	original
276	03687df12bf4bcfc693dd371668e794a1fc176b5	17.318931		1.34	97.6	discard			baseline	Extrapolate accepted thin-sheet third-step normal corrections by 10%	The retained gated third Tukey fit corrects curvature-, asymmetric-density-, and outlier-induced tangent bias on thin coherent sheets. The measured 5% normal extrapolation improved clean, low-noise, stripe, and gradient accuracy with only tiny medium/high-noise losses, while the completed covariance-shrinkage sweep showed that attenuating the same correction consistently moves those geometry-sensitive conditions in the wrong direction. For each gate-accepted patch, sign-align n3 to n2 and return normalize(n3 + 0.10 (n3 - n2)); this tests the next simple parameter anchor under the hypothesis that successive robust corrections still point toward the query-local tangent. Clean, low-noise, stripe, and gradient should improve further; medium and high noise may regress if residual noise-driven rotation is amplified. The cost is one dot product, vector update, and normalization per query, with no additional fit. Ablate by removing the extrapolation and returning the accepted third-step normal, exactly recovering the validated estimator; the measured 0.05 setting independently isolates extrapolation strength.	original
277	1962da4702c43034290a150a9e9d78b60ea37388	17.309203		1.433	102.6	discard			baseline	Extrapolate accepted thin-sheet third-step normal corrections by 20%	The retained gated third Tukey fit corrects curvature-, asymmetric-density-, and outlier-induced tangent bias on thin coherent sheets. Measured 5% and 10% extrapolation both improved clean, low-noise, stripe, and gradient accuracy, and the 10% anchor approximately doubled those geometry-sensitive gains with only tiny additional medium/high-noise losses, so 20% is the next untested ordered strength. For each gate-accepted patch, sign-align n3 to n2 and return normalize(n3 + 0.20 (n3 - n2)); this treats the successive robust displacement as a still-underrelaxed correction toward the query-local tangent. Clean, low-noise, stripe, and gradient should improve further; medium and high noise may regress if residual noise-driven rotation is amplified. The cost is one sign alignment, vector update, and normalization per query, with no additional fit. Ablate by setting THIRD_NORMAL_EXTRAPOLATION to zero, exactly recovering the validated estimator; settings 0.05 and 0.10 independently recover the measured anchors.	original
278	5186554f8f8f85a2aa6ba6af25f9e43f87eb80c0	17.29277		1.367	111.7	discard			baseline	Extrapolate accepted thin-sheet third-step normal corrections by 40%	The gated third Tukey refinement corrects curvature-, asymmetric-density-, and outlier-induced tangent bias on thin coherent sheets. Measured 5%, 10%, and 20% extrapolation produced progressively larger improvements on clean, low-noise, stripe, and gradient conditions, indicating that the successive robust correction remains underrelaxed; 40% is the next ordered strength. For each gate-accepted patch, sign-align n3 to n2 and return normalize(n3 + 0.40 (n3 - n2)). Clean, low-noise, stripe, and gradient should improve further, while medium and high noise may regress if residual noise-driven rotation is amplified. The cost is one sign alignment, vector update, and normalization per query, with no additional fit. Ablate by setting THIRD_NORMAL_EXTRAPOLATION to zero, exactly recovering the validated estimator; settings 0.05, 0.10, and 0.20 independently recover the measured anchors.	original
279	c529cefe0007af493961dd386de9f5323568936b	17.268683	14.444381	1.332	105.2	keep			baseline	Extrapolate accepted thin-sheet third-step normal corrections by 80%	On thin coherent patches, successive Tukey-PCA refinements correct curvature-, asymmetric-density-, and outlier-induced tangent bias, but the retained third update remains underrelaxed. Measured extrapolation strengths of 5%, 10%, 20%, and 40% produced progressively larger improvements on clean, low-noise, stripe, and gradient conditions with only very small medium/high-noise losses, so 80% is the next ordered anchor. For gate-accepted patches, sign-align n3 to n2 and return normalize(n3 + 0.8 (n3 - n2)); medium and high noise may regress if residual noise-driven rotation is amplified. The cost is one sign alignment, vector update, and normalization with no additional fit. Ablate by setting THIRD_NORMAL_EXTRAPOLATION to zero, exactly recovering the validated estimator; 0.4 independently recovers the preceding measured anchor.	original
280	0e51cd19ec57c8bc30f13204475391cfc1479f36	17.267139		1.337	113.7	discard			baseline	Extrapolate accepted thin-sheet third-step normal corrections by 160%	On thin coherent patches, successive Tukey-PCA refinements correct curvature-, asymmetric-density-, and outlier-induced tangent bias, but the retained third update appears underrelaxed. Measured extrapolation strengths from 5% through 80% produced monotonic gains on clean, low-noise, stripe, and gradient conditions with only small medium/high-noise losses, so 160% is the next ordered parameter anchor. For gate-accepted patches, sign-align n3 to n2 and return normalize(n3 + 1.6 (n3 - n2)); this extends the measured robust correction without another neighborhood fit. Clean, low-noise, stripe, and gradient should improve further, while medium and high noise may regress if residual noise-driven rotation is amplified. The cost is unchanged: one vector update and normalization per accepted query. Ablate by setting THIRD_NORMAL_EXTRAPOLATION to zero, exactly recovering the non-extrapolated gated estimator; setting it to 0.8 independently recovers the current frontier. The quadratic-jet batch item remains skipped because its prior prediction failure has no precise diagnostic to address.	original
281	a4bf09f713448082f33e18a25652688d1ce34741	17.260117		1.329	97.4	discard			baseline	Extrapolate accepted thin-sheet third-step normal corrections by 120%	On thin coherent patches, successive Tukey-PCA refinements correct curvature-, asymmetric-density-, and outlier-induced tangent bias, but the retained third update remains underrelaxed. Extrapolation strengths through 80% produced monotonic gains on clean, low-noise, stripe, and gradient conditions, whereas 160% crossed the trade-off by regressing low noise and stripe; 120% is the untested midpoint. For each gate-accepted patch, sign-align n3 to n2 and return normalize(n3 + 1.2 (n3 - n2)). Clean and gradient should improve, and low-noise and stripe may improve if the correction remains underrelaxed; medium and high noise may regress slightly, while low-noise and stripe may also regress if 120% is already beyond their optimum. The change only alters one scalar and adds no computation. Ablate by setting THIRD_NORMAL_EXTRAPOLATION to zero to recover the non-extrapolated gated estimator; setting it to 0.8 independently recovers the current frontier.	original
282	f99cb6fef6b529936aecc1cb544c8b38996fb577	17.26241		1.375	104.6	discard			baseline	Extrapolate accepted thin-sheet third-step normal corrections by 100%	On thin coherent patches, successive Tukey-PCA refinements correct curvature-, asymmetric-density-, and outlier-induced tangent bias, but the retained third update remains underrelaxed. The retained 80% extrapolation improved clean, low-noise, stripe, and gradient conditions, while measured 120% began to regress low noise and stripe; 100% is the untested midpoint that brackets this trade-off. For gate-accepted patches, sign-align n3 to n2 and return normalize(n3 + 1.0 (n3 - n2)). Clean and gradient should improve, and low-noise and stripe may improve if their optimum lies above 80%; medium and high noise may regress slightly from amplified noise-driven rotation, while low-noise and stripe may also regress if 80% is already optimal. This changes one scalar with no added computation. Ablate by setting THIRD_NORMAL_EXTRAPOLATION to zero to recover the non-extrapolated gated estimator; setting it to 0.8 independently recovers the validated frontier.	original
283	cdd1b9888a4993a5a03116bfec3399fa38c71e15	17.265045		1.361	105.2	discard			baseline	Extrapolate accepted thin-sheet third-step normal corrections by 90%	On thin coherent patches, successive Tukey-PCA refinements reduce curvature-, asymmetric-density-, and outlier-induced tangent bias, but the retained third update appears slightly underrelaxed. The validated 80% extrapolation improved clean, low-noise, stripe, and gradient accuracy, while the measured 100% endpoint further improved clean, stripe, and gradient but slightly regressed low noise; 90% is the untested midpoint that isolates this local trade-off. For each gate-accepted patch, sign-align n3 to n2 and return normalize(n3 + 0.9 (n3 - n2)). Clean, stripe, and gradient should improve modestly; low noise may regress slightly, and medium/high noise may regress very slightly if noise-driven rotation is amplified. This changes one scalar with no added computation. Ablate by setting THIRD_NORMAL_EXTRAPOLATION to zero to recover the non-extrapolated gated estimator; setting it to 0.8 exactly recovers the validated frontier.	original
284	5ca44db5a2e0796ed22af8c831f0930a3c3ffa85	17.266738		1.384	113.7	discard			baseline	Extrapolate accepted thin-sheet third-step normal corrections by 85%	On thin coherent patches, successive Tukey-PCA refinements reduce curvature-, asymmetric-density-, and outlier-induced tangent bias, but the retained third update remains slightly underrelaxed. The validated 80% extrapolation is the best retained anchor, while 90% further improved clean, stripe, and gradient accuracy but slightly regressed low noise; 85% is the untested midpoint that isolates this local trade-off. For each gate-accepted patch, sign-align n3 to n2 and return normalize(n3 + 0.85 (n3 - n2)). Clean, stripe, and gradient should improve modestly; low noise may regress slightly, and medium/high noise may regress very slightly if noise-driven rotation is amplified. This changes one scalar with no added computation. Ablate by setting THIRD_NORMAL_EXTRAPOLATION to zero to recover the non-extrapolated gated estimator; setting it to 0.8 exactly recovers the validated frontier.	original
285	05b8de829cd7ee75ca870547958b161daf1245e8	17.267679		1.32	105.4	discard			baseline	Extrapolate accepted thin-sheet third-step normal corrections by 82.5%	On thin coherent patches, successive Tukey-PCA refinements reduce curvature-, asymmetric-density-, and outlier-induced tangent bias, but the third update remains slightly underrelaxed. The validated 80% extrapolation is the best retained anchor, while the measured 85% endpoint further improved clean, stripe, and gradient accuracy but slightly regressed low, medium, and high noise; 82.5% is the untested midpoint that completes this local bracket. For each gate-accepted patch, the estimator sign-aligns n3 to n2 and returns normalize(n3 + 0.825 (n3 - n2)). Clean, stripe, and gradient should improve slightly; low, medium, and high noise may regress very slightly if noise-driven rotation is amplified. This changes one global scalar with no added runtime or asymptotic cost. Ablate by restoring the extrapolation to 0.8, exactly recovering the validated frontier; comparison with 0.85 isolates the midpoint parameter.	original
286	a0ca1d8ed50b1c7512aed6735259da71aff70eed	17.275221		1.338	105.6	discard			medium	Extrapolate the gated third-step normal only when Tukey rejection retains at least half of the Gaussian weight mass	The retained 80% extrapolation strongly improves clean, low-noise, stripe, and gradient patches, but slightly amplifies medium/high-noise rotations even when the third redescending covariance is supported by only a small inlier subset. Keep the retained thin-sheet third refinement itself, but apply n = normalize(n3 + 0.8 (n3 - n2)) only when the pre-normalization mass sum_i w_G,i w_T,i is at least 0.5; accepted low-mass patches return the sign-aligned n3 instead. Thus support confidence controls only amplification, rather than discarding the useful robust correction as the previously rejected retained-mass acceptance gate did. Medium and high noise should improve by avoiding extrapolation of under-supported rotations; clean, low-noise, stripe, and gradient may regress where a sparse but valid geometric correction was previously amplified, but should preserve the underlying third-step benefit. The cost is one scalar comparison using the weight sum already required for normalization. Ablate by setting THIRD_EXTRAPOLATION_MIN_RETAINED_MASS to zero, exactly recovering the validated 80% extrapolation.	original
287	c6bc7b4f11424d9a54066028be43aa096958567d	17.268636		1.338	97.8	discard			medium	Smoothly scale third-step normal extrapolation by retained Tukey weight mass	The retained 80% extrapolation corrects underrelaxed curvature-, asymmetric-density-, and outlier-induced tangent bias on thin sheets, but it can amplify a third-step rotation supported by only a small Tukey inlier subset. The measured hard 0.5-mass guard improved low, medium, high, and stripe conditions but regressed clean and gradient by removing extrapolation abruptly. This change instead multiplies the 0.8 extrapolation by clip((M - 0.25) / (0.50 - 0.25), 0, 1), where M = sum_i w_G,i w_T,i is the pre-normalization retained Gaussian mass. Thus fits retaining at least half the spatial kernel receive the full correction, marginally supported fits receive a continuous attenuation, and severely collapsed fits receive none. Medium and high noise should improve by reducing amplification of under-supported rotations; clean, low-noise, stripe, and gradient may regress where sparse geometric inliers are valid, but should retain more benefit than under the rejected hard guard. The cost is one weight sum and scalar ramp per query with no new fit. Ablate by replacing the mass confidence with one, exactly recovering the validated fixed 80% extrapolation; thresholding it at 0.5 independently recovers the measured hard guard.	original
