iteration	candidate_commit	dev_rmse	val_rmse	runtime_s	memory_mb	status	failure_stage	failure_message	complexity	description	rationale	source
41	16a285296861b3b1737191f013bd5340d0968a88	18.095621		1.044	93.2	discard			baseline	Relax only the 224-neighbor initialization kernel from Gaussian decay 2.0 to 1.0	The retained broad initialization improves medium- and high-noise normals by stabilizing the provisional plane, but decay 2.0 gives little effective weight to the added tail; conversely, the measured decay-3.0 initialization lost noise accuracy. Using exp(-(d/r_112)^2) for only the 224-neighbor provisional covariance increases noise-averaging support, while explicitly recomputing exp(-2(d/r_112)^2) weights for both final 112-neighbor Cauchy refinements prevents the broader kernel from directly biasing the final covariance. Medium and high noise should improve; clean, low-noise, stripe, and gradient conditions may regress if curvature or asymmetric density tilts provisional residual classification. This changes one scalar and adds only one local weight computation. Ablate by setting INITIAL_DISTANCE_DECAY back to 2.0, exactly recovering the frontier.	original
42	94e804b8fca96226d479369e4c79f2ff30cccfca	18.285766		1.003	81.2	discard			baseline	Reduce the robust refinement neighborhood and Gaussian bandwidth anchor from 112 to 96 neighbors	The retained 224-neighbor initialization reduces variance under medium and high positional noise, but the final 112-neighbor robust covariances can still average across curvature or asymmetric density and tilt the query-local tangent. Using the 96th-neighbor radius as the Gaussian bandwidth and retaining only 96 points in both Cauchy refinements makes the final fit more local while preserving the broad provisional normal. Clean, low-noise, stripe, and gradient conditions should improve through lower curvature and neighborhood bias; medium and high noise may regress because the final covariances average fewer samples. This changes one global neighborhood parameter, reduces refinement work, and adds no mechanism. Ablate by restoring NEIGHBOR_COUNT to 112, exactly recovering the frontier estimator.	original
43	cc3edfa78f113b9425f86ea12380115e926a2299	18.175115		1.034	88.6	discard			baseline	Use 96 neighbors only for the final Cauchy PCA refinement	The retained 224-neighbor initialization stabilizes normals under medium and high positional noise, but the final 112-neighbor covariance can still be tilted by curvature or asymmetric density. The measured all-pass k=96 probe improved clean, low-noise, stripe, and gradient conditions while losing substantial noise accuracy. This parameter change therefore keeps the provisional fit and first robust refinement at 224 and 112 neighbors, respectively, and truncates only the final, already-corrected Cauchy fit to 96 neighbors while retaining the 112th-neighbor Gaussian bandwidth. Clean, low, stripe, and gradient should improve through a more query-local final tangent; medium and high may regress from reduced final covariance support, but less than when both refinements used 96 points. The cost is lower final-pass work and one global support parameter. Ablate by setting the final support back to 112, exactly recovering the frontier estimator.	original
44	75a841ddeb4e7966e8978f985de5ff3ad3b273ea	17.97892	15.090036	1.243	80.3	keep			low	Use Gaussian-distance-weighted medians for residual location and MAD scale in both Cauchy refinements	The robust covariance is spatially localized by Gaussian weights, but its residual median and MAD currently give distant boundary samples the same influence as query-local samples. Computing weighted medians with the fixed Gaussian distance weights makes the Cauchy scale estimate consistent with the local fitting objective: the weighted median minimizes the corresponding weighted absolute-deviation loss, and its weighted MAD describes residual spread near the query rather than across the whole truncated patch. Clean, low-noise, stripe, and gradient conditions should improve through reduced curvature and density bias; medium and high noise may regress if the more local scale is smaller and rejects valid noisy samples. The cost is two deterministic row-wise sorts per refinement. Ablate by replacing both weighted medians with ordinary medians, exactly recovering the frontier estimator.	original
45	07c6fd9c3aa89d5a925f97568efd56e15d2803de	17.915474	15.040824	1.281	92.7	discard			low	Center first-pass Cauchy residuals on their Gaussian-weighted median	The retained provisional normal is fitted on 224 neighbors, so curvature or asymmetric density can displace its broad plane offset from the local 112-neighbor surface sheet even when its direction is stable. In only the first robust refinement, use e_i - weighted_median(e) in the Cauchy factor; this translates the provisional plane to the robust query-local residual location before classifying leverage. The second refinement remains zero-centered because its plane has already been refitted about a local robust centroid. Clean, low-noise, stripe, and gradient conditions should improve through reduced broad-neighborhood offset bias; medium and high noise may regress if the local median is less stable than the broad offset. The weighted median is already computed for MAD, so the cost is one subtraction and no new sort or eigendecomposition. Ablate by using the uncentered first-pass residuals, exactly recovering the current estimator.	original
46	642cb38fef3e60e3785e256047d13d14824e3023	17.929403		1.265	81.1	discard			low	Center second-pass Cauchy residuals on their Gaussian-weighted median	Even after one robust covariance refit, curvature or asymmetric density can leave the fixed Gaussian-weighted residual distribution offset from zero because the fitted centroid is a weighted mean rather than a robust location. In only the second refinement, replace e_i by e_i - weighted_median(e) in the Cauchy factor, so final leverage is measured around the query-local surface sheet while the first refinement and its stable broad-plane classification remain unchanged. The prior first-pass-only probe improved every development condition, providing evidence that this local residual location is meaningful, but was not retained; this experiment independently tests the remaining pass. Clean, low-noise, stripe, and gradient conditions should improve through reduced curvature and neighborhood bias, while medium and high noise may regress if the local weighted median is unstable. The median is already computed for MAD, so the cost is one subtraction and a pass index, with no new sort or eigendecomposition. Ablate by using the uncentered second-pass residuals, exactly recovering the frontier estimator.	original
47	b4fab5a8463b0960402d806a684b70f5ba746000	17.889097	15.016975	1.311	92.6	keep			low	Center both Cauchy refinement losses on the Gaussian-weighted residual median	Curvature, asymmetric density, and the broad provisional fit can offset the local residual sheet from zero, causing a zero-centered Cauchy loss to downweight valid surface samples asymmetrically. In both retained refinements, use u_i = (e_i - weighted_median(e)) / (c sigma) rather than e_i / (c sigma), making the robust loss location consistent with the Gaussian-weighted median already used to compute MAD. The separate first-pass-only and second-pass-only probes each improved clean, low, medium, high, stripe, and gradient development conditions, so applying the same location mechanism consistently in both passes should combine those reductions in neighborhood bias; medium and high noise could regress if their local weighted medians are unstable. The median is already computed, so the cost is two subtractions and no new sort or eigendecomposition. Ablate by removing the median subtraction in both passes, exactly recovering the frontier estimator.	original
48	b01769430adf0874471f4012b04a66a1c9a6f5cf	17.841476		1.285	83.4	discard			baseline	Narrow only the robust-refinement Gaussian bandwidth from the 112th- to the 96th-neighbor radius while retaining 112-point support	The final robust covariances can still be tilted by curvature or asymmetric density because their Gaussian kernel has substantial leverage across the full 112-neighbor patch. Prior k=96 experiments changed support and bandwidth together, while a final-support-only probe retained the broad bandwidth; this complementary parameter change isolates spatial tapering by normalizing both refinement kernels with the 96th-neighbor radius but retaining neighbors 97 through 112 as a decaying tail. Clean, low-noise, stripe, and gradient conditions should improve through greater query locality; medium and high noise may regress because tighter weights reduce effective averaging support, although retaining all 112 samples should make that loss smaller than hard truncation. The cost is one local Gaussian weight computation with unchanged covariance and eigendecomposition counts. Ablate by restoring the 112th-neighbor refinement bandwidth, exactly recovering the frontier estimator.	original
49	75d844833b728a5f0e95b3dbf44c8d4f32340e0f	17.93498		1.299	97.6	discard			baseline	Widen only the robust-refinement Gaussian bandwidth from the 112th- to the 128th-neighbor radius while retaining 112-point support	The retained robust refinements still have limited effective covariance support under medium and high positional noise because their Gaussian kernel is normalized by the outermost retained neighbor, giving boundary samples weight exp(-2). The measured 96th-neighbor bandwidth probe improved clean, low-noise, stripe, and gradient conditions but worsened medium and high noise, so this complementary parameter probe tests the opposite side of that measured locality-versus-averaging trade-off. Normalizing both refinement kernels by the 128th-neighbor radius raises all retained off-center weights without admitting any additional points; medium and high noise should improve through more uniform averaging, while clean, low-noise, stripe, and gradient may regress because boundary curvature or density bias gains leverage. The cost is only one bandwidth lookup with unchanged support, covariance, sorting, and eigendecomposition counts. Ablate by restoring the 112th-neighbor refinement bandwidth, exactly recovering the frontier estimator.	original
50	6d453cd1842b6393480473af0c0f83c922e17462					crash	development.prediction	command exited with status 1	medium	Add a Gaussian- and Cauchy-weighted quadratic jet refinement in the final robust PCA frame	A plane fitted across a curved or asymmetrically sampled patch can tilt because it must absorb second-order surface variation into one constant normal. After the retained robust PCA, this change expresses query-relative neighbors in its normalized local frame and fits z = c0 + c1 x + c2 y + c3 x^2 + c4 xy + c5 y^2 with the final robust weights; the query normal is proportional to n - c1 t1 - c2 t2, while the quadratic terms absorb curvature. Clean, low-noise, stripe, and gradient conditions should improve through lower curvature and neighborhood bias; medium and high noise may regress because estimating six coefficients has higher variance than PCA. The cost is one regularized 6-by-6 solve per query. Ablate by returning the final robust-PCA normal before the polynomial fit, exactly recovering the current frontier.	https://doi.org/10.1016/j.cagd.2004.09.008
51	9aaa9029b66d762b2d09bc4507d160325e99d24c	17.852589		1.284	80.5	discard			baseline	Tighten the final Cauchy refinement cutoff from 1.5 to 1.25 weighted-MAD sigmas	The retained Gaussian-weighted residual median and MAD make the final robust scale more query-local, but residuals from curvature, asymmetric density, or sparse outliers can still retain moderate leverage at the 1.5-sigma cutoff. Tightening only the second Cauchy refinement to 1.25 sigma tests the midpoint between the retained 1.5 setting and the previously overstrict 1.0 anchor, after the first 2.5-sigma pass has stabilized the plane. Clean, low-noise, stripe, and gradient conditions should improve through lower neighborhood bias; medium and high noise may regress because valid noisy samples receive less effective covariance support. The change is one global scalar with no added computation. Ablate by restoring the final cutoff to 1.5 while leaving the first cutoff and weighted location-scale estimates unchanged.	original
52	3aaab24aa05ffd13055abe844968fd3eb7c80917	17.971906		1.276	82.2	discard			baseline	Relax only the first Cauchy refinement cutoff from 2.5 to 3.0 weighted-MAD sigmas	The 224-neighbor provisional plane and Gaussian-weighted residual location-scale estimate make the first residual classification comparatively stable, but its 2.5-sigma Cauchy cutoff can still suppress widespread positional-noise samples before the final fit. Raising only the first cutoff to 3.0 retains more effective covariance support in that intermediate refinement, while the unchanged 1.5-sigma second pass still limits curvature-, density-, and outlier-induced leverage after the plane has been corrected. Medium and high noise should improve; clean, low-noise, stripe, and gradient conditions may regress if moderate geometric residuals tilt the intermediate plane. This changes one global scalar with no added computation. Ablate by restoring the first cutoff to 2.5 while retaining the final cutoff and all weighted location-scale computations.	original
53	1ee61deeea47e7c0017d024e6681b53985363c40	17.834106		1.389	86.3	provisional			baseline	Extend only the final robust PCA refinement from 112 to 128 neighbors	The final 112-neighbor covariance remains sample-limited under medium and high positional noise, while extending broad support throughout both robust passes previously introduced excessive curvature bias. After the first Cauchy refinement has corrected the provisional plane, admit neighbors 113 through 128 only in the final fit, retaining the 112th-neighbor Gaussian bandwidth so they form a decaying tail rather than broadening the kernel. Medium and high noise should improve through additional covariance averaging; clean, low-noise, stripe, and gradient conditions may regress if residual curvature or density bias survives Cauchy downweighting. The cost is 16 extra samples in only the final weighted-median and covariance calculations, with no additional eigendecomposition. Ablate by setting the final refinement support back to 112, exactly recovering the frontier estimator.	original
54	bbd944b5653479d90defb11a61d75dbbb8e68be6	17.763026		1.534	88.7	provisional			baseline	Extend only the final robust PCA refinement from 128 to 160 neighbors	The provisional 224-neighbor fit stabilizes the normal under positional noise, but the final 128-neighbor covariance can remain sample-limited. The retained move from 112 to 128 neighbors improved medium and high noise with only modest clean-geometry losses, so 160 is the next scale anchor: after the first robust correction, neighbors 129 through 160 enter only the final covariance, while the fixed 112th-neighbor Gaussian bandwidth makes them a rapidly decaying tail and Cauchy weights limit residual outliers. Medium and high noise should improve through additional averaging; clean, low-noise, stripe, and gradient conditions may regress through curvature or density bias. The cost is 32 extra samples in the final weighted-median and covariance calculations, with no extra eigendecomposition. Ablate by restoring final support to 128, exactly recovering the current frontier.	original
55	35c9e2ebab9451c8cba919fd87ac334dc08f6306	17.763026		1.48	88.8	discard			baseline	Extend only the final robust PCA refinement from 160 to 224 neighbors	The retained progression from 112 to 128 to 160 final-fit neighbors consistently improved medium- and high-noise conditions, indicating that the final covariance remains sample-limited despite the stabilized provisional normal. This parameter probe reaches the existing 224-neighbor scale anchor only after the first robust correction; neighbors 161 through 224 enter the final fit with the bandwidth still fixed by the 112th-neighbor radius, so their Gaussian weights form a rapidly decaying tail and Cauchy weights further limit large point-to-plane residuals. Medium and high noise should improve through additional covariance averaging, while clean, low-noise, stripe, and gradient conditions may regress through residual curvature or density bias. The cost is 64 extra samples in only the final weighted-median and covariance calculations, with no additional eigendecomposition. Ablate by restoring final support to 160, exactly recovering the current frontier estimator.	original
56	9691cb022270472e6512be18e41528edf321c74e	17.786708		1.521	103.9	discard			baseline	Widen only the 160-neighbor final-refinement Gaussian bandwidth from the 112th- to the 128th-neighbor radius	Extending the final robust fit from 128 to 160 neighbors improved medium and high noise, but the retained 112th-neighbor bandwidth gives the added tail very small Gaussian weights; extending support to 224 then made no measurable difference, indicating that bandwidth rather than available support now limits noise averaging. In only the final 160-neighbor fit, normalize distances by the 128th-neighbor radius, while the provisional fit and first 112-neighbor refinement remain unchanged. This gives neighbors 113 through 160 meaningful covariance weight after the plane has been robustly corrected. Medium and high noise should improve through greater effective sample support; clean, low-noise, stripe, and gradient conditions may regress because curved or density-biased outer samples gain leverage. The cost is one alternate bandwidth lookup and recomputing the existing final Gaussian weights, with no extra samples or eigendecomposition. Ablate by restoring the final bandwidth to the 112th-neighbor radius, exactly recovering the current frontier estimator.	original
57	c0ec4c0363e69d87dc92743b9995badfa228cfa4	17.775111		1.506	91.0	discard			baseline	Widen only the final-refinement Gaussian bandwidth from the 112th- to the 120th-neighbor radius	The retained 160-neighbor final covariance improves medium and high noise, but its Gaussian kernel is still normalized by the 112th-neighbor radius, leaving limited effective support. Widening all the way to the measured 128th-neighbor radius improved those noisy conditions but gave curved and density-biased outer samples enough leverage to worsen clean, low-noise, stripe, and gradient accuracy. The untested 120th-neighbor radius is a midpoint parameter probe: it moderately increases final-pass noise averaging after the first robust correction while Cauchy weights continue to bound normal-residual outliers. Medium and high noise should improve; clean, low-noise, stripe, and gradient may regress through increased neighborhood bias, but less than with the 128th-neighbor bandwidth. The cost is one alternate bandwidth lookup and recomputation of existing final distance weights, with no new samples or eigendecomposition. Ablate by restoring the final bandwidth to the 112th-neighbor radius while leaving 160-point support and all robust settings unchanged.	original
58						crash	quality.ruff-fix	Ruff exited with status 1	baseline	Narrow only the 160-neighbor final-refinement Gaussian bandwidth from the 112th- to the 104th-neighbor radius	The retained 160-neighbor final covariance improves medium and high noise through a decaying sample tail, but its 112th-neighbor bandwidth also gives curved or density-biased outer samples enough leverage to worsen clean, low-noise, stripe, and gradient accuracy. The earlier 96th-neighbor refinement bandwidth improved those four geometry-sensitive conditions but lost noise accuracy, so the untested 104th-neighbor radius is the midpoint scale probe between 96 and 112: it makes the final covariance more query-local while preserving all 160 samples and the Cauchy rejection of normal-residual outliers. Clean, low-noise, stripe, and gradient conditions should improve; medium and high noise may regress because the effective averaging support shrinks. The cost is one recomputed final-pass Gaussian weight vector with no new samples or eigendecomposition. Ablate by restoring the final bandwidth to the 112th-neighbor radius while leaving support and robust settings unchanged.	original
59	9b800e7a9d822dfa7ae6bbbb1d6c76997e43a029	17.749612		1.504	100.8	discard			baseline	Narrow only the 160-neighbor final-refinement Gaussian bandwidth from the 112th- to the 104th-neighbor radius	The retained 160-neighbor final covariance improves medium and high noise through a decaying sample tail, but its 112th-neighbor bandwidth gives curved or density-biased outer samples enough leverage to worsen clean, low-noise, stripe, and gradient accuracy. The earlier 96th-neighbor refinement bandwidth improved those four geometry-sensitive conditions but lost noise accuracy, so the 104th-neighbor radius is the unmeasured midpoint between 96 and 112; iteration 58 failed at linting and therefore did not test the hypothesis. Recomputing only the final Gaussian weights with this radius makes the final covariance more query-local while retaining all 160 samples and Cauchy rejection. Clean, low, stripe, and gradient should improve; medium and high may regress as effective averaging support shrinks. The cost is one recomputed final weight vector and no new samples or eigendecomposition. Ablate by restoring the final bandwidth to the 112th-neighbor radius with all support and robust settings unchanged.	original
