iteration	candidate_commit	dev_rmse	val_rmse	runtime_s	memory_mb	status	failure_stage	failure_message	complexity	description	rationale	source
131	38b6243184c1600ad9a3cd2d13b180f216a1d86b	17.491657		1.046	106.3	discard			low	Estimate first-pass Tukey residual location from 32 neighbors and scale from 48 neighbors	The retained 32-neighbor first-pass core makes the residual center query-local and strongly improves medium/high-noise and gradient accuracy, but estimating MAD from the same small core can make the rejection scale unstable, consistent with its small clean and stripe regressions. Keep the Gaussian-weighted residual median on the nearest 32 samples, estimate sigma = 1.4826 weighted_median(|e - m_32|) from the nearest 48, and apply the resulting Tukey weights to all 112 covariance samples. Clean, low-noise, and stripe conditions should improve through a more stable scale; gradient should remain near the frontier, while medium and high noise may regress if the broader scale includes curvature and preserves biased tail samples. The cost is a 48-value scale sort instead of 32 values, with unchanged covariance support and eigendecomposition count. Ablate by setting FIRST_SCALE_COUNT to 32, exactly recovering the current frontier estimator.	original
132	c8df5bf1f5414d1a173c9a8f5f5d8eb8f84cee4a	17.498365		1.075	110.2	discard			baseline	Increase the first-pass Tukey residual-statistic core from 32 to 48 neighbors	The 32-neighbor first-pass core strongly improves medium/high-noise and gradient accuracy by keeping curvature- and density-biased outer residuals from defining their own Tukey leverage, but its small weighted median and MAD also cause measured clean and stripe regressions. The measured scale-only 48-neighbor probe recovered clean, low-noise, and stripe accuracy, indicating that additional samples stabilize first-pass robust statistics; this parameter probe increases both location and scale cores together to 48, preserving their single-radius interpretation. Clean, low-noise, and stripe conditions should improve through more stable residual statistics, while medium/high noise and gradient may regress because the broader core admits more neighborhood bias. The cost is sorting 48 rather than 32 values with unchanged covariance support and eigendecomposition count. Ablate by restoring FIRST_STATISTIC_COUNT to 32, exactly recovering the current frontier estimator. The quadratic-jet batch item remains deferred because its prior prediction crash has no precise diagnostic to address.	original
133	db807e7a02e4c70150601f48a2200b150918ce4e	17.466807		1.081	106.3	discard			baseline	Use a 40-neighbor first-pass Tukey residual-statistic core	The provisional 32-neighbor first-pass statistic core strongly improves medium/high-noise and gradient accuracy by preventing curved or density-biased outer residuals from defining their own Tukey leverage, but its small weighted median and MAD slightly regress clean and stripe stability. Increasing the joint location-and-scale core to 48 recovered clean and stripe but admitted enough neighborhood bias to substantially worsen low, medium, high, and gradient conditions. Forty neighbors is the untested midpoint: it should stabilize the robust residual reference enough to improve clean and stripe while preserving more of the 32-core noise and gradient gains than 48. The cost is sorting eight additional residuals per query with unchanged 112-neighbor covariance support and eigendecomposition count. Ablate by restoring FIRST_STATISTIC_COUNT to 32, exactly recovering the current frontier estimator. The quadratic-jet batch item remains deferred because its prior prediction failure has no precise diagnostic to address.	original
134	3e7436986f462f6f2aadae7cd5a0ceba983ba7a2	17.450218		1.045	106.4	discard			baseline	Use a 36-neighbor first-pass Tukey residual-statistic core	The retained 32-neighbor first-pass core keeps curvature- and density-biased outer residuals from defining their own Tukey leverage, but its small weighted median and MAD slightly regress clean and stripe stability. The measured 40-neighbor core recovered clean, low-noise, and stripe accuracy but admitted enough neighborhood bias to worsen medium/high noise and gradient, so 36 is the untested midpoint between those anchors. Computing first-pass residual location and scale from 36 neighbors should improve clean and stripe through more stable robust statistics while preserving more of the 32-core medium/high-noise and gradient gains than 40; low noise may be near neutral. The cost is sorting four additional residuals per query, with unchanged 112-neighbor covariance support and eigendecomposition count. Ablate by restoring FIRST_STATISTIC_COUNT to 32, exactly recovering the frontier estimator. The ordered quadratic-jet item is skipped because its prior prediction failure has no precise diagnostic to address.	original
135	c262b12d3400ce0cca59c2fa6ac17fd6bc2ebaf7	17.436335		1.03	110.5	discard			baseline	Use a 34-neighbor first-pass Tukey residual-statistic core	The retained 32-neighbor first-pass core keeps curvature- and density-biased outer residuals from defining their own Tukey leverage, but its small weighted median and MAD slightly regress clean and stripe stability. The measured 36-neighbor core improved clean and stripe but worsened low, medium, high, and gradient conditions, so 34 is the untested midpoint between those anchors. Computing first-pass residual location and scale from 34 neighbors should recover part of the clean and stripe stability through two additional samples while losing less noise robustness and gradient locality than 36. The cost is sorting two additional residuals per query, with unchanged 112-neighbor covariance support and eigendecomposition count. Ablate by restoring FIRST_STATISTIC_COUNT to 32, exactly recovering the frontier estimator. The ordered quadratic-jet item remains skipped because its prior prediction failure has no precise diagnostic to address.	original
136	fb3d0f84dd95922c06e174562b9798534064da53	17.446882		1.026	97.6	discard			baseline	Use a 35-neighbor first-pass Tukey residual-statistic core	The retained 32-neighbor first-pass core prevents curvature- and density-biased outer residuals from defining their own Tukey leverage, but its small weighted median and MAD slightly reduce clean and stripe stability. The 36-neighbor probe improved clean and stripe while regressing low, medium, high, and gradient conditions, whereas 34 neighbors produced no numerical change; 35 is the smallest untested upward scale anchor that can determine where the statistic changes. Computing first-pass residual location and scale from 35 neighbors may recover part of the clean and stripe stability with less loss of noise robustness and gradient locality than 36. The cost is sorting three additional residuals per query, with unchanged 112-neighbor covariance support and eigendecomposition count. Ablate by restoring FIRST_STATISTIC_COUNT to 32, exactly recovering the frontier estimator. The ordered quadratic-jet item remains skipped because its prior prediction failure has no precise diagnostic to address.	original
137	14249637995622bb63dc1ad3adbb9dd15a230381	17.380046	14.720481	1.043	89.5	discard			baseline	Extend only the first Tukey-PCA refinement from 112 to 128 neighbors	The 32-neighbor first-pass residual-statistic core makes Tukey rejection query-local, but the resulting 112-neighbor covariance can remain sample-limited under medium and high positional noise. Admit neighbors 113 through 128 only to that first robust covariance while retaining the 112th-neighbor Gaussian bandwidth and 32-neighbor location-scale core; the added samples therefore form a decaying tail whose large normal residuals are still rejected. Medium and high noise should improve through additional covariance averaging, while clean, low-noise, stripe, and gradient conditions may regress if coherent curvature or density bias survives rejection. The cost is 16 extra samples in the first weighted covariance, with no additional fit. Ablate by setting FIRST_REFINEMENT_COUNT back to 112, exactly recovering the frontier estimator. The ordered quadratic-jet item remains deferred because its prior prediction crash has no precise diagnostic to address.	original
138	82e87aa999a4b3f80ffc134f1385f414f348f588	17.484047		1.1	101.3	provisional			baseline	Extend only the first Tukey-PCA refinement from 112 to 120 neighbors	The first 112-neighbor robust covariance can remain sample-limited under positional noise, but the measured 128-neighbor extension improved medium and high noise at too much cost to clean, low-noise, stripe, and gradient geometry. This midpoint parameter probe admits only neighbors 113 through 120 to the first covariance while retaining the 112th-neighbor Gaussian bandwidth and 64-neighbor robust location-scale core, so they form a low-leverage decaying tail and Tukey rejection still removes large normal residuals. Medium and high noise should improve through additional covariance averaging; clean, low-noise, stripe, and gradient may regress through coherent curvature or density bias, but less than with 128 neighbors. The cost is eight extra samples in one covariance and no additional fit. Ablate by restoring FIRST_REFINEMENT_COUNT to 112, exactly recovering the frontier estimator.	original
139	7392daac9e2c05147c5178fdb12dfc9c8b07dfe2	17.463383		1.177	98.3	discard			baseline	Extend only the first Tukey-PCA refinement from 120 to 124 neighbors	The first robust covariance remains sample-limited under positional noise, but extending its support increases curvature and density bias. The measured 120-neighbor refinement improved low-, medium-, and high-noise conditions over 112 with smaller clean, stripe, and gradient losses than the measured 128-neighbor endpoint, so 124 is the next untested midpoint. Admit neighbors 121 through 124 only to the first covariance while retaining the 112th-neighbor Gaussian bandwidth and 64-neighbor residual-statistic core; these samples form a low-weight tail, and Tukey rejection removes large normal residuals. Medium and high noise should improve through additional averaging; clean, stripe, and gradient may regress through coherent neighborhood bias, with low noise likely near the trade-off boundary. The cost is four samples in one covariance and no additional fit. Ablate by restoring FIRST_REFINEMENT_COUNT to 120 with every other setting unchanged.	original
140	c4f9984d83dea13c30ff3702f11b80da183bfb64	17.471592		1.131	98.2	discard			baseline	Extend only the first Tukey-PCA refinement from 120 to 122 neighbors	The first robust covariance remains sample-limited under positional noise, but its outer tail can introduce curvature and density bias. The measured 120-neighbor frontier improves low-, medium-, and high-noise conditions over 112, whereas extending to 124 adds medium/high averaging at the cost of clean, low-noise, stripe, and gradient accuracy; 122 is the untested midpoint that isolates this support trade-off. Admit only neighbors 121 and 122 to the first covariance while retaining the 112th-neighbor Gaussian bandwidth and 64-neighbor residual-statistic core, so they have low distance weight and Tukey rejection still removes large normal residuals. Medium and high noise should improve modestly through additional averaging; clean, low-noise, stripe, and gradient may regress through coherent curvature or density bias, but less than at 124. The cost is two extra samples in one covariance and no additional fit. Ablate by restoring FIRST_REFINEMENT_COUNT to 120 with every other setting unchanged.	original
141	c96cf05039127edcaf35fde21932419f9c6769e0	17.479004		1.106	98.1	discard			baseline	Extend only the first Tukey-PCA refinement from 120 to 121 neighbors	The first robust covariance remains sample-limited under positional noise, but coherent curvature and density bias in its outer tail can tilt the corrected tangent. The retained 120-neighbor frontier improves low-, medium-, and high-noise accuracy over 112 neighbors, while the measured 122-neighbor endpoint adds medium/high averaging but regresses clean, low-noise, and stripe accuracy; 121 is the next untested minimal support increment. Admit only neighbor 121 to the first covariance while retaining the 112th-neighbor Gaussian bandwidth and 64-neighbor Tukey location-scale core, so it has low distance weight and is removed when its normal residual is extreme. Medium and high noise may improve modestly through one additional covariance sample; clean, low-noise, stripe, and possibly gradient may regress through coherent neighborhood bias, but less than at 122. The cost is one sample in one covariance and no additional fit. Ablate by restoring FIRST_REFINEMENT_COUNT to 120 with every other setting unchanged.	original
142	6671201b0a472ad05a0049956d2a8090b09d76ec	17.483155		1.115	98.1	discard			baseline	Narrow only the 120-neighbor first-refinement Gaussian bandwidth from the 112th- to the 108th-neighbor radius	The retained 120-neighbor first robust covariance improves low-, medium-, and high-noise accuracy through extra averaging, but its 112th-neighbor Gaussian bandwidth gives the outer tail enough coherent curvature or density leverage to regress clean, stripe, and gradient patches. Recompute only that pass's spatial weights as exp(-2 d^2 / r_108^2), retaining all 120 samples and the same Tukey rejection so the tail remains available but decays faster. Clean, stripe, and gradient conditions should improve through lower neighborhood bias; low, medium, and high noise may regress because effective covariance support shrinks. The cost is one refinement weight-vector computation with unchanged samples and eigendecompositions. Ablate by restoring FIRST_BANDWIDTH_COUNT to 112, exactly recovering the current frontier estimator.	original
143	f38329d577bd7e79da18b650112f5e94b70c116a	17.483927		1.126	98.0	discard			baseline	Narrow only the 120-neighbor first-refinement Gaussian bandwidth from the 112th- to the 110th-neighbor radius	The retained 120-neighbor first robust covariance improves low-, medium-, and high-noise accuracy through extra averaging, but its 112th-neighbor Gaussian bandwidth gives the outer tail coherent curvature and density leverage that regresses clean, stripe, and gradient patches. Narrowing to the measured 108th-neighbor radius recovered all four geometry-sensitive conditions but lost medium/high-noise accuracy, so the untested 110th-neighbor radius is the midpoint parameter probe. Recompute only the first-refinement weights as exp(-2 d^2 / r_110^2), retaining all 120 samples and unchanged Tukey rejection. Clean, low-noise, stripe, and gradient should improve through lower neighborhood bias; medium and high noise may regress slightly as effective covariance support shrinks, but less than at radius 108. The cost is one weight-vector recomputation with unchanged support and eigendecomposition count. Ablate by restoring FIRST_BANDWIDTH_COUNT to 112, exactly recovering the current frontier estimator.	original
144	ada634c833106786fb818af1842bd857fdfb63cd	17.48524		1.137	98.1	discard			baseline	Widen only the 120-neighbor first-refinement Gaussian bandwidth from the 112th- to the 116th-neighbor radius	The retained 120-neighbor first robust covariance improves low-, medium-, and high-noise accuracy through additional averaging, but its Gaussian bandwidth remains fixed at neighbor 112, limiting the effective weight of the added tail. Narrowing the radius to 108 and 110 improved clean, low-noise, stripe, and gradient conditions but consistently regressed medium and high noise, giving a concrete reason to test the unmeasured opposite direction. Recompute only the first-refinement weights as exp(-2 d^2 / r_116^2), retaining all 120 samples and unchanged Tukey rejection. Medium and high noise should improve through greater effective covariance support; clean, low-noise, stripe, and gradient may regress because coherent curvature or density-biased tail samples gain leverage. The cost is one weight-vector recomputation with unchanged support and eigendecomposition count. Ablate by restoring FIRST_BANDWIDTH_COUNT to 112, exactly recovering the current frontier estimator.	original
145	3c6574268a83ab248ed84830e15b92280ca810d3	17.484838		1.126	114.2	discard			baseline	Widen only the 120-neighbor first-refinement Gaussian bandwidth from the 112th- to the 114th-neighbor radius	The retained 120-neighbor first robust covariance improves low-, medium-, and high-noise accuracy through additional averaging, but its kernel is still normalized by neighbor 112, limiting the effective contribution of the added tail. The measured 116th-neighbor bandwidth improved medium and high noise but introduced excessive clean, low-noise, stripe, and gradient bias, while 108 and 110 showed the opposite trade-off; 114 is the untested midpoint between the retained 112 radius and the measured 116 radius. Recompute only the first-refinement weights as exp(-2 d^2 / r_114^2), retaining all 120 samples and unchanged Tukey rejection. Medium and high noise should improve through greater effective covariance support; clean, low-noise, stripe, and gradient may regress through coherent curvature or density bias, but less than at radius 116. The cost is one weight-vector recomputation with unchanged support and eigendecomposition count. Ablate by restoring FIRST_BANDWIDTH_COUNT to 112, exactly recovering the current frontier estimator.	original
146	6ffef388d62cc0fdc0586a58f3f944f9f477c426	17.484047		1.161	98.1	discard			baseline	Reduce only the first Tukey-PCA refinement from 120 to 116 neighbors	The provisional 120-neighbor first robust covariance improves low-, medium-, and high-noise accuracy through extra averaging, but measurably regresses clean, stripe, and gradient patches because coherent curvature or density-biased tail samples can survive Tukey rejection. The recent bandwidth probes could only trade those effects by changing every retained sample's weight, so this untested support midpoint instead removes the four least-local samples while preserving the 112th-neighbor Gaussian bandwidth, 64-neighbor robust-statistic core, and all later computations. Clean, stripe, and gradient conditions should improve through lower neighborhood bias; low, medium, and high noise may regress from reduced covariance averaging, but less than when returning fully to 112 neighbors. The change slightly reduces first-pass covariance work and adds no mechanism. Ablate by restoring FIRST_REFINEMENT_COUNT to 120 with every other setting unchanged. The ordered quadratic-jet item remains deferred because its prior prediction crash has no precise diagnostic to address.	original
147	0b17b2843ec55999ec90745c59b2aa4181944961	17.517281		1.122	97.6	discard			baseline	Reduce only the first Tukey-PCA refinement from 120 to 114 neighbors	The retained 120-neighbor first robust covariance adds a Gaussian-decaying tail for positional-noise averaging, but coherent curvature or density-biased outer samples can survive Tukey rejection and tilt the corrected tangent. Removing neighbors 117 through 120 produced exactly unchanged development scores, showing that this outermost tail contributes no useful effective weight; 114 is the next untested midpoint toward the 112-neighbor validated support and tests whether neighbors 115 and 116 are similarly redundant. Removing the six least-local samples should leave all conditions unchanged if Tukey already suppresses them, or improve clean, stripe, and gradient through lower neighborhood bias; low, medium, and high noise may regress if the two newly removed samples provide genuine covariance averaging. The change slightly reduces first-pass covariance work and adds no mechanism. Ablate by restoring FIRST_REFINEMENT_COUNT to 120 with every other setting unchanged.	original
148	0630bb1ece25bec7e2b0e510d67a1b93e2428f59	17.512371		1.143	111.6	discard			baseline	Reduce only the first Tukey-PCA refinement from 120 to 115 neighbors	The retained 120-neighbor first robust covariance averages positional noise with a Gaussian-decaying tail, but coherent curvature or density-biased outer samples can survive Tukey rejection and tilt the corrected tangent. Reducing support to 116 produced exactly unchanged scores, proving neighbors 117 through 120 are redundant, whereas reducing to 114 improved clean, low-noise, stripe, and gradient conditions but regressed medium and high noise after also removing neighbors 115 and 116. The untested 115-neighbor boundary independently isolates neighbor 116: removing it should recover part of the measured geometry-sensitive gains with a smaller medium/high-noise loss than at 114, or leave scores unchanged if it too has zero effective leverage. The change removes five samples from one covariance, adds no mechanism or asymptotic cost, and is ablated by restoring FIRST_REFINEMENT_COUNT to 120. The ordered quadratic-jet item remains deferred because its prior prediction crash has no precise diagnostic to address.	original
