iteration	candidate_commit	dev_rmse	val_rmse	runtime_s	memory_mb	status	failure_stage	failure_message	complexity	description	rationale	source
320	9909a5caa2cb67b184ea31bfe7ad9e942b197868	17.268698		1.428	106.7	discard			low	Damp the transverse component of thin-sheet third-normal extrapolation from 80% to 75%	The retained 80% extrapolation continues an underrelaxed Tukey-PCA correction on thin coherent sheets, but the component of the latest update that turns away from the preceding update is more likely to contain sampling variance than its persistent component. Sign-align the first three robust normals, decompose d3 = n3 - n2 into its projection along d2 = n2 - n1 and a transverse remainder, then extrapolate the persistent component by 0.8 and the transverse component by 0.75. Measured transverse coefficients 0.4, 0.6, and 0.7 improved medium-noise, stripe, and gradient accuracy but regressed clean, low-noise, and high-noise accuracy; 0.75 is the next untested midpoint toward the retained 0.8 endpoint and should preserve smaller medium, stripe, and gradient gains while further reducing those regressions. The cost is retaining one normal and one vector projection per query, with no new fit. Ablate by setting THIRD_TRANSVERSE_EXTRAPOLATION to 0.8, for which the components recombine to exactly recover the validated fixed-80% extrapolation.	original
321	a599494514dea6a870943f9f44a0e86d9274f3bc	17.26869		1.341	105.9	discard			low	Damp the transverse component of thin-sheet third-normal extrapolation from 80% to 77.5%	The retained 80% extrapolation continues an underrelaxed Tukey-PCA correction on thin coherent sheets, but the component of the latest update that turns away from the preceding robust update is more likely to contain sampling variance than the persistent component. Sign-align the first three robust normals, decompose d3 = n3 - n2 into its projection along d2 = n2 - n1 and a transverse remainder, then extrapolate the persistent component by 0.8 and the transverse component by 0.775. Measured transverse coefficients 0.4, 0.6, 0.7, and 0.75 consistently improved medium-noise, stripe, and gradient accuracy while regressing clean, low-noise, and high-noise accuracy; 0.775 is the next untested midpoint toward the retained 0.8 endpoint and should preserve very small medium, stripe, and gradient gains while roughly halving those regressions relative to 0.75. The cost is retaining one normal and one vector projection per query, with no new neighborhood fit. Ablate by setting THIRD_TRANSVERSE_EXTRAPOLATION to 0.8, for which the two components recombine to exactly recover the validated fixed-80% extrapolation.	original
322						crash	quality.ruff-fix	Ruff exited with status 1	low	Damp the transverse component of thin-sheet third-normal extrapolation from 80% to 78.75%	The retained 80% extrapolation continues an underrelaxed Tukey-PCA correction on thin coherent sheets, but the component of the latest update that turns away from the preceding robust update is more likely to contain sampling variance than the persistent component. Sign-align the first three robust normals, decompose d3 = n3 - n2 into its projection along d2 = n2 - n1 and a transverse remainder, then extrapolate the persistent component by 0.8 and the transverse component by 0.7875. Measured transverse coefficients from 0.4 through 0.775 consistently improved medium-noise, stripe, and gradient accuracy while regressing clean, low-noise, and high-noise accuracy; 0.7875 is the next untested midpoint toward the retained 0.8 endpoint and should preserve minute medium, stripe, and gradient gains while roughly halving the 0.775 regressions. The cost is retaining one normal and one vector projection per query, with no new neighborhood fit. Ablate by setting THIRD_TRANSVERSE_EXTRAPOLATION to 0.8, for which the persistent and transverse components recombine to exactly recover the validated fixed-80% extrapolation.	original
