iteration	candidate_commit	dev_rmse	val_rmse	runtime_s	memory_mb	status	failure_stage	failure_message	complexity	description	rationale	source
237	3e351a2c353ed7fda16243c7f3877d4dbe23b342	17.360576		1.381	105.1	discard			baseline	Estimate the gated third Tukey refinement's residual location and scale from 64 rather than 32 neighbors	The optional third refinement currently estimates its weighted residual median, MAD thickness, Tukey rejection, and acceptance confidence from only 32 samples. That highly local core reduces curvature and density bias, but its statistics can be noisy enough to misclassify a patch as a thin coherent sheet and then form an under-supported redescending covariance. Using 64 neighbors only for the third-pass residual reference should stabilize the median, scale, and gate, improving medium- and high-noise conditions; clean, low-noise, stripe, and gradient conditions may regress if the broader statistic absorbs curvature or asymmetric-density variation and preserves biased samples. Covariance support, Gaussian bandwidth, cutoffs, and all eigendecompositions remain unchanged; the cost is sorting 64 instead of 32 values in the third pass. Ablate by restoring THIRD_STATISTIC_COUNT to 32, exactly recovering the validated frontier estimator. This parameter probe is chosen because the ordered quadratic-jet retry remains blocked by its prediction crash without a precise diagnostic.	original
238	a4c1d22ec24422fae4c5345f41fe2a3108146865	17.344392		1.4	97.6	discard			baseline	Estimate the gated third Tukey refinement's residual statistics from 48 rather than 32 neighbors	The optional third refinement estimates its weighted residual median, MAD thickness, Tukey rejection, and thin-sheet confidence from only 32 samples, so noise in those statistics can admit an under-supported redescending covariance. The measured 64-neighbor statistic core improved medium and high noise but broadened the reference enough to worsen clean, low-noise, stripe, and gradient geometry; 48 neighbors is the untested midpoint intended to recover part of that statistical stability with less curvature and asymmetric-density bias. Medium and high noise should improve, while clean, low-noise, stripe, and gradient may regress modestly. Covariance support, Gaussian bandwidth, cutoffs, and eigendecomposition count are unchanged; the cost is sorting 48 rather than 32 residuals only in the third pass. Ablate by restoring THIRD_STATISTIC_COUNT to 32, exactly recovering the validated frontier estimator; comparison with 64 independently isolates the midpoint.	original
239	2d140aec0b56d866fd2845f9a2407ef82289f12d	17.340841		1.348	97.4	discard			baseline	Estimate gated third-pass Tukey residual statistics from 40 rather than 32 neighbors	The optional third refinement estimates its weighted residual median, MAD thickness, redescending weights, and thin-sheet confidence from only 32 samples, so noise in that small core can admit an under-supported covariance; however, the measured 48- and 64-neighbor cores improved low/medium/high noise while broadening the reference enough to harm clean, stripe, and gradient geometry. Forty neighbors is the next untested midpoint between the retained 32 core and measured 48 core. It should recover some noisy-condition stability with less curvature and asymmetric-density bias than 48, while clean, stripe, and gradient may still regress modestly. Covariance support, Gaussian bandwidth, Tukey cutoffs, and eigendecomposition count are unchanged; the cost is sorting 40 rather than 32 residuals only in the third pass. Ablate by restoring THIRD_STATISTIC_COUNT to 32, exactly recovering the validated frontier; comparison with 48 independently isolates this parameter choice.	original
240	38cef64e205e0c0f83b36143b40cfdfb782fd0c3	17.333056		1.338	97.3	discard			baseline	Estimate gated third-pass Tukey residual statistics from 36 rather than 32 neighbors	The optional third refinement estimates its weighted residual median, MAD thickness, redescending weights, and thin-sheet confidence from only 32 samples, so noise in that small core can admit an under-supported covariance. Measured 40-, 48-, and 64-neighbor cores improved medium and high noise but increasingly broadened the reference enough to harm clean, stripe, and gradient geometry; 36 neighbors is the next untested midpoint between the retained 32 core and measured 40 core. It should recover a smaller amount of medium/high-noise stability with less curvature and asymmetric-density bias than 40, while clean, low-noise, stripe, and gradient may still regress slightly. Covariance support, Gaussian bandwidth, Tukey cutoffs, and eigendecomposition count are unchanged; the cost is sorting 36 rather than 32 residuals only in the third pass. Ablate by restoring THIRD_STATISTIC_COUNT to 32, exactly recovering the validated frontier; comparison with 40 independently isolates this parameter choice.	original
241	d6d111b274f06bef80d150b996525f34d624ddb2	17.335595		1.305	97.3	discard			baseline	Estimate gated third-pass Tukey residual statistics from 34 rather than 32 neighbors	The optional third refinement estimates its weighted residual median, MAD thickness, redescending weights, and thin-sheet confidence from only 32 samples, so noise in that small core can admit an under-supported covariance. Measured 36-, 40-, 48-, and 64-neighbor cores improved medium and high noise but increasingly broadened the reference enough to harm clean, stripe, and gradient geometry; 34 neighbors is the next untested midpoint between the retained 32 core and measured 36 core. It should recover a smaller amount of low/medium/high-noise stability with less curvature and asymmetric-density bias than 36, while clean, stripe, and gradient may still regress slightly. Covariance support, Gaussian bandwidth, Tukey cutoffs, and eigendecomposition count are unchanged; the cost is sorting 34 rather than 32 residuals only in the third pass. Ablate by restoring THIRD_STATISTIC_COUNT to 32, exactly recovering the validated frontier; comparison with 36 independently isolates this parameter choice. The ordered quadratic-jet retry remains skipped because its prior prediction failure has no precise diagnostic to address.	original
242	09a35c0a3f27db38fc5d52deedd12de525ae1213	17.33031		1.329	105.4	discard			baseline	Estimate gated third-pass Tukey residual statistics from 33 rather than 32 neighbors	The optional third refinement estimates its weighted residual median, MAD thickness, redescending weights, and thin-sheet confidence from only 32 samples, so noise in that small core can admit an under-supported covariance. Measured cores of 34, 36, 40, 48, and 64 neighbors improved medium and high noise but increasingly broadened the reference enough to harm clean, stripe, and gradient geometry; 33 neighbors is the final untested one-sample midpoint between the retained 32 core and measured 34 core. It should recover a minimal amount of medium/high-noise statistical stability with less curvature and asymmetric-density bias than 34, while clean, low-noise, stripe, and gradient may regress slightly. Covariance support, Gaussian bandwidth, Tukey cutoffs, and eigendecomposition count are unchanged; the cost is sorting one additional residual only in the third pass. Ablate by restoring THIRD_STATISTIC_COUNT to 32, exactly recovering the validated frontier; comparison with 34 independently isolates this parameter choice. The ordered quadratic-jet retry remains skipped because its prior prediction failure has no precise diagnostic to address.	original
243	8712f8dea70d2b4201257bef0dbf858f79d1f494	17.33423		1.331	97.6	discard			low	Estimate the gated third-pass Tukey residual median from 32 neighbors and MAD scale from 48 neighbors	The optional third refinement needs a query-local residual center to avoid curvature and asymmetric-density bias, but estimating its MAD from the same 32 samples can make the thickness gate and redescending cutoff noisy. Keep the Gaussian-weighted median on the nearest 32 residuals, estimate sigma = 1.4826 weighted_median(|e - m_32|) from the nearest 48, and apply the resulting Tukey weights to all 128 covariance samples. The completed 33-to-64 joint-statistic sweep consistently found small medium/high-noise gains from additional samples but geometry losses from broadening both statistics; separating the roles should retain the local center while stabilizing scale. Low, medium, and high noise should improve; clean, stripe, and gradient may regress if the broader MAD absorbs curvature and suppresses useful third-step corrections. The cost is a 48-value scale sort instead of 32 values, with unchanged covariance support and eigendecomposition count. Ablate by setting THIRD_SCALE_COUNT to 32, exactly recovering the validated frontier. The ordered quadratic-jet retry remains skipped because its prior prediction crash has no precise diagnostic to address.	original
244	b491d23f3dbf9dd16e2637c4d8c12f6fb65c6518	17.345937		1.35	97.6	discard			low	Estimate the gated third-pass Tukey residual median from 48 neighbors while retaining the 32-neighbor MAD scale	The optional third refinement currently estimates both residual location and scale from 32 samples. That local center limits curvature and asymmetric-density bias, but it may be noisy enough to miscenter Tukey rejection and the thin-sheet decision. The completed joint-statistic sweep found small medium/high-noise gains from broader cores, and the immediately preceding scale-only broadening improved low, medium, and high noise while regressing clean, stripe, and gradient; this complementary ablation tests whether stabilizing location supplies those gains independently. Compute the Gaussian-weighted residual median m from 48 neighbors, retain sigma = 1.4826 weighted_median(|e - m|) on the nearest 32, and apply the resulting weights to all 128 covariance samples. Low, medium, and high noise may improve through a stabler center; clean, stripe, and gradient may regress if the broader median follows curvature or density bias. The cost is a 48-value location sort instead of 32 values, with unchanged covariance support and eigendecomposition count. Ablate by setting THIRD_LOCATION_COUNT to 32, exactly recovering the validated frontier. The ordered quadratic-jet retry remains skipped because its prior prediction crash has no precise diagnostic to address.	original
245	bc578343640a2e7f142414471dcedbff79ba1576	17.32896		1.344	97.5	discard			baseline	Estimate the gated third-pass Tukey residual median from 32 neighbors and MAD scale from 40 neighbors	The optional third refinement needs a query-local residual center to limit curvature and asymmetric-density bias, while estimating MAD from the same 32 samples can make its thickness confidence and rejection cutoff noisy. The measured 48-neighbor scale-only probe improved low-, medium-, and high-noise conditions but regressed clean, stripe, and gradient geometry; 40 neighbors is the untested midpoint intended to retain part of that scale stability with less broad-patch bias. Keep the Gaussian-weighted median on 32 residuals, compute sigma = 1.4826 weighted_median(|e - m_32|) on 40 residuals, and apply the resulting Tukey weights to all 128 covariance samples. Low, medium, and high noise should improve; clean, stripe, and gradient may regress, but less than with the 48-neighbor scale. The cost is sorting 40 rather than 32 values only for the third-pass MAD. Ablate by setting THIRD_SCALE_COUNT to 32, exactly recovering the validated frontier estimator.	original
246	0b2042e859336037a1b06b14b416a62ec83f1e26	17.327019		1.311	113.4	discard			baseline	Estimate the gated third-pass Tukey residual median from 32 neighbors and MAD scale from 36 neighbors	The optional third refinement needs a query-local 32-neighbor residual center to limit curvature and asymmetric-density bias, but estimating MAD from the same small core can make its thin-sheet confidence and rejection cutoff noisy. The measured 40-neighbor scale-only probe improved clean, low-, medium-, and high-noise conditions but regressed stripe and gradient geometry; 36 neighbors is the untested midpoint between that probe and the retained 32-neighbor scale. Keep the Gaussian-weighted median on 32 residuals, compute sigma = 1.4826 weighted_median(|e - m_32|) on 36 residuals, and apply the resulting Tukey weights to all 128 covariance samples. Low, medium, and high noise should improve through a stabler scale; clean should remain near the frontier, while stripe and gradient may regress through broader-patch bias, but less than with 40 samples. The cost is sorting 36 rather than 32 values only for the third-pass MAD. Ablate by setting THIRD_SCALE_COUNT to 32, exactly recovering the validated frontier estimator.	original
247	cfc8faac39200b5fd01dd2620a2f9ea12f425788	17.329056		1.349	98.6	discard			baseline	Estimate the gated third-pass Tukey residual median from 32 neighbors and MAD scale from 34 neighbors	The optional third refinement needs a query-local 32-neighbor residual center to limit curvature and asymmetric-density bias, but estimating MAD from the same small core can make its thin-sheet confidence and rejection cutoff noisy. The measured 36- and 40-neighbor scale-only probes improved clean, low-, medium-, and high-noise conditions but slightly regressed stripe and gradient geometry; 34 neighbors is the next untested midpoint between the retained 32-neighbor scale and the measured 36-neighbor scale. Keep the Gaussian-weighted median on 32 residuals, compute sigma = 1.4826 weighted_median(|e - m_32|) on 34 residuals, and apply the resulting Tukey weights to all 128 covariance samples. Low, medium, and high noise should improve through a stabler scale; clean should remain near the frontier, while stripe and gradient may regress slightly through broader-patch bias, but less than with 36 samples. The cost is sorting 34 rather than 32 values only for the third-pass MAD. Ablate by setting THIRD_SCALE_COUNT to 32, exactly recovering the validated frontier estimator.	original
248	ce61e35c364673482d3e3bda541ce9cc64b3a637	17.329052		1.324	97.5	discard			baseline	Estimate the gated third-pass Tukey residual median from 32 neighbors and MAD scale from 33 neighbors	The optional third refinement needs a query-local 32-neighbor residual center to limit curvature and asymmetric-density bias, but estimating MAD from exactly the same small core can make its thin-sheet confidence and rejection cutoff noisy. The measured 34-, 36-, and 40-neighbor scale-only probes show that modest scale broadening can improve clean and medium/high-noise accuracy, although broader scales can regress stripe and gradient geometry; 33 neighbors is the next untested minimal increment and isolates whether one extra residual adds useful scale stability without materially broadening the robust reference. Keep the Gaussian-weighted median on 32 residuals, compute sigma = 1.4826 weighted_median(|e - m_32|) on 33 residuals, and apply the resulting Tukey weights to all 128 covariance samples. Medium and high noise should improve slightly; clean and low noise should remain near the frontier, while stripe and gradient may regress slightly if the extra sample carries neighborhood bias. The cost is sorting one additional value only for the third-pass MAD. Ablate by setting THIRD_SCALE_COUNT to 32, exactly recovering the validated frontier estimator.	original
249	ea27c9c838157b247db40e66060fa0bccdcdd0c6	17.329164		1.328	97.6	discard			baseline	Estimate the gated third-pass Tukey residual median from 32 neighbors and MAD scale from 31 neighbors	The completed third-pass scale sweep found that broadening MAD beyond the query-local 32-neighbor core can stabilize medium/high-noise estimates but repeatedly introduces stripe and gradient neighborhood bias; the ordered quadratic-jet item remains blocked because its prediction crash has no precise diagnostic to address. This untested opposite parameter direction keeps the residual center on 32 neighbors but estimates sigma = 1.4826 weighted_median(|e - m_32|) from the nearest 31, preventing the outermost core residual from inflating the Tukey cutoff and thin-sheet confidence under curvature or asymmetric density. Clean, stripe, and gradient conditions should improve through a slightly more local scale; low, medium, and high noise may regress because one fewer residual makes MAD less stable and can reduce effective support. The cost is sorting one fewer value only for the third-pass MAD, with unchanged covariance support and eigendecomposition count. Ablate by setting THIRD_SCALE_COUNT to 32, exactly recovering the validated frontier estimator.	original
250	784a6253f87ea91512174f0a441b18d0dacbfd79	17.331108		1.304	97.6	discard			baseline	Estimate the gated third-pass Tukey residual median from 32 neighbors and MAD scale from 30 neighbors	The completed upward scale sweep showed that broadening the third-pass MAD beyond its query-local 32-neighbor center can stabilize noisy estimates but repeatedly introduces stripe and gradient neighborhood bias; the first opposite probe at 31 neighbors modestly improved clean, medium-noise, and stripe accuracy while regressing low noise, high noise, and gradient. This next untested scale anchor keeps the residual location on 32 neighbors but estimates sigma = 1.4826 weighted_median(|e - m_32|) from the nearest 30, further limiting curvature- or asymmetric-density-inflated residuals from widening the Tukey cutoff and thin-sheet gate. Clean and stripe should improve if additional locality dominates, and medium noise may retain the 31-neighbor gain; low noise, high noise, and gradient may regress because two fewer residuals make MAD less stable and can reduce effective covariance support. The cost is sorting two fewer values only for the third-pass MAD, with unchanged covariance support and eigendecomposition count. Ablate by setting THIRD_SCALE_COUNT to 32, exactly recovering the validated frontier estimator. The ordered quadratic-jet retry remains skipped because its prior prediction failure has no precise diagnostic to address.	original
251	eb39a6d7d6ae0e8f9a939a07f5f99cf61b78784a	17.326848		1.337	113.8	discard			baseline	Estimate the gated third-pass Tukey residual median from 32 neighbors and MAD scale from 28 neighbors	The completed upward scale sweep showed that broadening the third-pass MAD beyond its query-local 32-neighbor center can stabilize noise but introduces stripe and gradient neighborhood bias, while the first downward anchors at 31 and 30 neighbors exposed the opposite locality-versus-stability trade-off. This next untested scale anchor keeps the residual location on 32 neighbors but estimates sigma = 1.4826 weighted_median(|e - m_32|) from the nearest 28, further preventing curvature- or asymmetric-density-inflated outer residuals from widening the Tukey cutoff and thin-sheet gate. Clean, stripe, and gradient may improve if scale locality dominates; low, medium, and high noise may regress because four fewer residuals make MAD less stable and can reduce effective covariance support. The cost is sorting four fewer values only for the third-pass MAD, with unchanged covariance support and eigendecomposition count. Ablate by setting THIRD_SCALE_COUNT to 32, exactly recovering the validated frontier estimator. The ordered quadratic-jet retry remains skipped because its prior prediction failure has no precise diagnostic to address.	original
252	2c5bc97c65ea9f56713f8e8dc92f1f3f691a81ff	17.324242		1.329	97.5	discard			baseline	Estimate the gated third-pass Tukey residual median from 32 neighbors and MAD scale from 24 neighbors	The third-pass residual median should remain stable on its retained 32-neighbor core, but curvature or asymmetric density near that core boundary can inflate the MAD, widen the Tukey rejection band, and make the thin-sheet gate overly permissive. The measured 28-neighbor scale improved clean, low-noise, medium-noise, and stripe conditions while only high noise and gradient regressed, so 24 is the next untested scale anchor in the same locality direction. Keep the residual location on 32 neighbors but compute sigma = 1.4826 weighted_median(|e - m_32|) from the nearest 24, then use that sigma for third-pass Tukey weights and gating. Clean, low-noise, medium-noise, and stripe conditions should improve if the measured 28-neighbor locality trend continues; high noise and gradient may regress because the smaller scale sample is less stable and can reduce effective covariance support. The cost is sorting eight fewer residuals only for the third-pass MAD, with unchanged covariance support and eigendecomposition count. Ablate by setting THIRD_SCALE_COUNT to 32, exactly recovering the validated frontier estimator.	original
