iteration	candidate_commit	dev_rmse	val_rmse	runtime_s	memory_mb	status	failure_stage	failure_message	complexity	description	rationale	source
220	4130a0374478e570787ef73c590d29f8e4e30580	17.315961		1.336	109.3	discard			baseline	Relax the third-refinement sheet-thickness gate from 0.10 to 0.15625 local radii	The gated third Tukey fit removes residual curvature, asymmetric-density, and outlier leverage, but the retained sigma / r_112 <= 0.10 boundary excludes moderately thick coherent sheets that can benefit from another robust correction. The measured 0.15 and 0.1625 thresholds both improved clean, low-noise, stripe, and gradient accuracy, with 0.1625 giving the best recent aggregate result, while 0.175 admitted enough noise-dominated patches to lose much of that gain; 0.15625 is the untested midpoint between the two best anchors and probes the apparent optimum without adding a mechanism. Those four geometry-sensitive conditions should improve, while medium and high noise may regress because more patches undergo redescending rejection and lose effective covariance support. The cost and runtime are unchanged. Ablate by restoring the threshold to 0.10, exactly recovering the validated frontier estimator; comparisons with 0.15 and 0.1625 isolate this parameter choice. The ordered quadratic-jet retry remains skipped because its prior prediction failure has no precise diagnostic to address.	original
221	25992998344f148925fae70a7a87ac1b077928bc	17.317878		1.349	97.4	discard			baseline	Relax the third-refinement sheet-thickness gate from 0.10 to 0.16875 local radii	The gated third Tukey fit removes residual curvature, asymmetric-density, and outlier leverage, but the retained sigma / r_112 <= 0.10 boundary excludes moderately thick coherent sheets that can benefit from another robust correction. The measured 0.1625 threshold gave the best aggregate development result in the recent gate sweep, whereas 0.175 admitted enough noise-dominated patches to lose part of that gain; 0.16875 is the untested midpoint between those anchors. Clean, low-noise, stripe, and gradient conditions should improve through additional robust refinement, while medium and high noise may regress because more patches undergo redescending rejection and lose effective covariance support. This changes one dimensionless scalar with no added runtime or asymptotic cost. Ablate by restoring the threshold to 0.10, exactly recovering the validated frontier estimator; comparisons with 0.1625 and 0.175 isolate the parameter choice. The ordered quadratic-jet retry remains skipped because its prior prediction failure has no precise diagnostic to address.	original
222	19cdbf7849fc2dead19e6bfd7832ecef5b042596	17.317114		1.351	113.5	discard			baseline	Relax the third-refinement sheet-thickness gate from 0.10 to 0.165625 local radii	The gated third Tukey fit removes residual curvature, asymmetric-density, and outlier leverage, but the retained sigma / r_112 <= 0.10 boundary excludes moderately thick coherent sheets that can benefit from another robust correction. The measured 0.1625 threshold gave the best aggregate development result in the recent sweep, whereas 0.16875 admitted enough noise-dominated patches to lose part of that gain; 0.165625 is the untested midpoint between those anchors. Clean, low-noise, stripe, and gradient conditions should improve through additional robust refinement, while medium and high noise may regress because more patches undergo redescending rejection and lose effective covariance support. This changes one dimensionless scalar with no added runtime or asymptotic cost. Ablate by restoring the threshold to 0.10, exactly recovering the validated frontier estimator; comparisons with 0.1625 and 0.16875 isolate the parameter choice. The ordered quadratic-jet retry remains skipped because its prior prediction failure has no precise diagnostic to address.	original
223	a15611e64cadbc50a89db5ece2013bdcbfbc5837	17.315156		1.349	97.5	discard			baseline	Relax the third-refinement sheet-thickness gate from 0.10 to 0.159375 local radii	The gated third Tukey fit removes residual curvature, asymmetric-density, and outlier leverage, but the retained sigma / r_112 <= 0.10 boundary excludes moderately thick coherent sheets that can benefit from another robust correction. The measured 0.1625 threshold produced the best aggregate development result in the recent sweep, while 0.15625 was slightly worse; 0.159375 is their untested midpoint and tests the lower side of that apparent optimum after the upper-side 0.165625 probe regressed. Clean, low-noise, stripe, and gradient conditions should improve through additional robust refinement, while medium and high noise may regress because more patches undergo redescending rejection and lose effective covariance support. This changes one dimensionless scalar with no added runtime or asymptotic cost. Ablate by restoring the threshold to 0.10, exactly recovering the validated frontier estimator; comparisons with 0.15625 and 0.1625 isolate the parameter choice. The ordered quadratic-jet retry remains skipped because its prior prediction failure has no precise diagnostic to address.	original
224	bf7defb4c1fc3f79d858c1851c1f3b1e166c26de	17.315522		1.384	97.4	discard			baseline	Relax the third-refinement sheet-thickness gate from 0.10 to 0.1609375 local radii	The gated third Tukey fit removes residual curvature, asymmetric-density, and outlier leverage, but the retained sigma / r_112 <= 0.10 boundary excludes moderately thick coherent sheets that can benefit from another robust correction. The measured 0.1625 threshold produced the best aggregate development result in the recent sweep, while 0.159375 was slightly worse; 0.1609375 is their untested midpoint and completes the lower-side bracket without adding a mechanism. Clean, low-noise, stripe, and gradient conditions should improve through additional robust refinement, while medium and high noise may regress because more patches undergo redescending rejection and lose effective covariance support. This changes one dimensionless scalar with no runtime or asymptotic cost. Ablate by restoring the threshold to 0.10, exactly recovering the validated frontier estimator; comparisons with 0.159375 and 0.1625 isolate this parameter choice. The ordered quadratic-jet retry remains skipped because its prior prediction failure has no precise diagnostic to address.	original
225	f342f815cefa0c206a3ea9f32ae0480906a2bdc0	17.344199		1.387	113.6	discard			baseline	Tighten the third-refinement sheet-thickness gate from 0.10 to 0.0875 local radii	The gated third Tukey fit removes residual curvature, asymmetric-density, and outlier leverage, but the retained sigma / r_112 <= 0.10 boundary can still classify unusually coherent noise-affected patches as thin sheets and apply another support-reducing refinement. The measured 0.075 threshold protected medium- and high-noise patches but rejected too many useful clean, low-noise, stripe, and gradient corrections; 0.0875 is the untested midpoint between that anchor and the validated 0.10 threshold. Medium and high noise should improve by retaining the two-step normal on more uncertain patches, while clean, low-noise, stripe, and gradient may regress because fewer third-step geometric corrections are accepted. This changes one dimensionless scalar with no runtime or asymptotic cost. Ablate by restoring the threshold to 0.10, exactly recovering the validated frontier estimator; comparison with 0.075 independently isolates the midpoint choice.	original
226	a6c1254054aee44960bb934d5045da2b4e81b844	17.337041		1.363	105.5	discard			baseline	Tighten the third-refinement sheet-thickness gate from 0.10 to 0.09375 local radii	The gated third Tukey fit removes curvature-, density-, and outlier-induced leverage on thin coherent sheets, but the retained sigma / r_112 <= 0.10 boundary can still admit unusually coherent noise-affected patches and apply another redescending refinement with reduced effective support. The measured 0.0875 midpoint improved medium and high noise but rejected too many useful clean, low-noise, stripe, and gradient corrections; 0.09375 is the untested midpoint between that anchor and the validated 0.10 threshold. Medium and high noise should improve by retaining the two-step normal on a smaller set of uncertain patches, while clean, low-noise, stripe, and gradient may regress slightly because fewer third-step geometric corrections are accepted, but less than at 0.0875. This changes one dimensionless scalar with no runtime or asymptotic cost. Ablate by restoring the threshold to 0.10, exactly recovering the validated frontier estimator; comparison with 0.0875 independently isolates the midpoint choice. The ordered quadratic-jet retry remains skipped because its prior prediction failure has no precise diagnostic to address.	original
227	5f2870698d518c9846edb5ca4a5dda6edbdd01eb	17.335149		1.369	113.6	discard			baseline	Tighten the third-refinement sheet-thickness gate from 0.10 to 0.096875 local radii	The gated third Tukey fit removes curvature-, density-, and outlier-induced leverage on thin coherent sheets, but the retained sigma / r_112 <= 0.10 boundary can still admit unusually coherent noise-affected patches and apply another redescending refinement with reduced effective support. The measured 0.09375 threshold improved medium and high noise but rejected enough useful clean, low-noise, stripe, and gradient corrections to worsen those conditions; 0.096875 is the untested midpoint between that anchor and the validated 0.10 threshold. Medium and high noise should improve by retaining the two-step normal on a small set of uncertain patches, while clean, low-noise, stripe, and gradient may regress slightly because fewer third-step geometric corrections are accepted, but less than at 0.09375. This changes one dimensionless scalar with no runtime or asymptotic cost. Ablate by restoring the threshold to 0.10, exactly recovering the validated frontier estimator; comparison with 0.09375 independently isolates the midpoint choice. The quadratic-jet batch item remains skipped because its prior prediction failure has no precise diagnostic to address.	original
228	7e41cd18bcaf5026f64769656a8714fcf364bfbf	17.331258		1.33	97.4	discard			baseline	Tighten the third-refinement sheet-thickness gate from 0.10 to 0.0984375 local radii	The gated third Tukey fit removes curvature-, density-, and outlier-induced leverage on thin coherent sheets, but the retained sigma / r_112 <= 0.10 boundary can still admit unusually coherent noise-affected patches and apply another redescending refinement with reduced effective support. The measured 0.096875 threshold improved medium and high noise but rejected enough useful clean, low-noise, stripe, and gradient corrections to worsen those conditions; 0.0984375 is the untested midpoint between that anchor and the validated 0.10 threshold. Medium and high noise should improve by retaining the two-step normal on a very small set of uncertain patches, while clean, low-noise, stripe, and gradient may regress slightly because fewer third-step geometric corrections are accepted, but less than at 0.096875. This changes one dimensionless scalar with no runtime or asymptotic cost. Ablate by restoring the threshold to 0.10, exactly recovering the validated frontier estimator; comparison with 0.096875 independently isolates the midpoint choice. The quadratic-jet batch item remains skipped because its prior prediction failure has no precise diagnostic to address.	original
229	37e197e1b712dc7aca887255f652d5cfa5af5ab2	17.33415		1.324	97.6	discard			low	Leave the query sample out of the gated third-pass residual location and scale statistics	The query is normally its own zero-distance neighbor and receives maximum Gaussian weight in the 32-neighbor residual statistic, even though its positional displacement is the noise source being diagnosed. This self-influence can make weighted median/MAD thickness appear artificially coherent and admit a support-reducing third Tukey refinement. Compute the third-pass weighted residual median and MAD over the same 32-neighbor core excluding only the query, while retaining the query and all 128 samples in the robust covariance. Medium and high noise should improve through less optimistic thin-sheet confidence; clean, low-noise, stripe, and gradient may regress if removing an exact surface sample destabilizes the statistic or rejects useful geometric corrections. The cost is one deterministic equality mask with no new fit or asymptotic work. Ablate by retaining the query's statistic weight, exactly recovering the frontier estimator. The ordered quadratic-jet retry remains skipped because its prior prediction failure has no precise diagnostic to address.	original
230	71c822942fa3d77f6b53f99eff77c0b42d6ad9e2	17.332469		1.492	103.3	discard			low	Exclude the query only from the third-refinement thin-sheet confidence statistic	The query is its own zero-distance neighbor and therefore has maximum Gaussian influence on the 32-neighbor residual thickness used to decide whether another redescending fit is safe, even though query displacement is part of the positional noise being diagnosed. The prior leave-query-out probe also changed the Tukey location and scale that form the third covariance and regressed clean, low-noise, high-noise, and gradient accuracy; this complementary ablation leaves that robust fit exactly unchanged and excludes the query only from an independently recomputed weighted median/MAD used by the acceptance gate. Medium and high noise should improve if self-influence was making confidence overly optimistic; clean, low-noise, stripe, and gradient may regress if the omitted surface sample makes confidence conservative and rejects useful curvature-, density-, or outlier-removing updates. The cost is one additional pair of 32-value weighted medians per query. Ablate by using the fit's existing robust_scale for the thin-sheet comparison, exactly recovering the frontier estimator.	original
231	fabb4e17367273b28542faaafa5f6aff9356744b	17.329494		1.375	97.4	discard			baseline	Give the query half weight only in the third-refinement thin-sheet confidence statistic	The query is normally its own zero-distance neighbor and has maximum Gaussian influence on the 32-neighbor residual thickness that decides whether a third redescending fit is safe, even though its positional displacement is part of the noise being diagnosed. Fully excluding it from only this confidence statistic improved medium-noise and stripe accuracy but made the gate too conservative for clean, low-noise, high-noise, and gradient patches. Multiplying only its confidence weight by 0.5 is the untested midpoint: it should reduce optimistic self-influence and improve medium noise and stripe while preserving more stable clean, low, high, and gradient decisions than exclusion. The Tukey fit itself remains unchanged and the cost is one additional pair of 32-value weighted medians per query. Ablate by setting QUERY_CONFIDENCE_WEIGHT to 1.0, exactly recovering the frontier estimator; setting it to 0 independently recovers the measured exclusion endpoint.	original
232	8bb7211ce4675b5b6ed67ad4e133fdea72d37fc3	17.329342		1.372	111.6	discard			low	Give the query three-quarter weight only in the third-refinement thin-sheet confidence statistic	The query is its own zero-distance neighbor and therefore has maximum influence on the 32-neighbor weighted-MAD thickness used to accept a third redescending fit, even though query displacement is part of the positional noise being diagnosed. Fully excluding it and the measured half-weight midpoint made confidence too conservative for clean, low-noise, high-noise, and gradient patches, while half weight still improved medium noise and stripe sampling. Using the untested midpoint 0.75 should retain a smaller reduction in optimistic self-influence, potentially improving medium noise and stripe with less regression on clean, low, high, and gradient conditions. The Tukey fit remains unchanged; only an independently recomputed gate statistic changes, at the cost of two additional 32-value weighted medians per query. Ablate by setting QUERY_CONFIDENCE_WEIGHT to 1.0, exactly recovering the frontier estimator; 0.5 independently recovers the preceding measured endpoint.	original
233	4e141b5d6f8a2a7d2c0349037e44cf669bca790e	17.329674		1.365	97.5	discard			baseline	Give the query seven-eighths weight only in the third-refinement thin-sheet confidence statistic	The query is its own zero-distance neighbor and therefore has maximum influence on the 32-neighbor weighted-MAD thickness used to accept a third redescending fit, even though query displacement is part of the positional noise being diagnosed. Full, half, and three-quarter query-weight probes establish a smooth confidence trade-off: reducing self-influence improves medium noise and stripe sampling, while too much reduction makes the gate conservative and regresses clean, high-noise, and gradient patches. The untested midpoint 0.875 should retain smaller medium-noise and stripe gains with less clean, high-noise, and gradient regression than 0.75. The Tukey fit itself remains unchanged; only an independently recomputed gate statistic changes, at the cost of two 32-value weighted medians per query. Ablate by setting QUERY_CONFIDENCE_WEIGHT to 1.0, exactly recovering the frontier estimator; 0.75 independently recovers the preceding endpoint.	original
234	3d8b713c400b114fffd7c60edffa74c3890d9238	17.329945		1.361	97.5	discard			baseline	Give the query fifteen-sixteenths weight only in the third-refinement thin-sheet confidence statistic	The query is its own zero-distance neighbor and therefore has maximum influence on the 32-neighbor weighted-MAD thickness used to accept a third redescending fit, even though query displacement is part of the positional noise being diagnosed. Full, one-half, three-quarter, and seven-eighths query-weight probes show a smooth trade-off: reducing self-influence improves low/medium noise and stripe sampling, but excessive reduction makes the gate conservative and regresses clean, high-noise, and gradient patches. The untested midpoint 15/16 should preserve smaller low/medium-noise and stripe gains while reducing the clean, high-noise, and gradient regressions seen at 7/8. The Tukey fit remains unchanged; only an independently recomputed confidence median and MAD change, costing two 32-value weighted-median sorts per query. Ablate by setting QUERY_CONFIDENCE_WEIGHT to 1.0, exactly recovering the frontier estimator; setting it to 0.875 independently recovers the preceding endpoint.	original
235	03fd82909fcb604b3f983789d503ea7010c5c264	17.320824		1.316	113.5	discard			baseline	Relax the third-refinement sheet-thickness gate from 0.10 to 0.1125 local radii	The gated third Tukey fit removes residual curvature, asymmetric-density, and outlier leverage, but the retained weighted-MAD thickness boundary sigma / r_112 <= 0.10 can reject moderately thick coherent sheets that would benefit from one more robust correction. The measured 0.125 boundary improved clean, low-noise, stripe, and gradient accuracy but slightly reduced medium/high-noise support, so 0.1125 is the untested midpoint that should recover part of those geometry-sensitive gains while admitting fewer noise-dominated patches than 0.125. Medium and high noise may still regress because accepted patches undergo another redescending fit. This changes one dimensionless scalar with no runtime or asymptotic cost. Ablate by restoring the threshold to 0.10, exactly recovering the validated frontier; comparison with 0.125 independently isolates the midpoint choice.	original
236	957eefcd336390c797ad1cc35204b383d0792286	17.327213		1.346	113.5	discard			baseline	Relax the third-refinement sheet-thickness gate from 0.10 to 0.10625 local radii	The gated third Tukey fit removes residual curvature, asymmetric-density, and outlier leverage, but the retained weighted-MAD thickness boundary sigma / r_112 <= 0.10 can reject slightly thicker coherent sheets that would benefit from one more robust correction. The measured 0.1125 boundary improved clean, low-noise, stripe, and gradient accuracy but slightly reduced medium/high-noise support, so 0.10625 is the untested midpoint intended to retain part of those geometry-sensitive gains while admitting fewer noise-dominated patches. Medium and high noise may still regress because accepted patches undergo another redescending fit, but less than at 0.1125. This changes one dimensionless scalar with no runtime or asymptotic cost. Ablate by restoring the threshold to 0.10, exactly recovering the validated frontier; comparison with 0.1125 independently isolates the midpoint choice. The ordered quadratic-jet retry remains skipped because its prior prediction failure has no precise diagnostic to address.	original
