iteration	candidate_commit	dev_rmse	val_rmse	runtime_s	memory_mb	status	failure_stage	failure_message	complexity	description	rationale	source
60	32047be7586e67a336063a8c19bd6b0470a2feb3	17.756779		1.49	93.9	discard			baseline	Narrow only the 160-neighbor final-refinement Gaussian bandwidth from the 112th- to the 108th-neighbor radius	The final 160-neighbor covariance needs broad support to average positional noise, but its 112th-neighbor Gaussian bandwidth gives curved or density-biased outer samples enough leverage to tilt the tangent. Narrowing to the measured 104th-neighbor radius improved clean, low-noise, stripe, and gradient conditions but regressed medium and high noise; 108 is the untested midpoint between that anchor and the retained 112 radius. Recomputing only the final Gaussian weights with the 108th-neighbor radius should recover part of the geometry-sensitive gain while sacrificing less noise averaging than 104. Medium and high noise may still regress slightly. The cost is one recomputed final weight vector with no new samples or eigendecomposition. Ablate by restoring the final bandwidth to the 112th-neighbor radius while retaining 160-point support and every robust-fit setting.	original
61	4cee2a9d92afb79d2a249e906c080d1b3f2381fc	17.733021		1.531	90.8	discard			baseline	Narrow only the 160-neighbor final-refinement Gaussian bandwidth from the 112th- to the 96th-neighbor radius	The final 160-neighbor covariance improves positional-noise averaging, but its 112th-neighbor Gaussian bandwidth gives curved or density-biased outer samples enough leverage to tilt the tangent. The measured 104th- and 108th-neighbor final-bandwidth probes improved clean, low-noise, stripe, and gradient conditions, with the stronger 104 setting producing the larger geometry-sensitive gains; 96 is the next untested final-pass locality anchor. Recomputing only the final distance weights as exp(-2 d^2 / r_96^2) retains all 160 samples as a decaying tail and leaves the broad initialization and first robust correction unchanged. Clean, low-noise, stripe, and gradient conditions should improve; medium and high noise may regress because tighter weights reduce effective averaging support. The cost is one final weight-vector computation with no new samples or eigendecomposition. Ablate by setting the final bandwidth count back to 112 while retaining 160-point support and every robust-fit setting.	original
62	bcaf7249ed96201c6d31cb2853a2eb6cadf6c95a	17.797892		1.462	105.4	discard			baseline	Reduce only the final robust PCA refinement from 160 to 144 neighbors	The retained progression from 112 to 128 to 160 final-fit neighbors improved medium and high noise through covariance averaging, but each support increase also worsened clean, low-noise, stripe, and gradient conditions through curvature and density bias. A 144-neighbor final support is the untested midpoint between the measured 128 and 160 anchors: after the first robust correction, neighbors 113 through 144 retain the fixed 112th-neighbor Gaussian bandwidth and Cauchy rejection, while the least local 16 samples are removed. Clean, low-noise, stripe, and gradient conditions should improve; medium and high noise may regress slightly because of reduced averaging. The change lowers final weighted-median and covariance work without adding a mechanism. Ablate by restoring final support to 160, exactly recovering the current frontier estimator.	original
63	16cfd28047eed9b8cff69c136734e47829f46132	17.778734		1.45	88.1	discard			baseline	Reduce only the final robust PCA refinement from 160 to 152 neighbors	The retained 160-neighbor final covariance improves medium- and high-noise averaging, but its outer tail can still introduce curvature and density bias on clean, low-noise, stripe, and gradient patches. The measured 144-neighbor probe removed too much support and substantially regressed both noisy conditions, so 152 is the untested midpoint between 144 and 160: after the first robust correction, it removes only the least local eight samples while retaining the fixed 112th-neighbor Gaussian bandwidth and Cauchy rejection. Clean, low-noise, stripe, and gradient conditions should improve modestly; medium and high noise may regress, but less than at 144. The change slightly reduces final weighted-median and covariance work and adds no mechanism. Ablate by restoring final support to 160 with every other setting unchanged.	original
64	43dd6f8568d877c80ed6fd14c672e7dc0b4ec4d6	17.739042		1.328	86.7	discard			low	Estimate the final-pass robust residual location and scale from the core 112-neighbor patch while retaining 160-neighbor covariance support	The final 160-neighbor tail improves medium- and high-noise averaging, but allowing those outer samples to set the weighted residual median and MAD can inflate or shift the Cauchy loss under curvature or density variation, increasing their own leverage. In the final refinement, estimate m and sigma = 1.4826 weighted_median(|e-m|) from the query-local 112-neighbor core, then apply 1 / (1 + ((e-m)/(1.5 sigma))^2) to all 160 residuals. This preserves the measured noise benefit of broad covariance support while making its robust reference distribution local. Clean, low-noise, stripe, and gradient conditions should improve; medium and high noise may regress if the core scale is less stable and excessively rejects valid tail samples. The cost is only slicing existing arrays, with unchanged sorts, covariance size, and eigendecomposition count. Ablate by computing the final median and MAD from all 160 residuals, exactly recovering the frontier estimator.	original
65	553567f48aef67d6bc48b208edff9a39da588f7a	17.749163		1.384	90.3	discard			low	Estimate final-pass Cauchy location and scale from 128 core neighbors while retaining 160-neighbor covariance support	The final 160-neighbor tail improves medium- and high-noise averaging, but allowing every tail sample to define the weighted residual median and MAD can shift or inflate the robust reference distribution under curvature or density variation. The prior 112-core probe improved clean, low-noise, stripe, and gradient conditions but slightly regressed medium and high noise, so 128 is the next untested locality anchor between the overly local 112 core and the retained 160-point statistic. In the final refinement, compute m and sigma = 1.4826 weighted_median(|e-m|) from the nearest 128 residuals, then apply the resulting Cauchy weights to all 160 covariance samples. Clean, low, stripe, and gradient should improve through reduced tail bias; medium and high may regress slightly if the smaller statistic set rejects valid noisy tail samples. The cost is only array slicing. Ablate by setting the statistic count to 160, exactly recovering the frontier estimator.	original
66	4722bdc364df6b13b1e47413a59bcd0bdaca19a0	17.725096		1.314	86.8	discard			low	Estimate final-pass Cauchy location and scale from 96 core neighbors while retaining 160-neighbor covariance support	The final 160-neighbor Gaussian tail improves medium- and high-noise averaging, but outer samples affected by curvature or density variation can shift or inflate their own robust reference distribution. The 112- and 128-core probes both improved clean, low-noise, stripe, and gradient accuracy, with the more local 112 core giving larger geometry-sensitive gains; 96 is the next untested locality anchor. In the final refinement, compute m and sigma = 1.4826 weighted_median(|e-m|) from the nearest 96 residuals, then apply the resulting Cauchy weights to all 160 covariance samples. Clean, low, stripe, and gradient should improve through reduced tail bias; medium and high may regress because the smaller core gives a noisier scale and can reject valid tail samples. The cost is only array slicing, with unchanged covariance support and eigendecomposition count. Ablate by setting the statistic count to 160, exactly recovering the frontier estimator.	original
67	ba00b1bdf2b282395cccb046e45c9944e844b41d	17.707436	14.994009	1.274	101.9	discard			baseline	Estimate final-pass Cauchy location and scale from 80 core neighbors while retaining 160-neighbor covariance support	The final 160-neighbor Gaussian tail improves medium- and high-noise averaging, but curved or density-biased outer samples can shift and inflate the robust residual distribution that determines their own Cauchy leverage. The measured 128-, 112-, and 96-core probes all improved clean, low-noise, stripe, and gradient conditions, with the 96-core anchor giving the largest geometry-sensitive and aggregate development gains; 80 is the next untested locality anchor. In the final refinement, compute the Gaussian-weighted residual median m and scale 1.4826 weighted_median(|e-m|) from the nearest 80 samples, then apply the resulting Cauchy weights to all 160 covariance samples. Clean, low-noise, stripe, and gradient should improve through lower curvature and neighborhood bias; medium and high noise may regress because the smaller core gives a noisier scale and can reject valid tail samples. The cost is only slicing existing arrays, with unchanged covariance support and eigendecomposition count. Ablate by setting the final statistic count to 160, exactly recovering the frontier estimator.	original
68						crash	quality.ruff-fix	Ruff exited with status 1	low	Shrink the final robust local normal 10% toward the sign-aligned broad provisional PCA normal	The retained 112-neighbor robust fit is query-local but remains variance-limited under medium and high positional noise, whereas the existing 224-neighbor provisional PCA averages noise more effectively but is biased by curvature and asymmetric density. After both robust refinements, return normalize(0.9 n_local + 0.1 sign(n_local dot n_broad) n_broad), a fixed two-scale shrinkage that transfers a small amount of broad-scale stability without allowing the broad fit to replace the local tangent. Medium and high noise should improve; clean, low-noise, stripe, and gradient conditions may regress slightly from broad-neighborhood bias. The cost is one dot product, vector blend, and normalization per query. Ablate by setting the blend coefficient to zero, exactly recovering the retained estimator.	original
69	9a09dc05202e1f903bbe1cf361c4721dba18bb2e	17.866365		1.256	80.5	discard			low	Blend 10% of the sign-aligned 224-neighbor provisional PCA normal into the final local robust normal	The final 112-neighbor robust tangent is query-local but variance-limited under medium and high positional noise, while the existing 224-neighbor provisional PCA normal averages noise over more samples but carries curvature and density bias. Return the normalized vector 0.9 n_local + 0.1 sign(n_local dot n_broad) n_broad, transferring a small fixed amount of broad-scale stability without allowing the broad estimate to replace the robust tangent. Medium and high noise should improve; clean, low-noise, stripe, and gradient conditions may regress slightly because of broad-neighborhood bias. The cost is one batched dot product, blend, and normalization. Ablate independently by setting the blend coefficient to zero, exactly recovering the frontier estimator.	original
70	d84a52920d1715a5e1c0063c25880de5f7749871	17.910922		1.326	85.5	discard			low	Use an area-preserving anisotropic Gaussian kernel for both robust local PCA refinements	A circular query-distance kernel can cross a narrow feature or undersampled tangent direction when the local surface support is elongated, letting curvature or directional density bias tilt the fitted plane. The broad provisional PCA supplies tangent variances lambda_1 and lambda_2; this change measures refinement distance with d_A^2 = z^2 + sqrt(lambda_1 lambda_2) (x^2 / lambda_1 + y^2 / lambda_2). The tangent metric has determinant one, exactly reduces to Euclidean distance for isotropic support, and narrows the kernel across the short patch direction while preserving support along its long direction. Clean, low-noise, stripe, and gradient conditions should improve through reduced neighborhood bias; medium and high noise may regress if anisotropy lowers effective support or is estimated unreliably. The cost is one projection and anisotropic weight vector per query, with no additional eigendecomposition. Ablate by replacing d_A^2 with the cached Euclidean squared distance, exactly recovering the frontier refinement kernel.	original
71						crash	quality.ruff-fix	Ruff exited with status 1	low	Apply the area-preserving anisotropic Gaussian kernel only in the final robust PCA refinement	The measured anisotropic-kernel probe reduced clean, low-noise, stripe, and gradient error but harmed medium and high noise when anisotropy was used in both robust passes, suggesting that an unreliable broad provisional frame corrupted the first refinement. This staged change keeps the first 112-neighbor Cauchy correction exactly isotropic, then computes the final kernel in that corrected PCA frame as d_A^2 = z^2 + sqrt(lambda_1 lambda_2)(x^2/lambda_1 + y^2/lambda_2). The determinant-one tangent metric narrows support across an elongated patch without changing its area, targeting curvature and directional density bias only after the normal has been robustly corrected. Clean, low, stripe, and gradient conditions should improve; medium and high noise may regress if the corrected tangent anisotropy remains unstable. The cost is one projection and weight-vector recomputation, with no extra eigendecomposition. Ablate by retaining the isotropic cached distance weights in the final pass, exactly recovering the frontier estimator.	original
72	1e62941c44cd482541a81ce969fa55686160a4cc	18.064942		1.302	88.8	discard			low	Apply an area-preserving anisotropic Gaussian kernel only in the final robust PCA refinement	A circular distance kernel can cross narrow features or overrepresent a densely sampled tangent direction, producing curvature and directional-density bias. The prior two-pass anisotropic probe improved clean, low-noise, stripe, and gradient conditions but regressed medium and high noise, suggesting that anisotropy from the broad provisional frame was unreliable; the final-only hypothesis previously failed at linting and was never measured. This change keeps the first robust correction isotropic, then uses its corrected PCA frame and tangent variances to measure d_A^2 = z^2 + sqrt(lambda_1 lambda_2)(x^2/lambda_1 + y^2/lambda_2) for the final Gaussian kernel. The determinant-one tangent metric narrows support across an elongated patch without changing kernel area. Clean, low-noise, stripe, and gradient conditions should improve; medium and high noise may regress if corrected-frame anisotropy still reduces effective support. The cost is one local projection and kernel recomputation, with no extra eigendecomposition. Ablate by retaining the isotropic distance weights in the final pass, exactly recovering the frontier estimator.	original
73	86ff2a9fee3332b97d9f05491127c5823fe7f2b7	17.812142	14.850593	1.272	80.5	keep			low	Replace Cauchy residual weights with matched Tukey-biweight rejection in both robust PCA refinements	The retained Cauchy loss bounds but never removes the leverage of points far from the local surface sheet, so sparse outliers, curvature from another sheet, or severe density-biased boundary samples can still tilt both robust covariances. Use Tukey weights w(u) = (1 - u^2)^2 for |u| < 1 and zero otherwise. Cutoffs 4.62 and 2.77 are chosen so each pass reaches half weight at approximately the same residual as the retained Cauchy cutoffs 2.5 and 1.5, isolating redescending rejection rather than arbitrarily tightening the loss. Clean, low-noise, stripe, and gradient conditions should improve through lower geometric leverage; medium and high noise may regress because widespread valid residuals can be rejected completely. The covariance and eigendecomposition counts are unchanged, with only a mask added. Ablate by restoring the Cauchy formula and cutoffs in both passes, exactly recovering the frontier estimator.	https://doi.org/10.1080/00401706.1974.10489171
74	b6e4653e7a80400977d89c8ed7dc6affc0ca481c	17.775517		1.296	89.6	discard			medium	Use Cauchy reweighting for the first robust PCA correction and Tukey rejection only for the final refinement	Applying redescending Tukey weights directly to residuals from the broad provisional plane improved clean, low-noise, stripe, and gradient accuracy but regressed medium and high noise, where an uncertain initial normal can classify valid samples beyond the cutoff and discard them completely. Keep the matched 2.5-sigma Cauchy loss in the first refinement so every sample retains bounded influence while the plane is corrected, then apply the retained 2.77-sigma Tukey biweight only to residuals from that corrected plane, where zeroing extreme residuals more reliably targets outliers, curvature, and density-biased boundary points. Medium and high noise should recover through greater first-pass support; clean, low-noise, stripe, and gradient may regress slightly if first-pass geometric leverage biases the corrected plane, but final redescending rejection should preserve part of the frontier gain. The fit count and asymptotic cost are unchanged. Ablate by replacing the first-pass Cauchy weights with the retained 4.62-sigma matched Tukey weights, exactly recovering the current frontier.	original
75	555dfc003adf9dbcedc57782a07208a2708cb27c	17.92221		1.325	80.5	discard			baseline	Relax only the first Tukey-biweight cutoff from 4.62 to 5.54 weighted-MAD sigmas	The retained redescending fit improves clean, low-noise, stripe, and gradient patches by eliminating extreme geometric leverage, but it regresses medium and high noise because residuals from the broad provisional plane are still uncertain and valid noisy samples can be rejected in the first refinement. Raising only the first Tukey cutoff from 4.62 to 5.54 moves its half-weight residual from about 2.5 to 3.0 scale sigmas and its zero-weight boundary from 4.62 to 5.54 sigmas, preserving more support while the plane is corrected; the final 2.77-sigma Tukey pass remains strict after that correction. Medium and high noise should improve, while clean, low, stripe, and gradient may regress slightly if curvature-, density-, or outlier-induced residuals gain first-pass leverage. This changes one scalar with no runtime or asymptotic cost. Ablate by restoring the first cutoff to 4.62 while leaving the final cutoff and all computations unchanged.	original
76	7ab1debba5109e131ad14daa081657e7d27c643c	17.907287		1.277	90.7	discard			baseline	Relax only the final Tukey-biweight cutoff from 2.77 to 3.69 weighted-MAD sigmas	The retained redescending fit improves clean, low-noise, stripe, and gradient patches, but its strict final Tukey pass can completely reject widespread valid residuals under medium and high positional noise even after the plane has been corrected. Raising only the final cutoff from 2.77 to 3.69 moves the half-weight residual from approximately 1.5 to 2.0 robust-scale sigmas while leaving the first-pass cutoff and zero-leverage property unchanged. Medium and high noise should improve through greater final covariance support; clean, low, stripe, and gradient conditions may regress because curvature-, density-, or outlier-induced residuals retain more leverage. This changes one scalar with no runtime or asymptotic cost. Ablate by restoring the final cutoff to 2.77 while leaving the first cutoff and all computations unchanged.	original
77	524ac98c2d9db6f0ca8de36ab82ecc31dfc8f262	17.772818		1.3	80.2	discard			baseline	Tighten only the final Tukey-biweight cutoff from 2.77 to 1.85 weighted-MAD sigmas	Residuals from the first redescending refinement are measured against a corrected local plane, so moderate curvature-, asymmetric-density-, and outlier-induced deviations can be rejected more confidently in the final covariance. The prior relaxation of this cutoff to 3.69 worsened every condition, motivating the untested opposite direction: 1.85 places Tukey's half-weight point at approximately one robust-scale sigma instead of 1.5 while leaving the first pass unchanged. Clean, low-noise, stripe, and gradient conditions should improve through lower geometric leverage; medium and high noise may regress if widespread valid residuals are removed, although the failed relaxation suggests extra support was not beneficial. This changes one scalar with no runtime or asymptotic cost. Ablate by restoring the final cutoff to 2.77 with every other computation unchanged.	original
78	db286f5bf819dbcbb49025d6f074cbef9dd586cc	17.781557		1.278	93.4	discard			baseline	Tighten only the final Tukey-biweight cutoff from 2.77 to 2.31 weighted-MAD sigmas	The final covariance can still be tilted by moderate curvature-, asymmetric-density-, or outlier-induced residuals after the first robust correction. Lowering only the final Tukey cutoff from 2.77 to 2.31 moves its zero-weight boundary inward and therefore removes moderate geometric leverage more aggressively while leaving initialization and the first refinement unchanged. The measured 1.85 cutoff improved clean, medium, high, and gradient conditions but regressed low noise and stripe, whereas relaxing to 3.69 worsened every condition; 2.31 is the untested midpoint intended to retain the strict cutoff's medium/high and geometry gains with less loss on low and stripe. This changes one scalar with no runtime or asymptotic cost. Ablate by restoring the final cutoff to 2.77 with every other computation unchanged.	original
