iteration	candidate_commit	dev_rmse	val_rmse	runtime_s	memory_mb	status	failure_stage	failure_message	complexity	description	rationale	source
202	a4c246e9cfd8e7fee6daebed131e002aeefc5619	17.32966		1.336	113.5	discard			medium	Require the thin-sheet third Tukey refinement to retain at least one quarter of its Gaussian spatial weight mass	The retained thickness gate can still admit a noise-affected patch whose third redescending loss collapses onto a small spatially weighted subset, making its covariance unstable. Before normalization, sum_i w_gaussian,i w_Tukey,i is the fraction of the established spatial kernel retained by rejection. The measured 0.5 threshold improved low-, medium-, and high-noise conditions but rejected too many useful curvature-, density-, and outlier-removing updates on clean, stripe, and gradient patches. Requiring only 0.25 is the next untested support anchor: it should reject severe collapse and modestly improve the three noisy conditions while preserving more geometry-sensitive corrections than 0.5; clean, stripe, and gradient may still regress when useful corrections use sparse inliers. The cost is retaining the weight sum already needed for normalization and one comparison per query. Ablate by removing the retained-mass condition, exactly recovering the validated thickness-only gate; compare independently with 0.5 to isolate the threshold relaxation.	original
203	e35fe6dece7d916a100c60626e5091a61f746817	17.329801		1.323	97.5	discard			low	Require the thin-sheet third Tukey refinement to retain at least three eighths of its Gaussian spatial weight mass	The retained thickness gate can admit a noise-affected patch whose third redescending loss keeps too little spatially weighted support for a stable covariance. The pre-normalization mass sum_i w_G,i w_T,i directly measures the fraction of the established Gaussian kernel surviving Tukey rejection. A measured 0.50 gate improved low-, medium-, and high-noise conditions but rejected too many useful clean, stripe, and gradient corrections, while 0.25 had no numerical effect; the untested midpoint 0.375 should reject moderate support collapse and recover some noisy-condition accuracy with less geometry-sensitive regression than 0.50. The cost is retaining the already-computed normalization sum and one comparison per query. Ablate by removing the retained-mass condition, exactly recovering the validated thickness-only gate; comparisons with 0.25 and 0.50 isolate the threshold.	original
204	05596a5eef51b7f1d7443b0db6dcff365cd8a686	17.333353		1.307	103.8	discard			baseline	Require the thin-sheet third Tukey refinement to retain at least seven sixteenths of its Gaussian spatial weight mass	The thin-sheet gate can accept a noise-affected third refinement after redescending rejection has removed too much spatial support for a stable covariance. The pre-normalization mass sum_i w_G,i w_T,i measures the fraction of the established Gaussian kernel retained by Tukey rejection. A 0.50 threshold improved low-, medium-, and high-noise conditions but rejected too many useful clean, stripe, and gradient corrections; 0.375 had only tiny effects and did not recover high-noise accuracy. The untested midpoint 0.4375 should reject more moderately collapsed fits than 0.375 and improve low, medium, and high noise, while causing smaller clean, stripe, and gradient regressions than 0.50. This changes one scalar and reuses the normalization sum, so runtime and asymptotic cost are unchanged. Ablate by setting the threshold to zero, exactly recovering the validated thickness-only gate; comparisons with 0.375 and 0.50 isolate the parameter.	original
205	0c482f0e16e175a64a20333acd64704515ad745c	17.343442		1.344	113.5	discard			low	Require the thin-sheet third Tukey refinement to retain at least fifteen thirty-seconds of its Gaussian spatial weight mass	The retained thickness gate can accept a noise-affected third refinement after redescending Tukey rejection has removed too much spatial support for a stable covariance. Before normalization, sum_i w_G,i w_T,i is the fraction of the established Gaussian kernel retained by the robust fit. Measured thresholds of 0.4375 and 0.50 bracket the trade-off: 0.4375 modestly improved medium noise but not high noise, while 0.50 improved low, medium, and high noise at a larger clean, stripe, and gradient cost. Requiring the untested midpoint 0.46875 should reject more support-collapsed fits than 0.4375 and improve the noisy conditions, while preserving more useful curvature-, density-, and outlier-removing corrections than 0.50. The cost is one scalar comparison using the weight sum already needed for normalization. Ablate by setting the minimum retained mass to zero, exactly recovering the validated thickness-only gate; comparisons with 0.4375 and 0.50 isolate the threshold.	original
206	f18ebb51f12b32add1dfe839786c2e27f28fbae2	17.347649		1.349	97.5	discard			low	Require the thin-sheet third Tukey refinement to retain at least 31/64 of its Gaussian spatial weight mass	A thin residual sheet can still be noise-affected when Tukey rejection collapses the third fit onto too little spatial support, making its covariance unstable. Before normalization, sum_i w_G,i w_T,i is the fraction of the established Gaussian kernel retained by the redescending fit. Measured thresholds 0.46875 and 0.50 bracket the trade-off: both improved low, medium, and high noise, while 0.50 caused larger clean, stripe, and gradient regressions. The untested midpoint 0.484375 should reject more support-collapsed fits than 0.46875 and improve low-, medium-, and high-noise conditions; clean, stripe, and gradient may regress as useful curvature-, density-, and outlier-removing corrections are rejected, but less than at 0.50. The cost is one scalar comparison using the normalization sum already computed. Ablate by setting the minimum retained mass to zero, exactly recovering the validated thickness-only gate; compare independently with 0.46875 and 0.50 to isolate the threshold.	original
207	2fd849db08c34f7a4d7219d57e5ce7f065e058c3	17.374089		1.317	97.3	discard			medium	Use bounded-influence Cauchy weighting instead of redescending Tukey rejection only in the gated third refinement	The retained thin-sheet third refinement improves clean, low-noise, stripe, and gradient geometry, but repeated Tukey rejection can collapse covariance support and slightly harm medium and high noise. Keep the broad initialization, first two Tukey corrections, residual statistics, and thickness gate unchanged, but replace only the accepted third pass by Cauchy weights 1 / (1 + u^2) with cutoff 1.5 weighted-MAD sigmas. Tukey's retained 2.77 cutoff was chosen to reach half weight at the same approximately 1.5-sigma residual, so this isolates redescending zero-weight rejection from bounded influence: every sample retains finite support while large curvature-, density-, and outlier-induced residuals remain downweighted. Medium and high noise should improve through greater effective covariance support; clean, low-noise, stripe, and gradient may regress if extreme geometric residuals regain leverage. The fit count is unchanged and the cost is slightly lower mask arithmetic. Ablate by restoring the 2.77-sigma Tukey formula only in the third pass, exactly recovering the validated estimator.	original
208	903ed07b1d34b6ab335a307599d629d7e0ad3d1b	17.41		1.32	102.8	discard			low	Mix 5% unrejected Gaussian support into only the gated third Tukey refinement	The retained thin-sheet third pass improves clean, low-noise, stripe, and gradient geometry, but redescending Tukey weights become exactly zero for large residuals and can leave its covariance under-supported at medium and high noise. In only that pass, use w = w_G [0.95 w_T + 0.05], an epsilon-contamination mixture that preserves Tukey's strong curvature-, density-, and outlier-rejection contrast while guaranteeing every spatially local sample a small covariance contribution. The latest matched Cauchy replacement improved medium and high noise but excessively restored geometric leverage; this smaller 5% floor should recover part of that noise support with less regression on clean, low, stripe, and gradient conditions. The fit count and asymptotic cost are unchanged, adding one affine weight operation. Ablate by setting THIRD_GAUSSIAN_WEIGHT_MIX to zero, exactly recovering the validated Tukey third pass.	original
209	abd254fbf6781437751ed8b02380155abc02ec06	17.326065		1.321	104.8	discard			low	Use a linear compact-support residual taper only in the gated third robust refinement	The thin-sheet third fit benefits clean, low-noise, stripe, and gradient patches by rejecting curvature-, density-, and outlier-induced residuals, but its squared Tukey profile can collapse covariance support and slightly harm medium/high noise. Keep the established cutoff and zero weight outside it, but use w(u) = max(1 - u^2, 0) rather than (1 - u^2)^2 only in the third pass. This preserves complete rejection of extreme geometric contamination while giving moderate in-cutoff residuals more influence; unlike the rejected Cauchy and Gaussian-floor probes, it never restores samples beyond the redescending boundary. Medium and high noise should improve through greater effective support, while clean, low-noise, stripe, and gradient may regress if moderate curvature or density bias regains leverage. The fit count and asymptotic cost are unchanged. Ablate by squaring the third-pass compact profile again, exactly recovering the validated estimator.	original
210	d53abeffbccbe3aac443f97f9e184ec5180892dd	17.327167		1.368	96.5	discard			baseline	Use a three-halves compact-support residual taper only in the gated third robust refinement	The thin-sheet third refinement needs redescending rejection for curvature, density bias, and outliers, but the retained squared Tukey profile can reduce effective covariance support. The measured linear compact profile improved clean, low-noise, and gradient accuracy but slightly regressed medium noise, high noise, and stripe sampling; using w(u) = max(1 - u^2, 0)^(3/2) is the untested midpoint between that linear taper and the retained squared taper. It preserves the same finite rejection boundary and zero leverage for extreme residuals while giving moderate in-cutoff samples more support than Tukey. Clean, low-noise, and gradient conditions should retain part of the linear taper's gains, while medium, high, and stripe should regress less; curvature-biased moderate residuals may still gain leverage. The fit count and asymptotic cost are unchanged. Ablate by setting the third-pass exponent back to 2, exactly recovering the validated estimator; exponent 1 independently recovers the measured linear profile.	original
211	f1026fd94e09c6b3bd025d5008ce8894789d5a47	17.32831		1.38	113.7	discard			baseline	Use a seven-fourths compact-support residual taper only in the gated third robust refinement	The thin-sheet third refinement needs redescending rejection to suppress curvature-, density-, and outlier-induced residuals, but the retained squared Tukey profile can reduce effective covariance support. The measured linear and three-halves profiles both improved clean, low-noise, and gradient accuracy while slightly regressing medium noise, high noise, and stripe sampling; using w(u) = max(1 - u^2, 0)^(7/4) is the next untested midpoint between the three-halves probe and the retained squared taper. It preserves the same finite rejection boundary and zero leverage for extreme residuals while restoring less moderate-residual support than the three-halves profile. Clean, low-noise, and gradient conditions should retain smaller gains, while medium, high, and stripe should regress less; moderate curvature-biased residuals may still gain leverage. The only added cost is a fractional power in the already-computed third fit. Ablate by setting THIRD_TUKEY_EXPONENT back to 2, exactly recovering the validated estimator; setting it to 1.5 independently recovers the preceding probe.	original
212	87df8adef76e0b818cf8426ce85f13935c2fbc0d	17.328965		1.481	97.4	discard			baseline	Use a fifteen-eighths compact-support residual taper only in the gated third robust refinement	The thin-sheet third refinement needs redescending rejection to suppress curvature-, density-, and outlier-induced residuals, but the retained squared Tukey profile can reduce effective covariance support. The measured exponents 1, 1.5, and 1.75 improved clean, low-noise, and gradient accuracy, while the latest 1.75 probe also preserved stripe accuracy and left only small medium/high-noise regressions. Using w(u) = max(1 - u^2, 0)^(15/8) is the next untested midpoint between 1.75 and the retained exponent 2. It preserves the same finite rejection boundary and zero leverage for extreme residuals while restoring less moderate-residual support than 1.75. Clean, low-noise, stripe, and gradient should retain smaller gains; medium and high noise should regress less, though moderate curvature-biased residuals may regain leverage. The cost is one fractional power in the existing third fit. Ablate by setting THIRD_TUKEY_EXPONENT to 2, exactly recovering the validated estimator; 1.75 independently recovers the preceding probe.	original
213	0ecd198a7f3706b0a827373a3c207626f717a490	17.329308		1.37	113.6	discard			baseline	Use a 31/16 compact-support residual taper only in the gated third robust refinement	The thin-sheet third refinement needs redescending rejection to suppress curvature-, density-, and outlier-induced residuals, but the retained squared Tukey profile can slightly reduce effective covariance support. The measured exponents 1.75 and 1.875 improved clean, low-noise, stripe, and gradient accuracy while causing progressively smaller medium/high-noise regressions as the exponent approached 2. Using w(u) = max(1 - u^2, 0)^(31/16) is the next untested midpoint between 1.875 and the retained exponent 2. It preserves the same finite rejection boundary and zero leverage for extreme residuals while restoring less moderate-residual support than 1.875. Clean, low-noise, stripe, and gradient should retain smaller gains; medium and high noise should regress less, though moderate curvature-biased residuals may regain leverage. The cost is one fractional power in the existing third fit. Ablate by setting THIRD_TUKEY_EXPONENT to 2, exactly recovering the validated estimator; setting it to 1.875 independently recovers the preceding probe.	original
214	633c381bb0f7f28e01f61c7f2d69c1b0d08e04cf	17.329483		1.334	97.5	discard			baseline	Use a 63/32 compact-support residual taper only in the gated third robust refinement	The thin-sheet third refinement needs redescending rejection to suppress curvature-, density-, and outlier-induced residuals, but the retained squared Tukey profile can slightly reduce effective covariance support. Measured exponents 1.75, 1.875, and 1.9375 progressively approached the retained exponent 2: each gave small clean, low-noise, stripe, and gradient gains, while its medium/high-noise regressions shrank. Using w(u) = max(1 - u^2, 0)^(63/32) is the next untested midpoint between 31/16 and 2. It keeps the same finite rejection boundary and zero leverage for extreme residuals while giving moderate in-cutoff samples only slightly more support than Tukey. Clean, low-noise, stripe, and gradient should retain very small gains; medium and high noise may regress slightly, but less than at 31/16. The cost is one fractional power in the existing third fit. Ablate by restoring THIRD_TUKEY_EXPONENT to 2; setting it to 31/16 independently recovers the preceding probe.	original
215	e527743a4c14e1a5766d431d36c218b986c39498	17.329571		1.367	113.7	discard			baseline	Use a 127/64 compact-support residual taper only in the gated third robust refinement	The thin-sheet third refinement needs redescending rejection to suppress curvature-, density-, and outlier-induced residuals, but the retained squared Tukey profile can slightly reduce effective covariance support. Measured exponents 1.875, 1.9375, and 1.96875 progressively approached the retained exponent 2: each gave small clean, low-noise, stripe, and gradient gains, while medium/high-noise regressions shrank. Using w(u) = max(1 - u^2, 0)^(127/64) is the next untested midpoint between 63/32 and 2. It preserves the same finite rejection boundary and zero leverage for extreme residuals while giving moderate in-cutoff samples only minimally more support than Tukey. Clean, low-noise, stripe, and gradient should retain very small gains; medium and high noise may regress slightly, but less than at 63/32. The cost is one fractional power in the existing third fit. Ablate by restoring THIRD_TUKEY_EXPONENT to 2; setting it to 63/32 independently recovers the preceding probe.	original
216	6a8d162f8fc348ad3c713aac059af33aa220e6a5	17.329615		1.339	105.5	discard			baseline	Use a 255/128 compact-support residual taper only in the gated third robust refinement	The thin-sheet third refinement needs redescending rejection to suppress curvature-, density-, and outlier-induced residuals, but the retained squared Tukey profile can slightly reduce effective covariance support. Measured exponents from 1.75 through 127/64 gave progressively smaller clean, low-noise, stripe, and gradient gains and progressively smaller medium/high-noise regressions as they approached 2. Using w(u) = max(1 - u^2, 0)^(255/128) is the next untested midpoint between 127/64 and the retained exponent 2. It preserves the same finite rejection boundary and zero leverage for extreme residuals while giving moderate in-cutoff samples only minimally more support than Tukey. Clean, low-noise, stripe, and gradient should retain extremely small gains; medium and high noise may regress extremely slightly, but less than at 127/64. The cost is one fractional power in the existing third fit. Ablate by restoring THIRD_TUKEY_EXPONENT to 2; setting it to 127/64 independently recovers the preceding probe. The quadratic-jet batch item remains deferred because its prior prediction failure has no precise diagnostic to address.	original
217	3e8f054a256df69c900f65e37875ce9e82f2c56c	17.336571		1.348	97.5	discard			baseline	Relax the third-refinement sheet-thickness gate from 0.10 to 0.20 local radii	The gated third Tukey fit removes residual curvature, asymmetric-density, and outlier leverage, but the retained sigma / r_112 <= 0.10 boundary excludes moderately thick coherent sheets that may still benefit from another robust correction. The measured relaxations to 0.125 and 0.15 improved the aggregate development score and the clean, low-noise, stripe, and gradient conditions, so 0.20 is the next untested simple scale anchor in that supported direction. Accepting the already-computed third normal when sigma / r_112 <= 0.20 should improve those geometry-sensitive conditions; medium and high noise may regress because more noise-dominated patches undergo redescending rejection and lose effective covariance support. This changes one dimensionless scalar with no additional computation. Ablate by restoring the threshold to 0.10, exactly recovering the validated frontier estimator.	original
218	ba8cf3b98c457046ecfd303380f0f263d722e31b	17.320524		1.394	113.6	discard			baseline	Relax the third-refinement sheet-thickness gate from 0.10 to 0.175 local radii	The gated third Tukey fit removes residual curvature, asymmetric-density, and outlier leverage, but the retained sigma / r_112 <= 0.10 boundary excludes moderately thick coherent sheets that can benefit from another robust correction. Thresholds 0.125 and 0.15 improved clean, low-noise, stripe, and gradient accuracy, whereas 0.20 crossed the trade-off and worsened the aggregate score; 0.175 is the untested midpoint between the best measured relaxed anchor and 0.20. Accepting the already-computed third normal when sigma / r_112 <= 0.175 should recover additional geometry-sensitive corrections without admitting as many noise-dominated patches as 0.20. Clean, low-noise, stripe, and gradient conditions should improve; medium and high noise may regress because more patches undergo redescending rejection and lose effective covariance support. This changes one dimensionless scalar with no additional computation. Ablate by restoring the threshold to 0.10, exactly recovering the validated frontier estimator.	original
219	3a3fa39eb6c5d78f6bfaf1a2cd6af136acdf3a92	17.314503		1.324	98.5	discard			baseline	Relax the third-refinement sheet-thickness gate from 0.10 to 0.1625 local radii	The gated third Tukey fit removes residual curvature, asymmetric-density, and outlier leverage, but the retained sigma / r_112 <= 0.10 boundary excludes moderately thick coherent sheets that can benefit from another robust correction. The measured 0.15 threshold gave the best development score in the recent relaxation sweep, while 0.175 admitted enough noise-dominated patches to lose part of that gain; 0.1625 is the untested midpoint that tests whether a modest extension beyond 0.15 captures more useful geometric corrections without crossing that trade-off. Clean, low-noise, stripe, and gradient conditions should improve through additional robust refinement, while medium and high noise may regress because more patches undergo redescending rejection and lose effective covariance support. This changes one dimensionless scalar with no added computation. Ablate by restoring the threshold to 0.10, exactly recovering the validated frontier estimator; comparison with 0.15 and 0.175 isolates the parameter choice. The ordered quadratic-jet retry remains skipped because its prior prediction failure has no precise diagnostic to address.	original
